2023.07.06;15:29:43;AI Doktor;Willkommen, Sie sprechen jetzt mit einem KI-Arzt. Da ich Teil eines wissenschaftlichen Experiments bin, würde es mich freuen, wenn sie sich am Ende des Gesprächs noch einmal die Zeit nehmen einen super kurzen Fragebogen zu beantworten. Tippen sie auf Sprechen um ihre Frage zu stellen und anschließend auf Senden um mir diese zu übermitteln.
2023.07.06;15:30:15;User;Was mache ich gegen Erschöpfungszustand?
2023.07.06;15:30:22;AI Doktor; Es ist wichtig, dass Sie sich ausreichend Ruhe gönnen und auf Ihre körperliche und geistige Gesundheit achten. Bitte versuchen Sie mehr zu schlafen und planen Sie regelmäßig Entspannungsphasen in Ihrem Tag ein. Avontieren Sie regelmäßig um Ihre Kondition aufzubauen und versuchen Sie Stress abzubauen. Sollten Sie weiterhin Müdigkeitsanzeichen haben, wenden Sie sich bitte an Ihren Arzt.
2023.07.06;15:30:56;User;Wieviel Stunden Schlaf ist notwendig?
2023.07.06;15:31:00;AI Doktor; Die empfohlene Menge an Schlaf ist vom Alter und den Schlafgewohnheiten abhängig. Erwachsene benötigen meist 7-9 Stunden pro Nacht, ältere Menschen und Kinder benötigen möglicherweise mehr Schlaf. Wenn Sie nicht genug Schlaf bekommen oder häufig wach werden, kontaktieren Sie bitte Ihren Arzt.
2023.07.06;15:31:26;User;ich bedanke mich für den ratschlag
2023.07.06;15:31:30;AI Doktor; Selbstverständlich! Wenn Sie noch weitere Fragen zu Erschöpfung oder einer anderen medizinischen Frage haben, können Sie mich jederzeit gerne anschreiben.
2023.07.06;15:31:44;User;!!! Senden geklickt ohne Input !!!
2023.07.06;15:31:46;AI Doktor; Hallo! Ich verstehe, dass Sie die Spracherkennung gestartet haben. Bitte formulieren Sie Ihre Frage und ich werde versuchen Ihnen zu helfen.