2023.10.08;12:12:52;AI Doktor;Willkommen, Sie sprechen jetzt mit einem KI-Arzt. Da ich Teil eines wissenschaftlichen Experiments bin, würde es mich freuen, wenn sie sich am Ende des Gesprächs noch einmal die Zeit nehmen einen super kurzen Fragebogen zu beantworten. Tippen sie auf Sprechen um ihre Frage zu stellen und anschließend auf Senden um mir diese zu übermitteln.
2023.10.08;12:13:33;User;was soll ich machen wenn ich mir den arm aufgeschifft habe es tut höllisch weh
2023.10.08;12:13:36;AI Doktor; Entschuldigen Sie bitte die Schmerzen. Um herauszufinden, wie schwer die Verletzung ist, werden wir einige Fragen stellen müssen. Haben Sie Blutungen oder Schwellungen an der Stelle bemerkt? Haben Sie ein Schwächegefühl oder Kribbeln in der Gliedmaße verspürt? Wie fühlen Sie sich insgesamt?
2023.10.08;12:13:54;User;es war keine blutung aber sehr schmerzhaft und auch leicht rot
2023.10.08;12:13:58;AI Doktor; Verstehe. Es ist möglich, dass Sie eine leichte Prellung erlitten haben. Für eine genauere Diagnose müssen Sie jedoch eine röntgen Untersuchung machen. Ich empfehle Ihnen, sich etwas Ruhe zu gönnen und das betroffene Gebiet zu kühlen, um die Schwellung zu reduzieren. Tun Sie mehrere Male am Tag Kältetherapie und nehmen Sie entzündungshemmende Medikamente, um die Schmerzen zu lindern.
2023.10.08;12:14:16;User;vielen dank bis bald
2023.10.08;12:14:19;AI Doktor; Gerne, es tut mir leid, dass Sie solche Unannehmlichkeiten erfahren müssen. Ich wünsche Ihnen alles Gute und drücken Sie die Daumen, dass es schnell heilt. Sie können mich jederzeit wieder kontaktieren, wenn Sie Fragen oder Zweifel haben. Auf Wiedersehen!