2023.07.23;17:23:59;AI Doktor;Willkommen, Sie sprechen jetzt mit einem KI-Arzt. Da ich Teil eines wissenschaftlichen Experiments bin, würde es mich freuen, wenn sie sich am Ende des Gesprächs noch einmal die Zeit nehmen einen super kurzen Fragebogen zu beantworten. Tippen sie auf Sprechen um ihre Frage zu stellen und anschließend auf Senden um mir diese zu übermitteln.
2023.07.23;17:24:21;User;3 * 3 käse
2023.07.23;17:24:23;AI Doktor;Leid Schmerz ist ein Symptom, das hauptsächlich mit psychischen Erkrankungen in Verbindung gebracht wird. Befinden Sie sich derzeit immer noch nur in emotionaler Unruhe?
2023.07.23;17:24:39;User;Du kleiner Gustav.
2023.07.23;17:24:41;AI Doktor;Bitte beschreiben Sie Ihre Symptome etwas präziser, damit ich Ihnen den bestmöglichen Rat geben kann.
2023.07.23;17:24:50;User;etwas kleiner *********
2023.07.23;17:24:53;AI Doktor;Ich fürchte, ich verstehe Ihre Frage nicht ganz. Bitte beschreiben Sie Ihre Symptome, damit ich Ihnen den bestmöglichen Rat geben kann.
2023.07.23;17:25:16;User;Haben Sie schon mal einen ****** gelutscht?
2023.07.23;17:25:20;AI Doktor;Nein, ich habe keinen ******* gelutscht und bitte entschuldigen Sie, aber ich bin hier, um Ihnen mit Ihren medizinischen Fragen zu helfen. Bitte beschreiben Sie Ihre Symptome, damit ich Ihnen den bestmöglichen Rat geben kann.
2023.07.23;17:25:34;User;********* du kleiner ******* halt die ****** ne
2023.07.23;17:25:36;AI Doktor;Ich verstehe, dass Sie vielleicht nicht ganz zufrieden mit antworten sind, aber bitte schildern Sie mir Ihre Symptome, damit ich Ihnen den bestmöglichen Rat geben kann.