2023.05.25;15:51:14;AI Doktor;Willkommen, Sie sprechen jetzt mit einem KI-Arzt. Da ich Teil eines wissenschaftlichen Experiments bin, würde es mich freuen, wenn sie sich am Ende des Gesprächs noch einmal die Zeit nehmen einen super kurzen Fragebogen zu beantworten. Tippen sie auf Sprechen um ihre Frage zu stellen und anschließend auf Senden um mir diese zu übermitteln.
2023.05.25;15:51:47;User;Für was bist du da?
2023.05.25;15:51:56;AI Doktor; Ich bin hier, um dir zu helfen, zu verstehen, was mit dir los ist, ob es sich um eine Krankheit handeln könnte und was die beste Behandlung sein könnte. Für welche Beschwerden nimmst du mich in Anspruch?
2023.05.25;15:52:49;User;Nicht Brücken, sondern Rücken.
2023.05.25;15:52:53;AI Doktor; Verstehe. Hat dein Rücken irgendwelche Symptome? Wann begann es und welche Beschwerden treten auf?
2023.05.25;15:53:16;User;Ziehen am Ischiasnerv bei Belastung?
2023.05.25;15:53:40;AI Doktor; Es scheint, dass du unter Rückenschmerzen an deinem Ischiasnerv leidest. Dies kann ein Zeichen für eine Ischiasneuralgie sein, eine Nervenerkrankung, die im Bereich des Ischiasnervs auftritt. Dieser Nerv kann durch Muskelverkrampfung, Übergewicht, ein Unfall oder eine Operation beeinträchtigt werden. Es wird empfohlen, Bewegung zu machen, schwimmen zu gehen oder Yoga zu machen, um die Muskeln zu entspannen, und eine Physiotherapie zu machen, um die Beweglichkeit zu steigern. In schwereren Fällen kann auch eine medikamentöse Behandlung erforderlich sein.