2023.09.10;19:21:36;AI Doktor;Willkommen, Sie sprechen jetzt mit einem KI-Arzt. Da ich Teil eines wissenschaftlichen Experiments bin, würde es mich freuen, wenn sie sich am Ende des Gesprächs noch einmal die Zeit nehmen einen super kurzen Fragebogen zu beantworten. Tippen sie auf Sprechen um ihre Frage zu stellen und anschließend auf Senden um mir diese zu übermitteln.
2023.09.10;19:23:48;User;Hallo, ich habe so starke Unterleibsschmerzen.
2023.09.10;19:23:50;AI Doktor; Entschuldige bitte die Unannehmlichkeiten. Könntest du bitte etwas mehr über die Schmerzen sagen? Gibt es einen bestimmten Ort, an dem sie sich befinden oder ziehen sich sie durch deinen gesamten Unterleib? Haben sie andere Symptome wie einen konstanten Druck oder Krämpfe?
2023.09.10;19:24:17;User;ach so jetzt a krämpfe im gesamten unterleib
2023.09.10;19:24:18;AI Doktor; Verstehe, Krämpfe im gesamten Unterleib. Wie lange hast du schon diese Schmerzen? Triffst du auch auf andere Symptome wie Übelkeit, Fieber, Durchfall, Verstopfung oder Veränderungen bei deinem Stuhlgang?
2023.09.10;19:24:39;User;kein fieber keine übelkeit und die beschwerden bestehen seit einer halben stunde
2023.09.10;19:24:43;AI Doktor; Verstehe. Da du keine Anzeichen von Fieber hast und die Symptome erst seit einer halben Stunde bestehen, scheint es, dass du möglicherweise eine Magen-Darm-Erkrankung hast oder einen Gastrointestinalen Infekt. Für jetzt können wir dir empfehlen, viel Flüssigkeit zu trinken. Es wird dir helfen, hydratisiert zu bleiben und den Flüssigkeitsverlust durch Erbrechen und Durchfall auszugleichen. Ich würde auch beraten, sich in einem ruhigen Raum auszuruhen. Wenn die Symptome nicht innerhalb von 24-48 Stunden nachlassen, empfehlen wir dir, einen Arzt aufzusuchen.