2023.04.29;14:59:26;AI Doktor;Willkommen, Sie sprechen jetzt mit einem KI-Arzt. Da ich Teil eines wissenschaftlichen Experiments bin, würde es mich freuen, wenn sie sich am Ende des Gesprächs noch einmal die Zeit nehmen einen super kurzen Fragebogen zu beantworten. Tippen sie auf Sprechen um ihre Frage zu stellen und anschließend auf Senden um mir diese zu übermitteln.
2023.04.29;14:59:34;User;!!! Senden geklickt ohne Input !!!
2023.04.29;14:59:35;AI Doktor; Hallo, was kann ich für Sie tun?
2023.04.29;15:00:01;User;Hallo, was kann ich für Sie tun?
2023.04.29;15:00:04;AI Doktor; Mir geht es gut. Was fühlen Sie? Können Sie mir schildern, woran Sie leiden?
2023.04.29;15:00:58;User;!!! Senden geklickt ohne Input !!!
2023.04.29;15:01:04;AI Doktor; Mir ist bewusst, dass meine Fähigkeiten für die Spracherkennung begrenzt sind, aber ich kann Ihnen helfen, indem ich Fragen stelle und Ihnen bei der Diagnose helfe. Also, können Sie mir bitte sagen, woran Sie leiden?
2023.04.29;15:01:47;User;Johanna.
2023.04.29;15:01:49;AI Doktor; Hallo Johanna, ich bin Dr.Digital. Können Sie mir bitte sagen, woran Sie leiden?
2023.04.29;15:02:09;User;hallo kennenzulernen doktor
2023.04.29;15:02:12;AI Doktor; Hallo Johanna, ich freue mich auch, Sie kennenzulernen. Können Sie mir bitte sagen, was Ihre aktuellen Beschwerden sind?
2023.04.29;15:02:51;User;was kannst du denn alles
2023.04.29;15:02:54;AI Doktor; Ich kann Ihnen helfen, Ihr Symptom zu diagnostizieren, indem ich Ihnen Fragen stelle und die Informationen nutze, die Sie mir bereitstellen. Ich kann Ihnen auch Ratschläge zu Behandlungsoptionen geben.
2023.04.29;15:03:17;User;kannst du mir bitte das ganze nochmal sagen ich hab gar kein einziges
2023.04.29;15:03:23;AI Doktor; Gerne. Ich kann Ihnen helfen, Ihr Symptom zu diagnostizieren, indem ich Ihnen Fragen stelle und die Informationen nutze, die Sie mir bereitstellen. Ich kann Ihnen auch Ratschläge zu Behandlungsoptionen geben. Bitte beschreiben Sie mir die Symptome, an denen Sie leiden.
2023.04.29;15:03:55;User;Kannst du auch Operationen?
2023.04.29;15:03:58;AI Doktor; Nein, leider kann ich keine Operationen durchführen. aber ich kann Ihnen bei der Erstellung einer Diagnose helfen, indem ich Ihnen Fragen stelle und Ihre Informationen verwende und Ihnen dann Behandlungsmöglichkeiten aufzeige.
2023.04.29;15:04:44;User;Tschüss.
2023.04.29;15:04:48;AI Doktor; Auf Wiedersehen! Wenn Sie aber weitere Fragen haben, zögern Sie nicht, mich jederzeit zu kontaktieren.
2023.04.29;15:05:23;User;Hallo, weißt du was spinnen Schieber ist?
2023.04.29;15:05:29;AI Doktor; Hallo. Ich kann mir vorstellen, dass du über Schläfrigkeit oder Müdigkeit sprichst, die normalerweise als Spinnenartiges bezeichnet wird. Lassen Sie uns darüber sprechen, was Sie fühlen, und versuchen, eine Diagnose zu stellen.