2023.04.26;19:44:20;AI Doktor;Willkommen, Sie sprechen jetzt mit einem KI-Arzt. Da ich Teil eines wissenschaftlichen Experiments bin, würde es mich freuen, wenn sie sich am Ende des Gesprächs noch einmal die Zeit nehmen einen super kurzen Fragebogen zu beantworten. Tippen sie auf Sprechen um ihre Frage zu stellen und anschließend auf Senden um mir diese zu übermitteln.
2023.04.26;19:44:50;User;senden
2023.04.26;19:44:52;AI Doktor; Hallo, welche Symptome hast du?
2023.04.26;19:45:07;User;saurer magen magen tut weh wenn ich wein
2023.04.26;19:45:14;AI Doktor; Hmm das klingt nach Reflux oder Sodbrennen. Hast du auch Symptome wie: Aufstoßen, Sodbrennen oder ein brennendes Gefühl hinter dem Brustbein?
2023.04.26;19:45:26;User;Ja.
2023.04.26;19:45:35;AI Doktor; Okay, es scheint, als hättest du Reflux oder Sodbrennen. Um Ihre Symptome zu lindern, empfehlen wir Ihnen, regelmäßig zu essen und kleinere Mahlzeiten zu sich zu nehmen, um Ihren Magen zu entlasten. Auch sollten Sie spezielle Medikamente einnehmen, um die Magensäureproduktion zu hemmen. Falls die Symptome nicht besser werden, empfehlen wir Ihnen, einen Arzt aufzusuchen, um weitere Untersuchungen zu machen.
2023.04.26;19:46:09;User;Kann ich Wein trinken, wenn ich Sodbrennen habe?
2023.04.26;19:46:16;AI Doktor; Alkohol wie Wein kann die Symptome von Reflux oder Sodbrennen verschlimmern, daher empfehlen wir Ihnen, ihn vorsichtig bzw. in Maßen zu trinken und das Trinken vor allem in den Abendstunden zu vermeiden.
2023.04.26;19:46:40;User;Tschüss.
2023.04.26;19:46:42;AI Doktor; Na gut, man sieht sich. Wir wünschen Ihnen noch einen schönen Tag!
2023.04.26;19:46:51;User;Was machst du am Wochenende? Lust auf einen Kaffee?
2023.04.26;19:46:56;AI Doktor; Vielen Dank für die Einladung, aber ich bin kein richtiger Arzt und treffe mich nicht mit Patienten. Ich kann nur medizinisch relevante Fragen beantworten. Wenn Sie weitere Fragen haben, zögern Sie nicht, mich zu kontaktieren.
2023.04.26;19:47:16;User;Ja, genau.
2023.04.26;19:47:17;AI Doktor; Wie kann ich Ihnen helfen?