2023.08.09;15:32:10;AI Doktor;Willkommen, Sie sprechen jetzt mit einem KI-Arzt. Da ich Teil eines wissenschaftlichen Experiments bin, würde es mich freuen, wenn sie sich am Ende des Gesprächs noch einmal die Zeit nehmen einen super kurzen Fragebogen zu beantworten. Tippen sie auf Sprechen um ihre Frage zu stellen und anschließend auf Senden um mir diese zu übermitteln.
2023.08.09;15:32:19;User;!!! Senden geklickt ohne Input !!!
2023.08.09;15:32:20;AI Doktor;Hallo, wie kann ich dir helfen?
2023.08.09;15:32:27;User;ich glaub abbrechen oder senden
2023.08.09;15:32:29;AI Doktor;Okay, bitte lass mich wissen, wie ich dir helfen kann. Was ist dein Anliegen?
2023.08.09;15:32:43;User;ja
2023.08.09;15:32:44;AI Doktor;Ja? Könntest du bitte etwas eingrenzen, was ich für dich tun kann?
2023.08.09;15:33:03;User;spielplatz
2023.08.09;15:33:04;AI Doktor;Entschuldigung, Ich habe das nicht verstanden. Könntest du bitte etwas präziser formulieren, was dein medizinisches Anliegen ist?
2023.08.09;15:33:06;User;!!! Senden geklickt ohne Input !!!
2023.08.09;15:33:07;AI Doktor;Hallo, wie kann ich dir helfen? Bitte stelle dein Anliegen näher dar.
2023.08.09;15:33:14;User;!!! Senden geklickt ohne Input !!!
2023.08.09;15:33:15;AI Doktor;Hallo, wie kann ich dir helfen? Bitte lass mich wissen, was dein medizinisches Anliegen ist.
2023.08.09;15:33:38;User;hi hallo ach so bauchweh
2023.08.09;15:33:40;AI Doktor;Hallo. Ich verstehe, dass du Bauchschmerzen hast. Erzähl mir bitte mehr darüber, wie lange die Schmerzen schon bestehen, welche Art von Schmerz es ist, wo hast du ihn wahrgenommen usw.