2023.04.29;13:29:12;AI Doktor;Willkommen, Sie sprechen jetzt mit einem KI-Arzt. Da ich Teil eines wissenschaftlichen Experiments bin, würde es mich freuen, wenn sie sich am Ende des Gesprächs noch einmal die Zeit nehmen einen super kurzen Fragebogen zu beantworten. Tippen sie auf Sprechen um ihre Frage zu stellen und anschließend auf Senden um mir diese zu übermitteln.
2023.04.29;13:29:45;User;Wie groß ist die BUGA?
2023.04.29;13:29:48;AI Doktor; Diese Frage ist nicht mit medizinischen Themen verbunden und kann daher nicht beantwortet werden. Kann ich dir mit anderen Themen helfen?
2023.04.29;13:30:32;User;!!! Senden geklickt ohne Input !!!
2023.04.29;13:30:34;AI Doktor; Bitte stelle deine Frage jetzt. Womit kann ich dir helfen?
2023.04.29;13:30:57;User;eine antwort wie ist das wetter in mannheim
2023.04.29;13:31:00;AI Doktor; Diese Frage gehört nicht zu meinen medizinischen Aufgaben. Kann ich Ihnen bei anderen Gesundheitsfragen helfen?
2023.04.29;13:31:16;User;was darf ich bei candida
2023.04.29;13:31:22;AI Doktor; Candida ist eine Infektion, die durch den Hefepilz Candida albicans verursacht wird. Es gibt verschiedene Behandlungsmöglichkeiten, wie Antimykotika in Form von Tabletten oder Cremes, aber auch Anti-Pilz-Diäten, um ein Übergreifen auf den Rest des Körpers zu verhindern.
2023.04.29;13:31:46;User;welche lebensmittel darf man bei candida
2023.04.29;13:31:54;AI Doktor; Für die Behandlung einer Candida-Infektion sollten Sie Lebensmittel vermeiden, die reich an Kohlenhydraten, Zucker und Pilzen sind. Stattdessen ist es am besten, sich auf frische, unverarbeitete Nahrungsmittel wie Gemüse, Obst, Nüsse, Hülsenfrüchte, Eier, Fleisch und Fisch zu konzentrieren.
2023.04.29;13:34:21;User;Hallo.
2023.04.29;13:34:23;AI Doktor; Hallo! Womit kann ich Ihnen helfen?
2023.04.29;13:34:42;User;wie mache ich ein selfie
2023.04.29;13:34:47;AI Doktor; Diese Frage gehört nicht zu meinen medizinischen Aufgaben. Aber wenn Sie Informationen zu Selfiestechniken benötigen, steht Ihnen das Internet zur Verfügung. Kann ich dir sonst mit medizinischen Themen helfen?
2023.04.29;13:35:22;User;Was hilft gegen eine Zwiebelallergie?
2023.04.29;13:35:30;AI Doktor; Zwiebelallergien können schwierig zu behandeln sein, da sie in so viele verschiedene Lebensmittel eingebaut sind. Allergien gegen Zwiebeln können mit verschiedenen Antihistaminika behandelt werden. Es ist auch wichtig, alle Produkte zu vermeiden, die Zwiebeln oder Allergene enthalten, und Ihren Allergiespezialisten aufzusuchen, um sicherzustellen, dass die richtige Behandlung erfolgt.