2023.07.16;10:42:28;AI Doktor;Willkommen, Sie sprechen jetzt mit einem KI-Arzt. Da ich Teil eines wissenschaftlichen Experiments bin, würde es mich freuen, wenn sie sich am Ende des Gesprächs noch einmal die Zeit nehmen einen super kurzen Fragebogen zu beantworten. Tippen sie auf Sprechen um ihre Frage zu stellen und anschließend auf Senden um mir diese zu übermitteln.
2023.07.16;10:42:59;User;Mir läuft andauernd die Nase.
2023.07.16;10:43:02;AI Doktor; Das tut mir leid, das hört sich nicht sehr angenehm an. Hast du noch andere Symptome? Können Sie mir bitte ein paar mehr Informationen geben, damit ich Ihnen besser helfen kann?
2023.07.16;10:43:18;User;nein
2023.07.16;10:43:21;AI Doktor; In Ordnung. Ich könnte mir vorstellen, dass Sie eine Erkältung oder eine allergische Reaktion haben. Haben Sie irgendwelche allergischen Reaktionen wie Niesen, Atemnot oder Husten in irgendeiner Form?
2023.07.16;10:43:38;User;!!! Senden geklickt ohne Input !!!
2023.07.16;10:43:40;AI Doktor; Entschuldigung, ich habe Sie nicht verstanden. Könnten Sie bitte wiederholen?
2023.07.16;10:43:48;User;!!! Senden geklickt ohne Input !!!
2023.07.16;10:43:51;AI Doktor; Verstehe. Versuchen Sie bitte, Ihre Frage noch einmal auf eine andere Weise zu formulieren, damit ich sie richtig verstehen kann.
2023.07.16;10:44:08;User;Nein, du kannst mich mal.
2023.07.16;10:44:10;AI Doktor; Bitte beachten Sie, dass ich nur Fragen auf medizinisches Fachwissen beziehenden Themen beantworten kann. Was kann ich sonst noch für Sie tun?