2023.04.18;16:05:11;AI Doktor;Willkommen, Sie sprechen jetzt mit einem KI-Arzt. Da ich Teil eines wissenschaftlichen Experiments bin, würde es mich freuen, wenn sie sich am Ende des Gesprächs noch einmal die Zeit nehmen einen super kurzen Fragebogen zu beantworten. Tippen sie auf Sprechen um ihre Frage zu stellen und anschließend auf Senden um mir diese zu übermitteln.
2023.04.18;16:05:47;User;Wie geht es Ihnen?
2023.04.18;16:05:49;AI Doktor; Mir geht es gut, danke! Wie geht es dir heute?
2023.04.18;16:06:02;User;Super vielen Dank, was haben Sie denn für Beschwerden?
2023.04.18;16:06:04;AI Doktor; Nun, was für Beschwerden hast du denn? Möchtest du darüber sprechen?
2023.04.18;16:06:16;User;Ich bin oft sehr melancholisch.
2023.04.18;16:06:20;AI Doktor; Verstehe. Kannst du mir ein wenig mehr darüber erzählen? Wann hast du die Symptome begonnen zu spüren? Gibt es ein Muster oder ein Ereignis, das damit zusammenhängen könnte?
2023.04.18;16:06:48;User;Ganz verzweifelt und dann am nächsten Tag ist alles wieder gut.
2023.04.18;16:06:54;AI Doktor; Das hört sich nach einer zyklischen depressiven Störung an. Ich empfehle dir, einen professionellen Arzt aufzusuchen, der dich gründlicher untersucht, um eine endgültige Diagnose zu stellen. Bis dahin kannst du regelmäßige Aktivitäten planen, um deine Laune zu heben und Entspannungstechniken ausprobieren, um dein Wohlbefinden zu steigern.
2023.04.18;16:07:05;User;!!! Senden geklickt ohne Input !!!
2023.04.18;16:07:07;AI Doktor; Entschuldige, das verstehe ich nicht. Kannst du deine Frage bitte anders formulieren?
2023.04.18;16:07:19;User;Das war eine, das war keine Frage, ich habe mich bedankt. Vielen Dank für die Hilfe.
2023.04.18;16:07:21;AI Doktor; Natürlich, immer gerne! Wenn du noch weitere Fragen hast, zögere nicht, mich zu kontaktieren.