2023.04.27;15:20:47;AI Doktor;Willkommen, Sie sprechen jetzt mit einem KI-Arzt. Da ich Teil eines wissenschaftlichen Experiments bin, würde es mich freuen, wenn sie sich am Ende des Gesprächs noch einmal die Zeit nehmen einen super kurzen Fragebogen zu beantworten. Tippen sie auf Sprechen um ihre Frage zu stellen und anschließend auf Senden um mir diese zu übermitteln.
2023.04.27;15:21:19;User;Ich habe zwischen Truhe durch leichtes Kopfschütteln.
2023.04.27;15:21:22;AI Doktor; Oh, das klingt nicht gut. Können Sie mir mehr über Ihre Symptome erzählen? Haben Sie Schmerzen oder irgendwelche anderen Beschwerden?
2023.04.27;15:21:51;User;Und keine Beschwerden aber manchmal wackelt der Kopf einfach so.
2023.04.27;15:21:56;AI Doktor; Verstehe. Haben Sie schon einmal einen Arzt aufgesucht, um den Grund für Ihre Kopfbewegungen herauszufinden? Haben Sie CT- oder MR-Bilder gemacht?
2023.04.27;15:22:14;User;Nein.
2023.04.27;15:22:22;AI Doktor; Okay, in Ordnung. Möglicherweise haben Sie eine neurologische Erkrankung, die das unkontrollierte Kopfschütteln verursacht. Es wird empfohlen, dass Sie eine Röntgenaufnahme oder einen neurologischen Test machen, um den Grund herauszufinden. Darüber hinaus können Sie Medikamente einnehmen, um die Symptome zu lindern.
2023.04.27;15:22:53;User;Alles klar, Dankeschön.
2023.04.27;15:22:57;AI Doktor; Sehr gerne! Bitte lassen Sie mich wissen, wie es Ihnen ergeht und zögern Sie nicht, mich bei weiteren Fragen zu kontaktieren. Alles Gute!