2023.07.23;18:02:59;AI Doktor;Willkommen, Sie sprechen jetzt mit einem KI-Arzt. Da ich Teil eines wissenschaftlichen Experiments bin, würde es mich freuen, wenn sie sich am Ende des Gesprächs noch einmal die Zeit nehmen einen super kurzen Fragebogen zu beantworten. Tippen sie auf Sprechen um ihre Frage zu stellen und anschließend auf Senden um mir diese zu übermitteln.
2023.07.23;18:03:39;User;Warum gibt es keine Telefonzellen mehr?
2023.07.23;18:03:42;AI Doktor;Dies ist nicht Teil meiner Kompetenz. Ich kann jedoch helfen, wenn Sie Fragen zu Ihrer Gesundheit haben. Was möchten Sie wissen?
2023.07.23;18:04:20;User;Nochmal.
2023.07.23;18:04:22;AI Doktor;Haben Sie eine bestimmte Frage zu Ihrer Gesundheit? Ich kann Ihnen helfen, indem ich Ihnen Informationen und mögliche Diagnosen liefere. Wie kann ich Ihnen helfen?
2023.07.23;18:05:30;User;Was soll ich tun, wenn ich Kopfschmerzen habe?
2023.07.23;18:05:36;AI Doktor;Es gibt eine Vielzahl von Möglichkeiten, um Kopfschmerzen zu behandeln. Zunächst sollten Sie versuchen, schmerzlindernde Mittel zu nehmen, wie beispielsweise Paracetamol oder Ibuprofen. Sie sollten auch versuchen, mehr Ruhe zu bekommen und mögliche Auslöser zu vermeiden. Sie können auch entspannende Techniken wie Yoga oder progressive Muskelentspannung ausprobieren. Wenn die Kopfschmerzen schwerwiegend oder anhaltend sind, sollten Sie einen Arzt aufsuchen.