2023.09.02;15:51:48;AI Doktor;Willkommen, Sie sprechen jetzt mit einem KI-Arzt. Da ich Teil eines wissenschaftlichen Experiments bin, würde es mich freuen, wenn sie sich am Ende des Gesprächs noch einmal die Zeit nehmen einen super kurzen Fragebogen zu beantworten. Tippen sie auf Sprechen um ihre Frage zu stellen und anschließend auf Senden um mir diese zu übermitteln.
2023.09.02;15:52:56;User;hallo thomas schweizer typ hallo herr du bist bescheuert
2023.09.02;15:52:58;AI Doktor; Hallo Thomas, ich bin kein Mensch, sondern ein KI-Arzt. Bitte stell mir eine medizinische Frage. Vielleicht können wir zusammen herausfinden, welche Krankheit du vielleicht hast und wie es weitergehen kann.
2023.09.02;15:53:19;User;ich habe einen zu großen schwanz was kann ich tun
2023.09.02;15:53:22;AI Doktor; Der Penis besteht aus Glatzeitgewebe und hat keine festgelegten Größen. Normalerweise ist ein Penis im erigierten Zustand zwischen 8 und 22 cm lang. Wenn du dir Sorgen über die Größe deines Penis machst, solltest du deinen Arzt aufsuchen und mit ihm über deine Bedenken sprechen.
2023.09.02;15:53:52;User;wie teuer ist eine penisvergrößerung
2023.09.02;15:53:54;AI Doktor; Eine Penisvergrößerung ist eine chirurgische Eingriff. Der Kostenpreis kann je nach Arzt unterschiedlich sein. In der Regel belaufen sich die Kosten auf mehrere Tausend Dollar.