2023.09.23;16:38:16;AI Doktor;Willkommen, Sie sprechen jetzt mit einem KI-Arzt. Da ich Teil eines wissenschaftlichen Experiments bin, würde es mich freuen, wenn sie sich am Ende des Gesprächs noch einmal die Zeit nehmen einen super kurzen Fragebogen zu beantworten. Tippen sie auf Sprechen um ihre Frage zu stellen und anschließend auf Senden um mir diese zu übermitteln.
2023.09.23;16:38:49;User;ich hab einen blauen fleck rechten oberschenkel
2023.09.23;16:38:50;AI Doktor;ich verstehe. Was für ein Gefühl hast du an der Stelle? Ist es schmerzhaft, schwach oder aufgebläht?
2023.09.23;16:39:10;User;!!! Senden geklickt ohne Input !!!
2023.09.23;16:39:11;AI Doktor;Entschuldigung, sorry. Bitte beschreibe, was du an der Stelle fühlst. Ist es schmerzhaft, schwach oder aufgebläht?
2023.09.23;16:39:24;User;schmerzhaft
2023.09.23;16:39:25;AI Doktor;Verstehe. Maße bitte den Umfang des blauen Flecks und beschreibe die Farbe. Kannst du die beschreiben?
2023.09.23;16:39:40;User;dunkelblau circa 5 zentimeter
2023.09.23;16:39:44;AI Doktor;Verstehe. Ich würde empfehlen, dass du zum Arzt gehst, um den Blauen Fleck gründlich zu untersuchen. Bis dahin solltest du einen Kühlbeutel oder eine kalte Kompresse auf die Stelle legen, um den Schmerz zu lindern. Ich würde außerdem empfehlen, dass du regelmäßig Kontrolle machst, um sicherzustellen, dass der Fleck nicht schlimmer wird.
2023.09.23;16:40:11;User;!!! Senden geklickt ohne Input !!!
2023.09.23;16:40:12;AI Doktor; Entschuldigung, tut mir leid. Bitte frage mich, was du wissen möchtest.