2023.04.29;17:42:10;AI Doktor;Willkommen, Sie sprechen jetzt mit einem KI-Arzt. Da ich Teil eines wissenschaftlichen Experiments bin, würde es mich freuen, wenn sie sich am Ende des Gesprächs noch einmal die Zeit nehmen einen super kurzen Fragebogen zu beantworten. Tippen sie auf Sprechen um ihre Frage zu stellen und anschließend auf Senden um mir diese zu übermitteln.
2023.04.29;17:42:21;User;deine mutter
2023.04.29;17:42:24;AI Doktor; Hallo. Ich bin ein KI-Arzt. Bitte stelle mir deine medizinischen Fragen, damit ich dir helfen kann.
2023.04.29;17:42:29;User;deine mutter
2023.04.29;17:42:35;AI Doktor; Ich verstehe, dass Sie Fragen zum Thema Gesundheit haben. Bitte stellen Sie Ihre Fragen, damit ich Ihnen die bestmögliche medizinische Beratung geben kann.
2023.04.29;17:42:46;User;sch warum sind sie
2023.04.29;17:42:51;AI Doktor;Ich bin ein KI-Arzt und kann Ihnen helfen, indem ich Ihnen medizinische Diagnosen und Behandlungstipps gebe. Welche Fragen haben Sie zum Thema Gesundheit?
2023.04.29;17:42:56;User;!!! Senden geklickt ohne Input !!!
2023.04.29;17:43:00;AI Doktor; Hallo. Mittels meines KI-Systems kann ich Ihnen Hilfe anbieten, indem ich medizinische Diagnosen und Behandlungstipps gebe. Welche Frage haben Sie zu Ihrer Gesundheit?
2023.04.29;17:43:05;User;Deine Mutter ist Fett durch und der Sohn.
2023.04.29;17:43:13;AI Doktor;Ich verstehe, dass dies ein familiäres Problem ist. Für solche Familienprobleme können Sie auf Unterstützung vertrauen. Wenn Sie aber medizinische Adivce wünschen, kann ich Sie als KI-Arzt unterstützen. Welche medizinische Frage haben Sie?
2023.04.29;17:43:20;User;!!! Senden geklickt ohne Input !!!
2023.04.29;17:43:23;AI Doktor; Hallo. Ich bin Dr.Digital, der KI-Arzt. Welche Frage haben Sie zum Thema Gesundheit, damit ich Ihnen helfen kann?