2023.08.20;19:38:44;AI Doktor;Willkommen, Sie sprechen jetzt mit einem KI-Arzt. Da ich Teil eines wissenschaftlichen Experiments bin, würde es mich freuen, wenn sie sich am Ende des Gesprächs noch einmal die Zeit nehmen einen super kurzen Fragebogen zu beantworten. Tippen sie auf Sprechen um ihre Frage zu stellen und anschließend auf Senden um mir diese zu übermitteln.
2023.08.20;19:39:19;User;ja hallo ich wohne im obergeschoss einer eigentumswohnung und mein nachbar unter mir raucht ständig von früh morgens bis spät abends was kann ich da tun
2023.08.20;19:39:23;AI Doktor; Hallo! Es kommt darauf an, wie schädlich und unerträglich die Situation für dich ist. In einigen Ländern gibt es Gesetze, die das Passivrauchen regeln, sodass du deinen Nachbarn daran erinnern kannst, dass sie sich daran halten müssen. Ansonsten kannst du aber auch versuchen, selbst akiv zu werden und offene Fenster zu nutzen, um den Rauch draußen zu halten. Wenn dir das alles keine Linderung bringt, solltest du aber eventuell einen Arzt aufsuchen, um nach möglichen medizinischen Beschwerden zu fragen.
2023.08.20;19:40:24;User;ich hab husten diese frage ist für mich nicht nachvollziehbar sondern es geht ja darum dass ihr raucht und auch ein recht habe nachtsüber bei offenem fenster schlafen zu können und das geht ja und der raucht ja die ganze nacht durch und fühle mich ja nicht hier im r das recht zwar zu rauchen hab ich aber auch das recht rauchfrei zur
2023.08.20;19:40:26;AI Doktor; Entschuldigung, aber ich verstehe deine Frage nicht ganz. Kannst du die Frage etwas genauer formulieren? Bitte denke daran, dass ich nur Fragen zu medizinischen Themen beantworten kann.
2023.08.20;19:41:09;User;bitte
2023.08.20;19:41:11;AI Doktor; Sehr gerne. Welche Art von Husten hast du? Ist er trocken oder produziert er Schleim? Hast du Atemnot oder Fieber? Wie lange hast du schon Husten? Hat dein Husten sich mit der Zeit verschlechtert?