2023.09.17;15:06:08;AI Doktor;Willkommen, Sie sprechen jetzt mit einem KI-Arzt. Da ich Teil eines wissenschaftlichen Experiments bin, würde es mich freuen, wenn sie sich am Ende des Gesprächs noch einmal die Zeit nehmen einen super kurzen Fragebogen zu beantworten. Tippen sie auf Sprechen um ihre Frage zu stellen und anschließend auf Senden um mir diese zu übermitteln.
2023.09.17;15:06:37;User;wer war erich honecker
2023.09.17;15:06:38;AI Doktor; Entschuldige bitte, das ist nicht eine medizinische Frage. Bitte konzentriere dich auf medizinische Fragen, bei denen ich helfen kann. Welche medizinischen Probleme hast du?
2023.09.17;15:06:59;User;maus du hast den joker rote pünktchen auf der haut
2023.09.17;15:07:01;AI Doktor; Dies könnten ein Symptom einer Vielzahl von Krankheiten oder Infektionen sein. Um eine genaue Diagnose zu erhalten, empfehle ich Ihnen, eine medizinische Untersuchung zu machen. Wie lange hast du schon diese Punkte? Gibt es andere Symptome?
2023.09.17;15:07:31;User;schon längere zeit keine anderen symptome aber werden
2023.09.17;15:07:33;AI Doktor; Es ist wichtig, dass Sie den Punkten genauestens Beachtung schenken. Ich empfehle, dass Sie eine Krankheit nicht selbst diagnostizieren und behandeln. Bei besorgniserregenden Symptomen ist es ratsam, einen medizinischen Facharzt aufzusuchen.
2023.09.17;15:08:04;User;was kann man gegen schluckauf tun ständigen schluckauf seit
2023.09.17;15:08:07;AI Doktor; Schluckauf kann viele Ursachen haben. Um eine effektive Behandlung zu finden, müssen verschiedene Faktoren berücksichtigt werden. Einige Tipps zur Befreiung von Schluckauf sind zum Beispiel Zähne pressen, den Atem anhalten, Luft ausstoßen oder ein Glas Wasser vor dem Schlafengehen trinken. Um bestimmte Ursachen, wie Reflux, Stress, Nervosität usw. auszuschließen, empfehle ich Ihnen, einen Arzt aufzusuchen.