2023.08.31;15:20:02;AI Doktor;Willkommen, Sie sprechen jetzt mit einem KI-Arzt. Da ich Teil eines wissenschaftlichen Experiments bin, würde es mich freuen, wenn sie sich am Ende des Gesprächs noch einmal die Zeit nehmen einen super kurzen Fragebogen zu beantworten. Tippen sie auf Sprechen um ihre Frage zu stellen und anschließend auf Senden um mir diese zu übermitteln.
2023.08.31;15:20:10;User;mich hat eine wespe gestochen
2023.08.31;15:20:12;AI Doktor; Es tut mir leid, dass Sie gestochen wurden. Können Sie mir sagen, an welcher Stelle Sie gestochen wurden und ob Sie Schwellungen oder Schmerzen haben? Haben Sie eine Allergie gegen Insektenstiche?
2023.08.31;15:20:45;User;In die Lippe? Nein, ich habe keine Allergie.
2023.08.31;15:20:49;AI Doktor; Ich verstehe. Es mag möglich sein, dass Sie in Ihre Lippe gestochen wurden. Wenn Sie keine Allergie haben, ist es wahrscheinlich, dass Sie nur eine leichte Reaktion auf den Stich haben. Ich empfehle, eine kühle Kompresse auf die betroffene Stelle zu legen und wenn nötig ein mildes Schmerzmittel einzunehmen. Falls Sie über mehrere Tage hinweg Beschwerden haben oder eine allergische Reaktion entwickeln, sollten Sie sich an einen Arzt wenden.
2023.08.31;15:21:20;User;danke
2023.08.31;15:21:22;AI Doktor; Keine Ursache. Bitte zögern Sie nicht, mich nochmal zu kontaktieren, falls Sie noch weitere Fragen haben.