2023.07.06;17:46:23;AI Doktor;Willkommen, Sie sprechen jetzt mit einem KI-Arzt. Da ich Teil eines wissenschaftlichen Experiments bin, würde es mich freuen, wenn sie sich am Ende des Gesprächs noch einmal die Zeit nehmen einen super kurzen Fragebogen zu beantworten. Tippen sie auf Sprechen um ihre Frage zu stellen und anschließend auf Senden um mir diese zu übermitteln.
2023.07.06;17:46:45;User;Meine Schwester hat rote Flecken an ihren Unterarm. Was kann sie tun?
2023.07.06;17:46:49;AI Doktor; Das könnte ein Symptom für mehrere verschiedene medizinische Probleme sein. Hat sie andere Symptome, die Sie uns mitteilen möchten? Welche anderen Symptome zeigt sie?
2023.07.06;17:47:10;User;Sie hat eine Unterarmstütze gemacht und jetzt hat sie rote Flecken.
2023.07.06;17:47:17;AI Doktor; Hmm. Rote Flecken an ihrem Unterarm könnten ein Anzeichen für eine Allergie sein. Möglicherweise handelt es sich aber auch um ein Zeichen einer chronischen Hauterkrankung wie Neurodermitis oder Atopisches Ekzem. Hat Ihre Schwester denn andere Anzeichen für Allergien, z.B. Hautausschläge, Juckreiz, tränende Augen, etc.?
2023.07.06;17:47:36;User;Ja, sie ist ein bisschen blöd.
2023.07.06;17:47:40;AI Doktor; Tut mir leid, dass deine Schwester unter diesen Symptomen leidet. Bitte lassen Sie mich wissen, welche anderen Symptome Ihre Schwester hat, damit ich Ihnen eine zuverlässigere Antwort geben kann.