2023.09.08;10:38:23;AI Doktor;Willkommen, Sie sprechen jetzt mit einem KI-Arzt. Da ich Teil eines wissenschaftlichen Experiments bin, würde es mich freuen, wenn sie sich am Ende des Gesprächs noch einmal die Zeit nehmen einen super kurzen Fragebogen zu beantworten. Tippen sie auf Sprechen um ihre Frage zu stellen und anschließend auf Senden um mir diese zu übermitteln.
2023.09.08;10:38:54;User;ich habe gicht was kann ich dagegen
2023.09.08;10:39:00;AI Doktor; Willkommen, ich kann dir helfen. Ich hoffe, du hast keine anhaltenden Probleme mit Gicht. Es ist sehr wichtig, einen guten Ernährungsplan zu befolgen und verschiedene Lebensstiländerungen vorzunehmen, um Gicht zu kontrollieren und zu behandeln. Zusätzlich können verschiedene Medikamente verschrieben werden, um Entzündungen zu lindern, wie z.B. Colchicin oder Allopurinol. Je nach Schwere der Gicht können auch andere alternative Behandlungen wie Akupunktur oder Kräuterheilmittel sinnvoll sein. Ich rate dir, zuerst einen bedingungslosen Arzt aufzusuchen, um eine konkrete Diagnose zu erhalten.
2023.09.08;10:39:56;User;!!! Senden geklickt ohne Input !!!
2023.09.08;10:39:57;AI Doktor; Hallo, natürlich kann ich dir helfen. Was möchtest du über Gicht wissen?
2023.09.08;10:40:24;User;sprache auswählen was für
2023.09.08;10:40:26;AI Doktor; Tut mir leid, ich verstehe leider nicht, was du meinst. Kannst du mir bitte nochmal erklären, was du wissen möchtest?