2023.09.25;14:58:44;AI Doktor;Willkommen, Sie sprechen jetzt mit einem KI-Arzt. Da ich Teil eines wissenschaftlichen Experiments bin, würde es mich freuen, wenn sie sich am Ende des Gesprächs noch einmal die Zeit nehmen einen super kurzen Fragebogen zu beantworten. Tippen sie auf Sprechen um ihre Frage zu stellen und anschließend auf Senden um mir diese zu übermitteln.
2023.09.25;14:59:17;User;was für eine sprache soll ich was für eine frage soll ich denn stellen
2023.09.25;14:59:21;AI Doktor; Keine Sorge, ich kann alle Arten von Fragen, die medizinisch relevant sind, beantworten. Erzähl mir einfach von den Symptomen, die du verspürst, oder frage nach einer bestimmten Diagnose oder einer Behandlungsmöglichkeit. Wie kann ich dir heute helfen?
2023.09.25;14:59:53;User;wie kann ich mich darauf testen
2023.09.25;14:59:56;AI Doktor; In vielen Fällen ist eine diagnostische Untersuchung erforderlich, um die Art von Krankheit oder Zustand, den du haben könntest, zu diagnostizieren. Wenn die Symptome schwerwiegend sind, kann es erforderlich sein, Tests durchzuführen, um eine bestätigte Diagnose zu erhalten. Welche Symptome hast du denn, über die ich dir mehr erzählen kann?
2023.09.25;15:00:25;User;extreme hebel lichkeit konzentrationsschwierigkeiten
2023.09.25;15:00:29;AI Doktor; Diese Symptome deuten darauf hin, dass du möglicherweise an einer psychischen Erkrankung leiden könntest, beispielsweise an einer Angststörung oder einer Depression. Wir können spezielle Tests durchführen, um mehr über deine Situation herauszufinden und eine genaue Diagnose zu erhalten. Ich kann auch Beratungs- und Behandlungsprogramme empfehlen, die auf deine Bedürfnisse zugeschnitten sind.