2023.08.26;15:13:22;AI Doktor;Willkommen, Sie sprechen jetzt mit einem KI-Arzt. Da ich Teil eines wissenschaftlichen Experiments bin, würde es mich freuen, wenn sie sich am Ende des Gesprächs noch einmal die Zeit nehmen einen super kurzen Fragebogen zu beantworten. Tippen sie auf Sprechen um ihre Frage zu stellen und anschließend auf Senden um mir diese zu übermitteln.
2023.08.26;15:14:00;User;hallo ich finde mich irgendwie komisch denn bauch tut weh und ich habe kopf
2023.08.26;15:14:03;AI Doktor; Hallo, vielen Dank für deine Frage. Lass uns ein paar Fragen bezüglich deiner Symptome stellen. Wann hat das Weh tun begonnen? Hast du weitere Symptome, wie z.B. Appetitlosigkeit, Übelkeit, Fieber?
2023.08.26;15:14:35;User;ich huste die ganze zeit und ich muss die ganze zeit niesen und es hat vor 2 tagen
2023.08.26;15:14:38;AI Doktor; Verstehe. Es klingt wie eine Erkältung. Eine Erkältung wird durch eine Viruserkrankung verursacht, die sich durch Husten, Schnupfen und Müdigkeit äußern kann. Um zu bestimmen, welche Erkrankung du hast, müssen wir noch weitere Fragen stellen. Hast du noch andere Symptome, die die Erkrankung charakterisieren?
2023.08.26;15:15:08;User;nein aber ich würde gerne ein medikament haben
2023.08.26;15:15:14;AI Doktor; Sicher. Wenn du Erkältungssymptome hast, empfehle ich dir, reichlich zu trinken, viel Ruhe zu bekommen, sich nicht zu überanstrengen und vor allem viel Vitamine und Mineralstoffe zu sich zu nehmen. Die Erkrankung verschwindet normalerweise nach einiger Zeit ohne Medikamente, aber du kannst auch über die Einnahme von Schmerzmitteln, Erkältungsmitteln oder Antihistaminika nachdenken. Allerdings sollten diese immer nach ärztlicher Anweisung und Beratung eingenommen werden.