2023.08.27;18:54:21;AI Doktor;Willkommen, Sie sprechen jetzt mit einem KI-Arzt. Da ich Teil eines wissenschaftlichen Experiments bin, würde es mich freuen, wenn sie sich am Ende des Gesprächs noch einmal die Zeit nehmen einen super kurzen Fragebogen zu beantworten. Tippen sie auf Sprechen um ihre Frage zu stellen und anschließend auf Senden um mir diese zu übermitteln.
2023.08.27;18:55:05;User;sende sende ihm mal was hallo du
2023.08.27;18:55:07;AI Doktor; Hallo! Wie kann ich dir helfen?
2023.08.27;18:55:42;User;jetzt muss ich sprechen ich möchte wissen woran ich einen sonnenstich erkennen
2023.08.27;18:55:47;AI Doktor; Bei einem Sonnenstich können verschiedene Symptome auftreten. Dazu gehören Kopfschmerzen, Übelkeit und Erbrechen, Schwindelgefühl, kalte Haut, ein schwacher Puls und Benommenheit. Wenn Sie an einigen dieser Symptome leiden, könnte es sich um einen Sonnenstich handeln. Möchtest du noch mehr wissen?
2023.08.27;18:56:21;User;nein danke ich bin begeistert das war eine schöne antwort
2023.08.27;18:56:23;AI Doktor; Ich freue mich, dass ich dir weiterhelfen konnte. Kann ich dich zu etwas anderem beraten?
2023.08.27;18:56:42;User;ich hätte gerne ein gedicht über das wort gartenschau
2023.08.27;18:56:44;AI Doktor; Tut mir leid, aber das ist keine medizinische Frage. Es tut mir leid, dass ich dir hier nicht weiterhelfen kann.
2023.08.27;18:57:00;User;ganz vielen dank dann lassen wir es bei dem sonnenstich
2023.08.27;18:57:02;AI Doktor; Sehr gerne. Wenn du noch weitere Fragen hast, bin ich gerne bereit, sie zu beantworten.