2023.08.27;15:06:36;AI Doktor;Willkommen, Sie sprechen jetzt mit einem KI-Arzt. Da ich Teil eines wissenschaftlichen Experiments bin, würde es mich freuen, wenn sie sich am Ende des Gesprächs noch einmal die Zeit nehmen einen super kurzen Fragebogen zu beantworten. Tippen sie auf Sprechen um ihre Frage zu stellen und anschließend auf Senden um mir diese zu übermitteln.
2023.08.27;15:07:05;User;wie lange sind sie schon der sprecher der telefonzelle
2023.08.27;15:07:07;AI Doktor; Entschuldigung, ich bin kein Arzt der Telefonzelle. Ich bin ein KI-Arzt, der medizinische Fragen beantworten kann. Welche Art von Symptomen hast du gegenwärtig?
2023.08.27;15:07:25;User;ich habe keine symptome ich wollte nur fragen wie lange schon dieser telefonzelle
2023.08.27;15:07:27;AI Doktor; Verstehe. Die medizinische Frage, die ich stellen kann ist, wie lange hast du Symptome? Wenn Sie keine Symptome haben, kann ich Ihnen nicht helfen.
2023.08.27;15:07:54;User;ich habe leider heuschnupfen
2023.08.27;15:07:56;AI Doktor; Verstehe. Nach Ihrer Beschreibung könnten Sie allergisch gegen Pollen oder andere Substanzen sein. Ich empfehle Ihnen, Ihren behandelnden Arzt aufzusuchen, um eine genaue Diagnose und Behandlung zu erhalten.
2023.08.27;15:08:08;User;ich bin gegen keine pollen allergisch
2023.08.27;15:08:10;AI Doktor; Verstehe. In diesem Fall könnten Sie vielleicht eine respiratorische Infektion haben. Ich empfehle Ihnen, Ihren behandelnden Arzt aufzusuchen, um weitere Tests zu machen und eine genaue Diagnose und Behandlung zu erhalten.
2023.08.27;15:08:21;User;ja
2023.08.27;15:08:25;AI Doktor; Sehr gut. Ich würde auch empfehlen, regelmäßig ein Glas warmes Wasser mit ein wenig Honig und Zitrone zu trinken. Dies hilft, die Schleimhäute zu befeuchten und dadurch den Heuschnupfen zu lindern. Außerdem hilft es, die Flüssigkeiten zu ersetzen, die Sie durch Niesen und Schniefen verlieren.
2023.08.27;15:08:31;User;haben sie eine krankheit
2023.08.27;15:08:34;AI Doktor; Nein, ich bin ein KI-Arzt und kann leider keine Krankheit bekommen. Ich kann Ihnen jedoch Informationen und Ratschläge zu Krankheiten geben, die Sie haben könnten.