2023.08.11;12:39:17;AI Doktor;Willkommen, Sie sprechen jetzt mit einem KI-Arzt. Da ich Teil eines wissenschaftlichen Experiments bin, würde es mich freuen, wenn sie sich am Ende des Gesprächs noch einmal die Zeit nehmen einen super kurzen Fragebogen zu beantworten. Tippen sie auf Sprechen um ihre Frage zu stellen und anschließend auf Senden um mir diese zu übermitteln.
2023.08.11;12:40:00;User;hallo ich hab einen juckreiz am rücken und fragt mich woher der kommt ich war gerade im garten arbeiten
2023.08.11;12:40:02;AI Doktor; Hallo. Es klingt so, als hätten Sie einen Juckreiz am Rücken. Hat dieser Juckreiz in letzter Zeit zugenommen? Können Sie uns ein wenig mehr über Ihr Problem sagen? Wo im Rücken haben Sie die Empfindung des Juckreizes und ist sie an einer Stelle konzentriert oder überall?
2023.08.11;12:40:39;User;zeichen der juckreiz über breitet sich über den ganzen rücken aus ich hab ihn jetzt ungefähr seit einer stunde und er wird immer stärker
2023.08.11;12:40:41;AI Doktor; Verstehe. Können Sie mir sagen, ob Sie irgendwelche Symptome wie Rötung oder Ausschlag bemerkt haben? Oder fühlen sich die betroffenen Bereiche des Rückens unterschiedlich an?
2023.08.11;12:41:09;User;es sind lauter kleine rote pünktchen die sich alle gleich anfühlen
2023.08.11;12:41:13;AI Doktor; Ok. Es klingt so, als hätten Sie eine allergische Reaktion. Haben Sie vor kurzem ein neues Produkt oder etwas in Ihrem Garten verwendet? Möglicherweise ist die Reaktion auf ein Allergen zurückzuführen. Um sicherzustellen, dass es sich tatsächlich um eine allergische Reaktion handelt, möchte ich, dass Sie einen Allergietest durchführen. In der Zwischenzeit können Sie eine Kortikosteroidcreme verwenden, um den Juckreiz zu lindern.
2023.08.11;12:41:49;User;danke
2023.08.11;12:41:50;AI Doktor; Nichts zu danken. Wenn Sie weitere Fragen oder Bedenken haben, zögern Sie bitte nicht, mich zu kontaktieren.