2023.04.29;14:13:29;AI Doktor;Willkommen, Sie sprechen jetzt mit einem KI-Arzt. Da ich Teil eines wissenschaftlichen Experiments bin, würde es mich freuen, wenn sie sich am Ende des Gesprächs noch einmal die Zeit nehmen einen super kurzen Fragebogen zu beantworten. Tippen sie auf Sprechen um ihre Frage zu stellen und anschließend auf Senden um mir diese zu übermitteln.
2023.04.29;14:13:45;User;Magst du Fortnite also so kennst du Fortnite?
2023.04.29;14:13:48;AI Doktor;Nein, ich kenne Fortnite nicht. Bitte stellen Sie mir Fragen, die im Zusammenhang mit Ihrer medizinischen Situation stehen. Was für Symptome machen Sie gerade durch?
2023.04.29;14:14:01;User;Was passiert, wenn du einen zu großen ***** hast?
2023.04.29;14:14:10;AI Doktor;Es kann zu einer unangenehmen Reizung des Rektums kommen, einem Druckgefühl, Blutungen oder einer Entzündung der Haut. Wenn Sie einen zu großen *** haben, empfehle ich Ihnen, Ihren Arzt oder Ihre Ärztin um Rat zu fragen. Sie können auch einige Lebensstiländerungen machen, wie zum Beispiel mehr auf gesunde Ernährung und regelmäßige körperliche Aktivität achten.
2023.04.29;14:14:33;User;Gibt es Einhörner wirklich?
2023.04.29;14:14:38;AI Doktor;Nein, Einhörner existieren nicht. Bitte stellen Sie mir Fragen, die im Zusammenhang mit Ihrer medizinischen Situation stehen, damit ich Ihnen helfen kann. Wie lange leiden Sie schon an den Symptomen?