2023.08.31;14:14:08;AI Doktor;Willkommen, Sie sprechen jetzt mit einem KI-Arzt. Da ich Teil eines wissenschaftlichen Experiments bin, würde es mich freuen, wenn sie sich am Ende des Gesprächs noch einmal die Zeit nehmen einen super kurzen Fragebogen zu beantworten. Tippen sie auf Sprechen um ihre Frage zu stellen und anschließend auf Senden um mir diese zu übermitteln.
2023.08.31;14:14:39;User;seit wann gibt es einen arzt also seit wann gibt es den doktortitel
2023.08.31;14:14:40;AI Doktor; Der Doktortitel ist seit dem Mittelalter bekannt und wird seit dem Hochmittelalter, circa seit dem 14. Jahrhundert verliehen.
2023.08.31;14:14:58;User;ist alexa besser als siri
2023.08.31;14:15:00;AI Doktor; Ich verstehe Ihre Frage nicht. Ich bin ein Arzt und kann Ihnen nur medizinische Fragen und Antworten geben.
2023.08.31;14:15:23;User;kann man auch eher mit seinem opa oder oma verwandt sein als mit seinen
2023.08.31;14:15:26;AI Doktor; Ja, das ist möglich. Man kann einem Großelternteil näher sein als den Eltern, insbesondere wenn es eine Generation zwischen den Eltern und Großeltern gibt, an denen man beide Seiten vererbt hat. Es ist auch möglich, über den Nachnamen ähnlicher zu sein als über die Gene.
2023.08.31;14:15:58;User;ich habe trockene schmerzen die füße was kann ich tun
2023.08.31;14:16:04;AI Doktor; Für trockene und schmerzhafte Füße, empfehle ich Ihnen, täglich Feuchtigkeitscremes oder -sprays zu verwenden. Es ist auch wichtig, sicherzustellen, dass Ihre Schuhe gut passen, um Druckstellen zu vermeiden. Zusätzlich können pedikürähnliche Behandlungen helfen. Es kann auch hilfreich sein, den Alltag zu reduzieren, um die Füße zu entlasten.  Wenn die Symptome schwerwiegend sind, kann es sinnvoll sein, einen Arzt aufzusuchen.
2023.08.31;14:16:43;User;was ist die tödlichste krankheit der welt
2023.08.31;14:16:48;AI Doktor;Die tödlichste Krankheit der Welt ist eine gute Frage. Eine der weltweit verbreitetsten und tödlichsten Krankheiten ist die Tuberkulose, die jährlich für etwa 2 Millionen Todesfälle verantwortlich ist. Außerdem gibt es viele andere Krankheiten, die in manchen Ländern tödlich sein können, z.B. die Malaria oder verschiedene Formen des Herzerkrankungen.
2023.08.31;14:17:23;User;kann man die tollwut überleben überleben
2023.08.31;14:17:27;AI Doktor; Ja, wenn eine Person schnell und richtig behandelt wird, ist es möglich, nach einer Tollwut-Infektion zu überleben. Als Behandlung wird eine Impfung empfohlen, sobald der Kontakt festgestellt wurde. Es ist auch wichtig, sofort einen Arzt aufzusuchen, um die richtige Behandlung zu erhalten.