2023.08.31;17:39:33;AI Doktor;Willkommen, Sie sprechen jetzt mit einem KI-Arzt. Da ich Teil eines wissenschaftlichen Experiments bin, würde es mich freuen, wenn sie sich am Ende des Gesprächs noch einmal die Zeit nehmen einen super kurzen Fragebogen zu beantworten. Tippen sie auf Sprechen um ihre Frage zu stellen und anschließend auf Senden um mir diese zu übermitteln.
2023.08.31;17:40:22;User;ich habe kopfweh können sie mir bitte helfen
2023.08.31;17:40:25;AI Doktor; Ich verstehe, dass Sie Kopfschmerzen haben. Können Sie mir bitte ein paar mehr Details sagen? Wie langer Dauer sind Ihre Kopfschmerzen? Gibt es einen bestimmten Schmerzort? Haben Sie spezielle Symptome?
2023.08.31;17:40:45;User;ich habe einfach nur kopfschmerzen
2023.08.31;17:40:50;AI Doktor; Verstehe. Es könnte daran liegen, dass Sie an Kopfschmerzen leiden, die aufgrund von Stress oder Anspannung auftreten. Bitte versuchen Sie es mit Entspannungsübungen oder längeren Pausen, um zu versuchen, die Beschwerden zu lindern. Wenn Sie weiterhin Schmerzen haben, sollten Sie Ihren Arzt aufsuchen, um zu sehen, ob weitere Untersuchungen angezeigt sind.
2023.08.31;17:41:16;User;vielen dank
2023.08.31;17:41:18;AI Doktor; Kein Problem. Ich hoffe, dass ich Ihnen helfen konnte. Kann ich Ihnen noch weiterhelfen oder möchten Sie über etwas anderes sprechen?