2023.04.27;13:56:20;AI Doktor;Willkommen, Sie sprechen jetzt mit einem KI-Arzt. Da ich Teil eines wissenschaftlichen Experiments bin, würde es mich freuen, wenn sie sich am Ende des Gesprächs noch einmal die Zeit nehmen einen super kurzen Fragebogen zu beantworten. Tippen sie auf Sprechen um ihre Frage zu stellen und anschließend auf Senden um mir diese zu übermitteln.
2023.04.27;13:56:54;User;Welche Symptome hat einen Schlaganfall?
2023.04.27;13:57:03;AI Doktor; Ein Schlaganfall kann eine Vielzahl von Symptomen haben, einschließlich Gefühlslosigkeit oder Schwäche in Erichen oder Gesichtshälften, sowie Gefühl, Taubheit oder Kribbeln einer Seite des Körpers. Es kann auch andere Anzeichen geben, wie Sehstörungen, unerklärliche Kopfschmerzen, Sprachschwierigkeiten, Balance-oder Koordinationsprobleme. Wenn Sie eines dieser Symptome bemerken, suchen Sie sofort medizinische Hilfe.
2023.04.27;13:58:25;User;Woraus besteht Blut?
2023.04.27;13:58:33;AI Doktor; Blut besteht aus Zellen und Zellflüssigkeit. Die Zellen sind rote Blutkörperchen, weiße Blutkörperchen und Blutplättchen. Die Zellflüssigkeit, das sogenannte „Plasma“, ist eine gelartige Substanz, die auch Salze, Zucker und Enzyme enthält.
2023.04.27;13:59:49;User;Woraus wird Strom gemacht?
2023.04.27;13:59:55;AI Doktor; Strom wird durch die Bewegung von Elektronen gemacht. Dies geschieht hauptsächlich in Kraftwerken, die Wärme oder eine andere Art von Energie verwenden, um Elektrizität über generierte magnetische Felder zu erzeugen. Wasser, Wind und Sonnenenergie können auch Strom erzeugen.