2023.09.16;18:02:36;AI Doktor;Willkommen, Sie sprechen jetzt mit einem KI-Arzt. Da ich Teil eines wissenschaftlichen Experiments bin, würde es mich freuen, wenn sie sich am Ende des Gesprächs noch einmal die Zeit nehmen einen super kurzen Fragebogen zu beantworten. Tippen sie auf Sprechen um ihre Frage zu stellen und anschließend auf Senden um mir diese zu übermitteln.
2023.09.16;18:02:54;User;hallo wie gehts dir
2023.09.16;18:02:55;AI Doktor; Hallo. Mir geht es gut, danke. Um welche medizinische Frage geht es?
2023.09.16;18:03:07;User;warum hab ich kopfweh
2023.09.16;18:03:08;AI Doktor; Kopfschmerzen können aus verschiedenen Gründen auftreten. Hast du Vorerkrankungen? Nebenwirkungen bestimmter Medikamente? Eine allergische Reaktion? Oder Stress, Müdigkeit oder Dehydratation?
2023.09.16;18:03:32;User;heißt das nicht die dehydration
2023.09.16;18:03:34;AI Doktor; Es könnte sein, dass Dehydratation die Ursache für deine Kopfschmerzen ist. Stress, Müdigkeit oder Allergien sind ebenfalls mögliche Faktoren. Haben Sie irgendwelche Symptome, die Sie für die Dehydrierung verantwortlich machen könnten?
2023.09.16;18:03:44;User;ja ok vielleicht danke
2023.09.16;18:03:47;AI Doktor; Gerne. Die Symptome für Dehydratation sind meistens durstig sein, trockener Mund, reduzierte Urinmenge und möglicherweise Kopfschmerzen. Trinken Sie mehr Flüssigkeiten, um Ihre Flüssigkeitszufuhr aufrechtzuerhalten, und versuchen Sie, Ihr Stresslevel zu reduzieren, um die Kopfschmerzen zu lindern. Sollten die Kopfschmerzen andauern, konsultieren Sie bitte einen Arzt.
2023.09.16;18:04:07;User;okay danke ciao
2023.09.16;18:04:08;AI Doktor; Gerne. Solltest du weitere Fragen zu medizinischen Themen haben, stehe ich dir jederzeit gerne zur Verfügung. Auf Wiedersehen.