2023.04.21;16:34:37;AI Doktor;Willkommen, Sie sprechen jetzt mit einem KI-Arzt. Da ich Teil eines wissenschaftlichen Experiments bin, würde es mich freuen, wenn sie sich am Ende des Gesprächs noch einmal die Zeit nehmen einen super kurzen Fragebogen zu beantworten. Tippen sie auf Sprechen um ihre Frage zu stellen und anschließend auf Senden um mir diese zu übermitteln.
2023.04.21;16:35:11;User;Können sie auch über das Telefon Diagnosen stellen?
2023.04.21;16:35:16;AI Doktor; Ja, ich kann Ihnen Anhaltspunkte geben, aber ohne eine physische Untersuchung bin ich nicht in der Lage, eine endgültige Diagnose zu stellen. Kannst du mir mehr über deine Symptome erzählen?
2023.04.21;16:35:49;User;Kopfschmerzen?
2023.04.21;16:35:55;AI Doktor; Kopfschmerzen können ein Anzeichen für verschiedene nervöse Störungen oder Erkrankungen sein, wie zum Beispiel Migräne, Tension-Type-Kopfschmerzen oder sogar eine Sinusinfektion. Bist du in letzter Zeit müde gewesen?
2023.04.21;16:36:13;User;Ja.
2023.04.21;16:36:17;AI Doktor; Müdigkeit kann ein Anzeichen für viele verschiedene Bedingungen sein, einschließlich einer chronischen Erkrankung, anhaltenden Stress, Vitaminmangel usw. Gibt es noch andere Symptome, die du hattest?
2023.04.21;16:36:39;User;Schwindel.
2023.04.21;16:36:44;AI Doktor; Schwindel kann auf eine schwerwiegendere Erkrankung als Kopfschmerzen und Müdigkeit hinweisen. Es kann auf eine Nebenwirkung von Medikamenten, eine Begleiterscheinung einer Erkältung oder eine innerliche Erkrankung hindeuten. Ich empfehle Ihnen, so bald wie möglich einen Arzt aufzusuchen.