2023.07.22;14:32:45;AI Doktor;Willkommen, Sie sprechen jetzt mit einem KI-Arzt. Da ich Teil eines wissenschaftlichen Experiments bin, würde es mich freuen, wenn sie sich am Ende des Gesprächs noch einmal die Zeit nehmen einen super kurzen Fragebogen zu beantworten. Tippen sie auf Sprechen um ihre Frage zu stellen und anschließend auf Senden um mir diese zu übermitteln.
2023.07.22;14:32:55;User;Warum muss ich dauernd Husten?
2023.07.22;14:33:01;AI Doktor; Das ist eine sehr gute Frage. Es gibt eine Reihe potenzieller Ursachen. Möglicherweise leiden Sie unter einer allergischen Reaktion, einer Erkältung oder einer Lungenentzündung. Dies lässt sich jedoch nur anhand weiterer Symptome wie Fieber, Atemnot, Verstopfung der Nase usw. feststellen. Einige dieser Symptome können auch mithilfe eines Online-Selbsttests überprüft werden. Fällt Ihnen bei Ihrem Husten noch etwas auf?
2023.07.22;14:33:41;User;Was, Nein, habe ich gesagt? Nein.
2023.07.22;14:33:44;AI Doktor; Ich verstehe. Wir können Ihnen online einige Tests anbieten, anhand derer wir möglicherweise mehr über Ihren Husten herausfinden können. Diese Tests können Ihnen ein besseres Bild Ihrer Symptome geben und Ihnen mögliche Verdachtsdiagnosen geben.
2023.07.22;14:34:07;User;Okay.
2023.07.22;14:34:09;AI Doktor; Sehr gut. Ich kann Ihnen einige Fragen stellen, anhand derer wir einige Tests empfehlen können. Lassen Sie uns damit beginnen. Haben Sie Fieber oder Atemnot?
2023.07.22;14:34:23;User;Nein.
2023.07.22;14:34:25;AI Doktor; In Ordnung. Haben Sie neben dem Husten vielleicht auch Nasenverstopfung oder andere Symptome?
2023.07.22;14:34:33;User;!!! Senden geklickt ohne Input !!!
2023.07.22;14:34:35;AI Doktor; Entschuldigung, ich habe Sie nicht verstanden. Können Sie nochmal wiederholen? Haben Sie neben dem Husten vielleicht auch Nasenverstopfung oder andere Symptome?
2023.07.22;14:34:46;User;Nein.
2023.07.22;14:34:51;AI Doktor; Sehr gut. Da Sie über Fieber, Atemnot und andere Symptome nicht Bescheid gesagt haben, würde ich Ihnen empfehlen, eine allergische Reaktion zu prüfen, indem Sie nach möglichen Allergenen in Ihrer Umgebung suchen und diese bei Bedarf meiden. Ich würde zudem vorschlagen, dass Sie einige Entspannungsübungen ausprobieren, um Ihren Husten in den Griff zu bekommen.
2023.07.22;14:35:22;User;Was für Entspannungsübungen sind das?
2023.07.22;14:35:26;AI Doktor; Es gibt verschiedene Arten von Entspannungsübungen, die Sie ausprobieren können. Einige Beispiele dafür sind progressive Muskelentspannung, tiefes Atmen, Visualisierung und Yoga. Es kann auch sehr hilfreich sein, Stressabbau-Apps auf Ihrem Smartphone oder Computer zu verwenden.
2023.07.22;14:35:50;User;Und das soll helfen?
2023.07.22;14:35:52;AI Doktor; Ja, es gibt Beweise, dass Entspannungsübungen helfen, den Husten zu lindern und Ihnen dabei helfen, ein gesünderes allgemeines Wohlbefinden zu erreichen. Es lohnt sich zu versuchen und mit der Zeit wird der Husten schwächer werden.
2023.07.22;14:36:13;User;Alles klar. Dankeschön.
2023.07.22;14:36:14;AI Doktor; Gerne geschehen. Wenn Sie noch weitere Fragen haben sollten, zögern Sie nicht mich zu kontaktieren. Ich wünsche Ihnen alles Gute!