2023.09.17;14:24:42;AI Doktor;Willkommen, Sie sprechen jetzt mit einem KI-Arzt. Da ich Teil eines wissenschaftlichen Experiments bin, würde es mich freuen, wenn sie sich am Ende des Gesprächs noch einmal die Zeit nehmen einen super kurzen Fragebogen zu beantworten. Tippen sie auf Sprechen um ihre Frage zu stellen und anschließend auf Senden um mir diese zu übermitteln.
2023.09.17;14:25:13;User;was kann ich bei einer sprunggelenksverletzung machen überdehnung des der bänder
2023.09.17;14:25:17;AI Doktor; Hallo. Es tut mir leid, dass du dir das Sprunggelenk verletzt hast. Um die bestmögliche Behandlung zu erhalten, solltest du zuerst deinen Arzt aufsuchen. Ärzte können Bildgebungsverfahren wie Ultraschall oder Röntgen anwenden, um festzustellen, ob du eine überdehnung der Bänder hast. Symptome einer überdehnung der Bänder können Schwellungen oder Blutergüsse an der Seite des Knöchels sein. Normalerweise empfehlen Ärzte die Anwendung von Kälte, die Einnahme von entzündungshemmenden Arzneimitteln oder eine kurze physische Rehabilitation.
2023.09.17;14:26:01;User;!!! Senden geklickt ohne Input !!!
2023.09.17;14:26:02;AI Doktor; Hallo, ich bin Dr.Digital und kann dir bei medizinischen Fragen helfen. Wie kann ich dir heute helfen?
2023.09.17;14:26:25;User;so jetzt hast du mir wächst eine bohne aus dem ohr was kann ich
2023.09.17;14:26:26;AI Doktor; Hallo. Bitte stelle eine eindeutigere Frage, damit ich besser verstehen kann, wie ich dir helfen kann. Was konkret würdest du gerne wissen?
2023.09.17;14:26:41;User;was kann ich gegen eine bohne im im ohr tun
2023.09.17;14:26:45;AI Doktor; Hallo. Eine solche Erkrankung erfordert eine Behandlung durch einen medizinischen Fachkräfte, da es sich um eine schwerwiegende Erkrankung handeln kann. Wenn du eine Bohne im Ohr hast, musst du zuerst einen Arzt aufsuchen. Der Arzt wird eine Reihe von Tests wie ein Hörtest oder einen CT-Scan durchführen, um unterschiedliche Ursachen wie eine Tumorwucherung oder eine Entzündung des Mittelohrs auszuschließen. Er wird dann eine Behandlung entsprechend der Diagnose vorschlagen.