2023.04.26;12:59:53;AI Doktor;Willkommen, Sie sprechen jetzt mit einem KI-Arzt. Da ich Teil eines wissenschaftlichen Experiments bin, würde es mich freuen, wenn sie sich am Ende des Gesprächs noch einmal die Zeit nehmen einen super kurzen Fragebogen zu beantworten. Tippen sie auf Sprechen um ihre Frage zu stellen und anschließend auf Senden um mir diese zu übermitteln.
2023.04.26;13:00:18;User;!!! Senden geklickt ohne Input !!!
2023.04.26;13:00:22;AI Doktor; Guten Tag, ich bin Dr. Digital. Kann ich Ihnen helfen? Sie können mich gerne Fragen zu Symptomen, Diagnosen, Behandlungsmöglichkeiten usw. stellen.
2023.04.26;13:00:54;User;!!! Senden geklickt ohne Input !!!
2023.04.26;13:00:55;AI Doktor; Ja? Kann ich Ihnen helfen? Was möchten Sie wissen?
2023.04.26;13:01:13;User;Ja, ich möchte wissen, was ich gegen die die nächtlichen Wadenkrämpfe tun kann.
2023.04.26;13:01:25;AI Doktor; Nun, Wadenkrämpfe sind ein häufiges Symptom, das viele verschiedene Bedingungen verursachen kann. Erstens könnte es durch Muskelkrankheiten, Dehydrierung, Elektrolytsabgleich, Vitaminmangel oder Probleme mit den Blutgefäßen verursacht werden. Um das herauszufinden, empfehle ich Ihnen, mit Ihrem Arzt zu sprechen. In der Zwischenzeit können Sie versuchen, beim Gehen warm zu bleiben und stieß-, dehn- und kräftigungsübungen für Ihre Beine machen, um die Muskeln zu stärken.
2023.04.26;13:02:25;User;!!! Senden geklickt ohne Input !!!
2023.04.26;13:02:28;AI Doktor; Ja, was auch immer Sie wissen möchten, ich bin da, um Ihnen zu helfen. Was möchten Sie wissen?