2023.08.08;13:05:46;AI Doktor;Willkommen, Sie sprechen jetzt mit einem KI-Arzt. Da ich Teil eines wissenschaftlichen Experiments bin, würde es mich freuen, wenn sie sich am Ende des Gesprächs noch einmal die Zeit nehmen einen super kurzen Fragebogen zu beantworten. Tippen sie auf Sprechen um ihre Frage zu stellen und anschließend auf Senden um mir diese zu übermitteln.
2023.08.08;13:06:18;User;hallo ich hatte heute morgen starke kopfschmerzen was kann ich tun
2023.08.08;13:06:22;AI Doktor; Guten Tag. Es tut mir leid, dass Sie unter Kopfschmerzen leiden. Magen-Darm-Probleme können Kopfschmerzen verursachen. Ich empfehle Ihnen daher, eine Stuhlprobe abzugeben, um zu sehen, ob die Kopfschmerzen mit einer Magen-Darm-Erkrankung zusammenhängen. Medikamente und natürliche Schmerzmittel können Ihnen auch helfen, die Symptome zu lindern. Zögern Sie nicht, Ihren Arzt zu kontaktieren, wenn Sie weitere Fragen oder Bedenken haben.
2023.08.08;13:07:03;User;die kopfschmerzen sind sehr heftig und führen dazu dass mir auch sogar übel wird
2023.08.08;13:07:08;AI Doktor; Es tut mir leid, dass Sie so heftige Kopfschmerzen und Übelkeit haben. Allergien und Infektionen können ebenfalls zu Kopfschmerzen und Übelkeit führen. Ich empfehle Ihnen, ein Blutbild und eine Urinprobe machen zu lassen, um mögliche Infektionen und Allergene auszuschließen. Möglicherweise müssen Sie sich auch für eine Immuntherapie anmelden. Wenn die Kopfschmerzen und die Übelkeit anhalten, kontaktieren Sie sofort Ihren Arzt.
2023.08.08;13:07:53;User;vielen dank für den tipp sie sind sehr vielseitig die tipps ich muss mich da mit sehr vielen ärzten dann in verbindung setzen
2023.08.08;13:07:57;AI Doktor; Es freut mich, dass meine Tipps Ihnen helfen. Rufen Sie Ihre Ärzte an und besprechen Sie mit ihnen die weitere Behandlung. Einige Ärzte können möglicherweise Ihren Zustand telefonisch überwachen, während andere Tests oder Untersuchungen vorschlagen. Sollten Sie unsicher sein oder Hilfe bei Diagnose oder Behandlung benötigen, rufen Sie mich jederzeit an.
2023.08.08;13:08:28;User;vielen dank für ihre auskunft
2023.08.08;13:08:30;AI Doktor; Keine Ursache. Es freut mich, Ihnen helfen zu können. Wenn Sie noch weitere Fragen oder Bedenken haben, zögern Sie nicht, mich zu kontaktieren.
2023.08.08;13:08:48;User;so habe ich nicht
2023.08.08;13:08:51;AI Doktor; Wenn Sie weitere Fragen haben, stehe ich Ihnen jederzeit gerne zur Verfügung. Wenn nicht, wünsche ich Ihnen eine erfolgreiche Behandlung.
2023.08.08;13:09:04;User;dankeschön ich bin zufrieden
2023.08.08;13:09:06;AI Doktor; Ich freue mich über Ihre Zufriedenheit. Ich wünsche Ihnen alles Gute und viel Erfolg bei der Behandlung!
2023.08.08;13:09:18;User;auf
2023.08.08;13:09:18;AI Doktor; Auf Wiedersehen!