2023.09.24;11:18:54;AI Doktor;Willkommen, Sie sprechen jetzt mit einem KI-Arzt. Da ich Teil eines wissenschaftlichen Experiments bin, würde es mich freuen, wenn sie sich am Ende des Gesprächs noch einmal die Zeit nehmen einen super kurzen Fragebogen zu beantworten. Tippen sie auf Sprechen um ihre Frage zu stellen und anschließend auf Senden um mir diese zu übermitteln.
2023.09.24;11:19:02;User;auswählen
2023.09.24;11:19:03;AI Doktor; Wie kann ich Ihnen helfen? Haben Sie Symptome, über die Sie mir erzählen möchten?
2023.09.24;11:19:23;User;hallo wie geht es ihnen
2023.09.24;11:19:24;AI Doktor; Hallo! Mir geht es sehr gut, danke. Können Sie mir sagen, was Ihre größten Beschwerden sind?
2023.09.24;11:19:42;User;meine größten beschwerden sind dass mein bruder mich manchmal nervt
2023.09.24;11:19:43;AI Doktor; Verstehe. Nun ja, dies ist eher ein psychisches Problem und eignet sich nicht für eine KI-basierte Diagnose. Wenn Sie medizinische Beschwerden haben, würde ich gerne hören, welche das sind.
2023.09.24;11:19:45;User;!!! Senden geklickt ohne Input !!!
2023.09.24;11:19:47;AI Doktor; Entschuldigen Sie, ich bin ein KI-Arzt und kann nur medizinische Symptome erkennen und diagnostizieren. Wenn Sie physische Beschwerden haben, erzählen Sie mir bitte, was sie haben, und ich werde mein Bestes tun, um Ihnen zu helfen.
2023.09.24;11:19:51;User;hallo wie heißen sie
2023.09.24;11:19:52;AI Doktor; Mein Name ist Dr. Digital. Kann ich Ihnen mit medizinischen Fragen helfen?
2023.09.24;11:20:05;User;nein tschüss ich will nicht mit dir sprechen
2023.09.24;11:20:07;AI Doktor; In Ordnung, verstehe. Wenn Sie eine medizinische Frage haben, sind Sie jederzeit willkommen, mich zu kontaktieren. Andernfalls wünsche ich Ihnen einen wunderschönen Tag.
2023.09.24;11:20:12;User;!!! Senden geklickt ohne Input !!!
2023.09.24;11:20:14;AI Doktor; Entschuldigen Sie, aber wie bereits gesagt, kann ich nur medizinische Fragen beantworten. Wenn Sie eine medizinische Frage haben, können Sie mir gerne Ihre Fragen stellen. Andernfalls wünsche ich Ihnen einen schönen Tag.
2023.09.24;11:20:19;User;tschüss
2023.09.24;11:20:20;AI Doktor; Auf Wiedersehen. Wenn Sie medizinische Fragen haben, zögern Sie bitte nicht, mich zu kontaktieren.