2023.10.01;14:48:35;AI Doktor;Willkommen, Sie sprechen jetzt mit einem KI-Arzt. Da ich Teil eines wissenschaftlichen Experiments bin, würde es mich freuen, wenn sie sich am Ende des Gesprächs noch einmal die Zeit nehmen einen super kurzen Fragebogen zu beantworten. Tippen sie auf Sprechen um ihre Frage zu stellen und anschließend auf Senden um mir diese zu übermitteln.
2023.10.01;14:48:59;User;!!! Senden geklickt ohne Input !!!
2023.10.01;14:49:00;AI Doktor; Hallo, was kann ich heute für Sie tun? Wie lautet Ihr Anliegen?
2023.10.01;14:49:12;User;!!! Senden geklickt ohne Input !!!
2023.10.01;14:49:13;AI Doktor; Ich freue mich, Sie zu treffen. Bitte erzählen Sie mir mehr über die Symptome, an denen Sie leiden. Was ist Ihre Beschwerde?
2023.10.01;14:49:25;User;!!! Senden geklickt ohne Input !!!
2023.10.01;14:49:27;AI Doktor; Tut mir leid, dass du offensichtlich ein paar Schwierigkeiten hast. Wie wäre es, wenn du mir erzählst, auf welche Symptome du dich konzentrierst? Ich helfe Ihnen gern, wo ich kann.
2023.10.01;14:49:38;User;!!! Senden geklickt ohne Input !!!
2023.10.01;14:49:40;AI Doktor; Verstehe. Können Sie mir mehr Details über Ihre Symptome, Beschwerden und Otherklagen erzählen? Wir können vielleicht herausfinden, was der Auslöser sein könnte.
2023.10.01;14:50:01;User;ich hab
2023.10.01;14:50:03;AI Doktor; Ich verstehe. Können Sie mir bitte mehr Details über Ihre Symptome, Beschwerden und Klagen erzählen? Welche Beschwerden verspüren Sie? Welche Symptome haben Sie?
2023.10.01;14:50:21;User;Speech Recognizer is now stopped.
2023.10.01;14:50:23;AI Doktor; Verstehe. Können Sie mir bitte mehr Details über Ihre Symptome, Beschwerden und Klagen erzählen? Möchten Sie, dass ich Ihnen einige Verdachtsdiagnosen gebe, um die mögliche Krankheit zu bestimmen?
2023.10.01;14:50:39;User;sprechen hallo ich habe eierschmerzen
2023.10.01;14:50:42;AI Doktor; Verstehe. Ein häufiges Symptom für Eierstockentzündungen ist Schmerzen im unteren Rücken und Unterleib. Haben Sie auch Symptome wie Schmerzen in der Brust, Erbrechen, Fieber, starke Blutungen oder Veränderungen beim Wasserlassen?
2023.10.01;14:51:06;User;Speech Recognizer is now stopped.
2023.10.01;14:51:08;AI Doktor; Verstehe. Würden Sie mir bitte mitteilen, welche weiteren Symptome Sie haben? Aufgrund dieser Symptome versuche ich, eine Verdachtsdiagnose zu stellen und Ihnen konkrete Behandlungstipps zu geben.