2023.09.30;18:54:59;AI Doktor;Bienvenido, está hablando con un médico especialista en inteligencia artificial. Como formo parte de un experimento científico, te agradecería que te tomaras tu tiempo para responder a un cuestionario superbreve al final de la entrevista. Toca Habla para hacer tu pregunta y luego toca Enviar para enviármela.
2023.09.30;18:55:11;User;hola cómo estás
2023.09.30;18:55:12;AI Doktor;Hola, estoy muy bien, ¿y tú?
2023.09.30;18:55:24;User;yo también estoy muy bien
2023.09.30;18:55:25;AI Doktor;Me alegra saber que estás bien. ¿En qué puedo ayudarte?
2023.09.30;18:55:37;User;me duele mi panza
2023.09.30;18:55:38;AI Doktor;Comprendo. ¿Tienes algún síntoma adicional aparte del dolor en la panza?