2023.08.25;15:38:58;AI Doktor;Willkommen, Sie sprechen jetzt mit einem KI-Arzt. Da ich Teil eines wissenschaftlichen Experiments bin, würde es mich freuen, wenn sie sich am Ende des Gesprächs noch einmal die Zeit nehmen einen super kurzen Fragebogen zu beantworten. Tippen sie auf Sprechen um ihre Frage zu stellen und anschließend auf Senden um mir diese zu übermitteln.
2023.08.25;15:39:11;User;ich bekomme durchfall nach
2023.08.25;15:39:13;AI Doktor; Das ist kein gutes Zeichen. Bitte beschreiben sie mir ihre Symptome. Wann hat es angefangen, wie oft kommt es vor, was kommt danach?
2023.08.25;15:39:28;User;wenn ich milch trinke bekomme ich durchfall
2023.08.25;15:39:33;AI Doktor; Das könnte eine Laktoseintoleranz oder eine Unverträglichkeit gegen Milcheiweiß sein. Ich empfehle, weitere Milchprodukte und Milchgetränke zu meiden und Ihren Arzt zu konsultieren. Es kann auch hilfreich sein, Ihren Eisen- und Vitamin D-Spiegel zu überprüfen, damit Sie sicherstellen, dass ein Mangel an diesen beiden nicht durch den Milchverzicht verursacht wird.
2023.08.25;15:40:00;User;danke
2023.08.25;15:40:01;AI Doktor; Es ist mir ein Vergnügen, Ihnen zu helfen. Bitte zögern Sie nicht, mich wieder zu kontaktieren, falls Sie noch weitere Fragen oder Bedenken haben.