2023.09.25;12:19:44;AI Doktor;Willkommen, Sie sprechen jetzt mit einem KI-Arzt. Da ich Teil eines wissenschaftlichen Experiments bin, würde es mich freuen, wenn sie sich am Ende des Gesprächs noch einmal die Zeit nehmen einen super kurzen Fragebogen zu beantworten. Tippen sie auf Sprechen um ihre Frage zu stellen und anschließend auf Senden um mir diese zu übermitteln.
2023.09.25;12:20:14;User;ja hallo ich habe schreckliche kopfschmerzen was soll
2023.09.25;12:20:16;AI Doktor;Hallo! Es tut mir leid zu hören, dass du Kopfschmerzen hast. Kannst du mir ein wenig mehr über deine Symptome erzählen? Was für eine Art von Kopfschmerzen hast du? Sind die Schmerzen ein stechendes Gefühl oder mehr ein dumpfer Schmerz? Wie lange dauern sie an? Hast du andere Symptome wie Schläfrigkeit oder Fieber?
2023.09.25;12:20:52;User;das ist so ein dumm stehender schmerz und die ganze zeit schon also 2 stunden ungefähr
2023.09.25;12:20:55;AI Doktor;Danke dass du mehr darüber erzählt hast. Können wir vielleicht herausfinden, was die Ursache für die Kopfschmerzen ist. Hast du irgendwelche anderen Symptome wie Schwindel, Übelkeit oder Erbrechen? Es können auch allergische Reaktionen, Stress oder sogar Dehydratation die Ursache sein. Versuche mal ein Glas Wasser zu trinken und in Ruhe zu entspannen. Wenn deine Kopfschmerzen nicht nach einer Weile nachlassen, lass es mich bitte wissen.
2023.09.25;12:21:30;User;ich habe schon versucht die lassen nicht nach
2023.09.25;12:21:34;AI Doktor;Verstehe. In diesem Fall kann es möglicherweise eine Migräne sein. Ich würde dir empfehlen, über einige übliche Behandlungsmethoden nachzudenken, um deine Kopfschmerzen zu lindern. Dazu gehören schmerzstillende Arzneimittel, Kontrastbäder und frische Luft. Versuche auch, Stress und Müdigkeit abzubauen, indem du regelmäßig schläfst, Entspannungstechniken ausprobierst und gesund isst. Wenn deine Kopfschmerzen nicht nach einer Weile besser werden, suche bitte einen Arzt auf, um eine genaue Diagnose zu bekommen.
2023.09.25;12:22:13;User;ich bedanke mich im
2023.09.25;12:22:15;AI Doktor;Gerne, es freut mich, dir helfen zu können. Wenn du noch weitere medizinische Fragen hast, stehe ich gerne jederzeit zur Verfügung.