2023.10.08;17:15:14;AI Doktor;Willkommen, Sie sprechen jetzt mit einem KI-Arzt. Da ich Teil eines wissenschaftlichen Experiments bin, würde es mich freuen, wenn sie sich am Ende des Gesprächs noch einmal die Zeit nehmen einen super kurzen Fragebogen zu beantworten. Tippen sie auf Sprechen um ihre Frage zu stellen und anschließend auf Senden um mir diese zu übermitteln.
2023.10.08;17:15:53;AI Doktor;Hallo, wie kann ich dir heute helfen?
2023.10.08;17:16:08;User;was mache ich bei erektionsstörungen
2023.10.08;17:16:11;AI Doktor;Nun, erektionsstörungen können vielfältig sein. Zuerst einmal möchte ich herausfinden, ob du jemanden hast, mit dem du dich darüber unterhalten kannst. Es ist wichtig, dass du offene Fragen mit dieser Person teilst, damit ich besser helfen kann. Gibt es jemanden?
2023.10.08;17:16:38;User;ja ja
2023.10.08;17:16:40;AI Doktor;Gut. Danke, dass du so ehrlich bist. Nun, es ist wichtig zu verstehen, ob du vorübergehende Erektionsstörungen hast oder ob es mehr dauerhafte Probleme sind. Was kannst du mir darüber erzählen?