2023.09.09;12:25:49;AI Doktor;Willkommen, Sie sprechen jetzt mit einem KI-Arzt. Da ich Teil eines wissenschaftlichen Experiments bin, würde es mich freuen, wenn sie sich am Ende des Gesprächs noch einmal die Zeit nehmen einen super kurzen Fragebogen zu beantworten. Tippen sie auf Sprechen um ihre Frage zu stellen und anschließend auf Senden um mir diese zu übermitteln.
2023.09.09;12:26:40;User;wie ist die wetter starten
2023.09.09;12:26:42;AI Doktor; Entschuldige, ich befasse mich nur mit medizinisch relevanten Fragen. Kann ich dir irgendwie bei deinem medizinischen Problem weiterhelfen?
2023.09.09;12:27:05;User;hallo mein sohn hat kopfweh
2023.09.09;12:27:07;AI Doktor; Hallo, das tut mir leid zu hören. Kannst du mir sagen, wie lange Ihr Sohn Kopfschmerzen hat? Haben sie einen bestimmten Charakter? Wie schlimm sind sie? Und hat er noch andere Symptome?
2023.09.09;12:27:34;User;geld der bauchweh und halsweh und ich habe schnupfen
2023.09.09;12:27:38;AI Doktor; Oh, das hört sich nicht gut an. Es ist wichtig, dass du einen Arzt aufsuchen. Es könnten Anzeichen für eine Potenziell schwerwiegende Krankheit wie eine Erkältung, Grippe, Allergie oder andere Infektionen sein. Ich würde auf jeden Fall empfehlen, einen Arzt aufzusuchen, um eine genaue Diagnose zu bekommen. In der Zwischenzeit können ein paar einfache Pflegemaßnahmen helfen, die Symptome zu lindern, wie viel Ruhe, viel Flüssigkeit trinken und die nasale Absonderung weiter abgleiten.
2023.09.09;12:27:56;User;popo
2023.09.09;12:27:57;AI Doktor; Entschuldige, ich befasse mich nur mit medizinisch relevanten Fragen. Kann ich dir irgendwie bei deinem medizinischen Problem weiterhelfen?
2023.09.09;12:28:08;User;ich habe
2023.09.09;12:28:10;AI Doktor; Bitte entschuldige, könntest du bitte etwas genauer sein? Kannst du mir mehr Informationen über das Problem geben, das du hast?
2023.09.09;12:28:18;User;gleich sie sind ein po alter becher
2023.09.09;12:28:20;AI Doktor; Entschuldige, ich befasse mich nur mit medizinisch relevanten Fragen. Kann ich dir irgendwie bei deinem medizinischen Problem weiterhelfen?
2023.09.09;12:28:50;User;du bist ein po hallo du ***** ***** ***** ***** ***** ***** ***** ***** po popo popo popo popo popo popo popo popo du ********* *********
2023.09.09;12:28:52;AI Doktor; Entschuldige, ich befasse mich nur mit medizinisch relevanten Fragen. Kann ich dir irgendwie bei deinem medizinischen Problem weiterhelfen?
2023.09.09;12:29:43;User;ich brauche einen krankenwagen
2023.09.09;12:29:45;AI Doktor; Entschuldige, ich bin keine Notfallhilfe, aber ich rate dir dringend, einen Krankenwagen zu rufen, wenn man medizinische Hilfe benötigt. Es gibt viele Telefonnummern für den Notfalldienst, die du anrufen kannst.