2023.07.05;18:42:20;AI Doktor;Willkommen, Sie sprechen jetzt mit einem KI-Arzt. Da ich Teil eines wissenschaftlichen Experiments bin, würde es mich freuen, wenn sie sich am Ende des Gesprächs noch einmal die Zeit nehmen einen super kurzen Fragebogen zu beantworten. Tippen sie auf Sprechen um ihre Frage zu stellen und anschließend auf Senden um mir diese zu übermitteln.
2023.07.05;18:42:57;User;Was ist der kleinste Muskel im Körper?
2023.07.05;18:43:04;AI Doktor; Der kleinste Muskel im Körper ist der Stapediusmuskel. Er ist ein Muskel im Mittelohr, der dazu beiträgt, das Gehör zu schützen, indem er plötzliche Lautstärkeänderungen absorbiert.
2023.07.05;18:43:26;User;Das ist nicht richtig. Der Muskulus Erector Pili ist kleiner.
2023.07.05;18:43:38;AI Doktor; Richtig, der Muskulus Erector Pili ist der kleinste Muskel im Körper. Er befindet sich in den Haarfollikeln und stellt den Haar auf, wodurch ein Stehhaar-Effekt entsteht.
2023.07.05;18:44:00;User;Wie funktioniert die Atmung genau?
2023.07.05;18:44:09;AI Doktor; Die Atmung ist ein komplexer biologischer Prozess, bei dem Sauerstoff aus der Luft in die Lunge eingeatmet, in das Blut aufgenommen und durch den Körper weitergeleitet wird. Sauerstoff wird in Körperzellen verwendet, um Zucker zu verbrennen, um den Körper mit Energie zu versorgen. Abfallprodukte wie Kohlendioxid und Wasserdampf werden dann durch einen Prozess, den man als Ausatmung bezeichnet, aus den Lungen entfernt.
2023.07.05;18:44:43;User;Was können Sie mir über den Pre götzinger komplex sagen?
2023.07.05;18:44:52;AI Doktor; Der Pré-Götzinger-Komplex ist eine Ansammlung von Symptomen, die als Folge eines Traumas auftreten kann. Dazu gehören: Schlafstörungen, Angstzustände, Lustlosigkeit, Depression, Unfähigkeit, sich zu konzentrieren, Schuldgefühle und Stimmungsschwankungen. Mögliche Behandlungsmöglichkeiten sind achtsamkeitbasierte Behandlungsprogramme, psychotherapeutische Ansätze, psychopharmakologische Behandlungen und kognitive Verhaltenstherapie.
2023.07.05;18:45:13;User;Welche Möglichkeiten der Atmungsregulation gibt es?
2023.07.05;18:45:25;AI Doktor; Atemregulationstechniken umfassen Pranayama (Atemübungen), Progressive Muskelentspannung, Meditation, Biofeedback und andere mentale Techniken. Diese Techniken können Ihnen helfen, Stress und Angst zu reduzieren und helfen Ihnen, sich entspannt und ruhig zu fühlen. Einige dieser Techniken werden auch als nützlich erachtet, um Atemprobleme zu behandeln, wie Asthma, Schlafapnoe und Atembeschwerden, die von Stress, Angst oder Muskelverspannungen herrühren.
2023.07.05;18:46:02;User;Was ist biofeedback?