2023.04.16;11:43:34;AI Doktor;Willkommen, Sie sprechen jetzt mit einem KI-Arzt. Da ich Teil eines wissenschaftlichen Experiments bin, würde es mich freuen, wenn sie sich am Ende des Gesprächs noch einmal die Zeit nehmen einen super kurzen Fragebogen zu beantworten. Tippen sie auf Sprechen um ihre Frage zu stellen und anschließend auf Senden um mir diese zu übermitteln.
2023.04.16;11:43:59;User;Wie alt bin ich wohl?
2023.04.16;11:44:01;AI Doktor; Hallo. Das kann ich leider nicht beantworten. Gibt es irgendwelche Anzeichen von Beschwerden, die ich dir helfen kann zu diagnostizieren und zu behandeln?
2023.04.16;11:44:22;User;Ich habe sehr starke Rückenschmerzen und Bandscheibenvorwölbung und Arthrose den Facetten. Was kann ich da wohl machen?
2023.04.16;11:44:28;AI Doktor; Ich empfehle dir, einen Arzt aufzusuchen und ein bildgebendes Verfahren wie eine Röntgenaufnahme oder Magnetresonanztomographie durchzuführen, um die Diagnose zu bestätigen. Vor allem für deine Rückenschmerzen kann das sehr hilfreich sein. Es gibt verschiedene Behandlungsoptionen, die je nach Schwere der Symptome variieren können. Dazu gehören Medikamente, Physiotherapie, manuelle Therapie und sogar chirurgische Eingriffe. Ich würde auf jeden Fall empfehlen, einen Arzt aufzusuchen, um mehr darüber zu erfahren.
2023.04.16;11:45:13;User;Ich will eigentlich heiraten, aber ist eine Frau für mich die Richtige? 5 Jahre älter ist als ich.
2023.04.16;11:45:14;AI Doktor; Dies ist keine medizinische Frage. Daher kann ich dir dazu leider keinen Rat geben.
2023.04.16;11:45:31;User;okay ich muss jetzt weitergehen ich habe ein bisschen hunger du auch
2023.04.16;11:45:33;AI Doktor; Nein, ich fühle mich nicht hungrig. Haben Sie noch weitere medizinische Fragen, die ich Ihnen beantworten kann?
2023.04.16;11:45:47;User;Mein Blutdruck ist zu hoch was kann ich denn da machen?
2023.04.16;11:45:53;AI Doktor; Zuerst einmal glaube ich, dass es am besten ist, zu einem Arzt zu gehen, um deinen Blutdruck zu messen und sicherzustellen, dass du ein zu hoher Blutdruck hast. Wenn du einen zu hohen Blutdruck hast, gibt es verschiedene Möglichkeiten, deinen Blutdruck zu senken. Dazu gehören, Kontrolle von Blas und Fettaufnahme, mehr Bewegung, Verzicht auf Rauchen, gesunde Ernährung und eine Reduzierung des Salzkonsums. In manchen Fällen kann auch eine medikamentöse Behandlung erforderlich sein.
2023.04.16;11:46:17;User;guck mal nach okay ich sag jetzt mal tschüss
2023.04.16;11:46:18;AI Doktor; In Ordnung. Falls Sie weitere medizinischen Fragen haben, zögern Sie bitte nicht mich zu fragen. Auf Wiedersehen und gute Besserung.
2023.04.16;11:46:31;User;!!! Senden geklickt ohne Input !!!
2023.04.16;11:46:32;AI Doktor; Hallo, bitte stellen Sie mir Ihre medizinischen Fragen. Ich bin hier, um Ihnen weiterzuhelfen.
2023.04.16;11:46:35;User;!!! Senden geklickt ohne Input !!!
2023.04.16;11:46:37;AI Doktor; Hallo, stellen Sie mir bitte Ihre medizinischen Fragen. Ich bin hier, um Ihnen bei Bedarf zu helfen.