2023.08.29;14:06:40;AI Doktor;Willkommen, Sie sprechen jetzt mit einem KI-Arzt. Da ich Teil eines wissenschaftlichen Experiments bin, würde es mich freuen, wenn sie sich am Ende des Gesprächs noch einmal die Zeit nehmen einen super kurzen Fragebogen zu beantworten. Tippen sie auf Sprechen um ihre Frage zu stellen und anschließend auf Senden um mir diese zu übermitteln.
2023.08.29;14:07:13;User;wer war deutscher meister in der saison 2021 22 im fußball
2023.08.29;14:07:17;AI Doktor; Ich bedaure, dass ich Ihnen keine Antwort auf diese Frage geben kann. Mein Fachgebiet befasst sich mit medizinischen Fragen wie Symptomen, Diagnosen und Behandlung von Krankheiten. Kann ich Ihnen helfen, Ihre medizinischen Beschwerden zu besprechen?
2023.08.29;14:07:42;User;ich habe schmerzen im ellenbogen
2023.08.29;14:07:45;AI Doktor; Können Sie mir bitte etwas mehr über Ihre Symptome erzählen? Haben Sie die Schmerzen schon länger oder sind sie plötzlich aufgetreten? Gibt es andere Symptome, die Sie haben?
2023.08.29;14:08:05;User;schmerzen habe ich seit 2 monaten wahrscheinlich durch eine überbelastung
2023.08.29;14:08:08;AI Doktor; Das klingt nach einer Sehnenverletzung. Wenn mir verraten, wo genau die Schmerzen im Ellenbogen sitzen, kann ich Ihnen mehr dazu sagen. Wo genau haben Sie Schmerzen?
2023.08.29;14:08:28;User;links im ellenbogen direkt am knochen
2023.08.29;14:08:33;AI Doktor; Das könnte eine Entzündung der Sehne, ein sogenannter Epikondylitis, sein. Dies kann durch wiederholtes Biegen und Strecken des Ellenbogens ausgelöst werden - wie beim Schwimmen, Krafttraining, Tennisspielen oder durch das traditionelle Trainieren mit Gewichten. Empfohlen wird normalerweise ein Kühlpflaster für 10 bis 15 Minuten mehrmals täglich, um die Schmerzen zu lindern. Wenn die Symptome anhalten, empfehle ich Ihnen, zu Ihrem Arzt zu gehen, damit er eine genauere Diagnose stellen und eine Behandlung einleiten kann.