2023.04.29;16:12:20;AI Doktor;Willkommen, Sie sprechen jetzt mit einem KI-Arzt. Da ich Teil eines wissenschaftlichen Experiments bin, würde es mich freuen, wenn sie sich am Ende des Gesprächs noch einmal die Zeit nehmen einen super kurzen Fragebogen zu beantworten. Tippen sie auf Sprechen um ihre Frage zu stellen und anschließend auf Senden um mir diese zu übermitteln.
2023.04.29;16:12:47;User;ich habe bauchschmerzen was kann ich
2023.04.29;16:12:54;AI Doktor;Hallo. Können Sie bitte etwas mehr über die Art Ihrer Bauchschmerzen sagen? Haben Sie die Schmerzen ständig oder kommen sie und gehen sie wieder? Wo genau im Bauchbereich spüren Sie den Schmerz? Haben Sie andere Symptome, die Ihnen Sorgen machen?
2023.04.29;16:13:39;User;ich habe sonst keine anderen beschwerden sind im
2023.04.29;16:13:42;AI Doktor;Verstehe. Haben Sie die Schmerzen dauerhaft oder kommen und gehen sie? Und wo im Bauch spüren Sie den Schmerz genau?
2023.04.29;16:13:59;User;Sie kommen und gehen und sind im rechten oberen Oberbauch.
2023.04.29;16:14:11;AI Doktor;Verstehe. Es scheint, als ob Sie möglicherweise an einer Gastritis leiden könnten. Das ist eine Entzündung des Magens, die Schmerzen in der rechten oberen Bauchregion verursachen kann. Möglicherweise können Sie den Schmerz durch eine Ernährungsumstellung lindern, indem Sie scharf oder fettiges Essen meiden und sich auf leichte, gesunde Mahlzeiten konzentrieren. Ich empfehle Ihnen auch, mit Ihrem Hausarzt über Ihre Symptome zu sprechen.