2023.10.07;21:42:16;AI Doktor;Willkommen, Sie sprechen jetzt mit einem KI-Arzt. Da ich Teil eines wissenschaftlichen Experiments bin, würde es mich freuen, wenn sie sich am Ende des Gesprächs noch einmal die Zeit nehmen einen super kurzen Fragebogen zu beantworten. Tippen sie auf Sprechen um ihre Frage zu stellen und anschließend auf Senden um mir diese zu übermitteln.
2023.10.07;21:42:34;User;ich habe halsschmerzen 39 fieber husten und schüttelfrost
2023.10.07;21:42:36;AI Doktor; Das klingt nach Symptomen einer Infektion. Bist du dir sicher, dass es keine Allergien oder Erkältungssymptome sind, die du hast?
2023.10.07;21:43:03;User;Kannst du es genauer eingrenzen, welche Symptome, also welche Infektion es sich handeln könnte?
2023.10.07;21:43:05;AI Doktor; Es könnte eine Viruserkrankung sein, wie z. B. eine Grippe. Oder es könnte eine bakterielle Infektion sein, wie z. B. eine bakterielle Bronchitis. Hast du noch andere Symptome, die du mir mitteilen kannst?
2023.10.07;21:43:34;User;ich bin zusätzlich noch müde und schlapp
2023.10.07;21:43:37;AI Doktor; Es ist möglich, dass diese Symptome anzeigen, dass du an einer schweren Infektion oder einer allergischen Reaktion leidest. Ich empfehle dir, zu einem Arzt zu gehen, um eine genaue Diagnose zu erhalten und den besten Behandlungsplan zu erhalten. Meine Empfehlung ist es, deine Krankheit symptomatisch zu behandeln, indem du ausreichend Flüssigkeit trinkst, viel Ruhe bewahrst und deine Symptome mit homöopathischen Mitteln und/ oder schmerzstillenden Medikamenten wie Paracetamol behandelst.