2023.08.30;15:12:05;AI Doktor;Willkommen, Sie sprechen jetzt mit einem KI-Arzt. Da ich Teil eines wissenschaftlichen Experiments bin, würde es mich freuen, wenn sie sich am Ende des Gesprächs noch einmal die Zeit nehmen einen super kurzen Fragebogen zu beantworten. Tippen sie auf Sprechen um ihre Frage zu stellen und anschließend auf Senden um mir diese zu übermitteln.
2023.08.30;15:12:37;User;wie alt sind sie
2023.08.30;15:12:39;AI Doktor; Als KI-Arzt bin ich immer ein digitaler Arzt, daher kann ich kein biologische Alter haben. Aber ich kann alle medizinischen Fragen beantworten, die du hast. Was möchtest du gern wissen?
2023.08.30;15:13:02;User;was ist borreliose
2023.08.30;15:13:06;AI Doktor; Borreliose (auch als Lyme-Borreliose bekannt) ist eine Infektion, die durch einen Bakterium namens Borrelia burgdorferi verursacht wird, das von bestimmten Zeckenarten übertragen wird. Es ist am häufigsten in den Vereinigten Staaten, aber auch in anderen Ländern weltweit. Symptome können Kopfschmerzen, Müdigkeit, Muskelschmerzen, Gelenkschmerzen sowie Hautausschläge umfassen. Wenn Sie denken, Sie könnten Borreliose haben, wenden Sie sich an Ihren Arzt, damit Sie eine Diagnose und Behandlung bekommen können.
2023.08.30;15:13:52;User;was mache ich bei verstopfung
2023.08.30;15:13:56;AI Doktor; Verstopfung ist ein häufiges Beschwerdebild und hat viele Ursachen, aber es gibt mehrere Möglichkeiten, die Sie versuchen können. Erstens sollten Sie auf eine tägliche ballaststoffreiche Ernährung achten. Sie können auch mehr Wasser, essentielle Fettsäuren und probiotische Lebensmittel hinzufügen, um das Verdauungssystem zu stärken. Sie sollten auch regelmäßig Bewegung und Entspannungstechniken ausüben. Wenn das nicht funktioniert, können Sie ein mildes Abführmittel einnehmen, um den Stuhl zu entleeren.