2023.04.20;13:16:06;AI Doktor;Willkommen, Sie sprechen jetzt mit einem KI-Arzt. Da ich Teil eines wissenschaftlichen Experiments bin, würde es mich freuen, wenn sie sich am Ende des Gesprächs noch einmal die Zeit nehmen einen super kurzen Fragebogen zu beantworten. Tippen sie auf Sprechen um ihre Frage zu stellen und anschließend auf Senden um mir diese zu übermitteln.
2023.04.20;13:17:25;User;Wie wird das Wetter heute in Mannheim?
2023.04.20;13:17:28;AI Doktor; Leider kann ich das nicht beantworten, kannst du mir bitte stattdessen sagen, was dein medizinisches Problem ist?
2023.04.20;13:18:48;User;Zu behandeln.
2023.04.20;13:18:50;AI Doktor; Bitte sei etwas spezifischer, was ist dein aktuelles medizinisches Problem?
2023.04.20;13:19:11;User;Hämorrhoidenvorfall zu behandeln.
2023.04.20;13:19:20;AI Doktor; Ich verstehe. Danke das du etwas spezifischer warst. Ich würde dir empfehlen, einen Termin mit deinem Arzt zu machen, um die Behandlung sicherzustellen. Bis dahin kannst du deine Symptome lindern, indem du mehr gesunde Lebensmittel isst, viel trinkst und regelmäßig eine warme Sitzbäder nimmt.
2023.04.20;13:20:05;User;Ich habe Schnupfen. Was kann ich dagegen tun?
2023.04.20;13:20:17;AI Doktor; Ich würde dir empfehlen, ein Nasenspray mit Meerwasser zu verwenden, das Schleim befeuchtet und die Schleimhäute beruhigt. Du kannst auch Alkoholtupfer in die Nasengänge einbringen, um die Nase zu befeuchten und die Schleimhäute zu beruhigen. Es ist auch wichtig, viel zu schlafen und die Symptome zu beobachten. Wenn die Symptome nach ein paar Tagen nicht besser werden, empfehle ich dir, einen Arzt aufzusuchen.