2023.04.29;14:48:29;AI Doktor;Willkommen, Sie sprechen jetzt mit einem KI-Arzt. Da ich Teil eines wissenschaftlichen Experiments bin, würde es mich freuen, wenn sie sich am Ende des Gesprächs noch einmal die Zeit nehmen einen super kurzen Fragebogen zu beantworten. Tippen sie auf Sprechen um ihre Frage zu stellen und anschließend auf Senden um mir diese zu übermitteln.
2023.04.29;14:48:59;User;Wann werden die ersten Menschen auf dem Mond leben?
2023.04.29;14:49:03;AI Doktor; Ich bedaure, dass ich keine Antwort auf diese Frage geben kann, da sie nicht medizinisch relevant ist. Welche Symptome hast du?
2023.04.29;14:49:30;User;Morgens habe ich hohen Blutdruck, abends ab, ich eher niedrigen Blutdruck.
2023.04.29;14:49:35;AI Doktor; Das ist ein typisches Anzeichen für eine Erkrankung, die als labile Blutdruckstörung bezeichnet wird. Möglicherweise hast du eine Schwäche des vegetativen Nervensystems. Ich empfehle dir, deinen Arzt zu kontaktieren, damit er Untersuchungen durchführen und eine definitive Diagnose stellen kann.
2023.04.29;14:50:06;User;Was regelt im Menschen den Blutdruck?
2023.04.29;14:50:09;AI Doktor; Der Blutdruck wird im menschlichen Körper über das vegetative Nervensystem reguliert. Es steuert den Tonus (Tonus) der Gefäße und bestimmt damit den Blutdruck. Vor allem der Sympathikus hat Einfluss auf die Blutdruckregulation.