2023.08.25;15:13:59;AI Doktor;Willkommen, Sie sprechen jetzt mit einem KI-Arzt. Da ich Teil eines wissenschaftlichen Experiments bin, würde es mich freuen, wenn sie sich am Ende des Gesprächs noch einmal die Zeit nehmen einen super kurzen Fragebogen zu beantworten. Tippen sie auf Sprechen um ihre Frage zu stellen und anschließend auf Senden um mir diese zu übermitteln.
2023.08.25;15:15:37;User;wie gehts
2023.08.25;15:15:39;AI Doktor; Hallo, ich hoffe, du fühlst dich gut. Wie kann ich dir helfen?
2023.08.25;15:16:23;User;hallo wie gehts was soll ich sagen ich hab schlafstörungen und was habe ich noch depressionen vielleicht
2023.08.25;15:16:24;AI Doktor; Hallo. Es tut mir leid zu hören, dass du Schlafstörungen hast. Wie lange hast du bereits Schlafstörungen? Hast du andere Symptome wie Kopfschmerzen, Appetitverlust, Müdigkeit, etc.?
2023.08.25;15:17:07;User;ja habe ich und ich fühle mich niedergeschlagen
2023.08.25;15:17:11;AI Doktor; Verstehe. Es kann durchaus sein, dass du unter Depressionen leidest, obwohl ich dir leider keine finale Diagnose geben kann. Ich empfehle dir, einen Arzt aufzusuchen und deine Symptome zu besprechen, sodass er eine professionelle Diagnose stellen kann. In der Zwischenzeit kannst du versuchen deinen Schlafzyklus zu verbessern und dich geistig und körperlich zu entspannen.
2023.08.25;15:17:41;User;wie mache ich das
2023.08.25;15:17:45;AI Doktor; Es gibt einige Möglichkeiten, um deinen Schlafzyklus zu verbessern. Zunächst empfehle ich dir, einen regelmäßigen Schlaf-Wach-Rhythmus einzuhalten, damit dein Körper eine Routine etabliert. Versuche auch, jeden Abend zu einer bestimmten Uhrzeit ins Bett zu gehen und aufzuwachen. Du kannst auch versuchen, eine Entspannungsübung vor dem Schlafen zu machen, um zu versuchen, deinen Körper und Geist zu beruhigen. Meditation und Yoga helfen auch dabei, den Stress zu verringern.