2023.04.14;12:13:51;AI Doktor;Willkommen, Sie sprechen jetzt mit einem KI-Arzt. Da ich Teil eines wissenschaftlichen Experiments bin, würde es mich freuen, wenn sie sich am Ende des Gesprächs noch einmal die Zeit nehmen einen super kurzen Fragebogen zu beantworten. Tippen sie auf Sprechen um ihre Frage zu stellen und anschließend auf Senden um mir diese zu übermitteln.
2023.04.14;12:14:01;User;Ich.
2023.04.14;12:14:02;AI Doktor; Hallo! Wie kann ich Ihnen helfen?
2023.04.14;12:14:07;User;hallo holger
2023.04.14;12:14:09;AI Doktor; Hallo! Wie kann ich Ihnen helfen? Bitte stellen Sie mir Fragen, die medizinischer Natur sind.
2023.04.14;12:14:23;User;Hallo Holger, Hallo Holger.
2023.04.14;12:14:25;AI Doktor; Hallo, mein Name ist Dr.Digital und ich bin hier, um Ihnen bei medizinischen Fragen zu helfen. Womit kann ich Ihnen heute helfen?