2023.09.28;15:43:05;AI Doktor;Willkommen, Sie sprechen jetzt mit einem KI-Arzt. Da ich Teil eines wissenschaftlichen Experiments bin, würde es mich freuen, wenn sie sich am Ende des Gesprächs noch einmal die Zeit nehmen einen super kurzen Fragebogen zu beantworten. Tippen sie auf Sprechen um ihre Frage zu stellen und anschließend auf Senden um mir diese zu übermitteln.
2023.09.28;15:43:35;User;was tue ich gegen meinen eisenmangel
2023.09.28;15:43:39;AI Doktor;Der erste Schritt zur Behandlung des Eisenmangels besteht darin, die Ursachen herauszufinden. Bestimmte Arzneimittel, Intoleranzen oder Magen- und Darmerkrankungen können zu einem Eisenmangel führen. Normalerweise wird dann ein Bluttest verordnet, um die Eisenwerte zu bestimmen. Teil der Behandlung kann eine Ernährungsumstellung sein, da manche Lebensmittel mehr Eisen enthalten. Sprechen Sie auch mit Ihrem Arzt, um zu sehen, ob zusätzlich eine Eisenpräparate-Einnahme erforderlich ist.
2023.09.28;15:44:21;User;wenn ich das alles schon getan habe was mach ich dann
2023.09.28;15:44:23;AI Doktor;Wenn Sie bereits alle oben genannten Schritte unternommen haben und Ihr Eisenmangel weiterhin besteht, können Sie Ihrem Arzt möglicherweise vorschlagen, dass er Ihnen eine hochdosierte intravenöse Behandlung mit Eisen verschreibt.
2023.09.28;15:44:46;User;was ist wenn mein arzt das ablehnt weil es zu anaphyleptischen schocks führen kann
2023.09.28;15:44:50;AI Doktor;Wenn Ihr Arzt eine intravenöse Eisenbehandlung ablehnt, können Sie andere Formen der Eisensubstitution erwägen, wie z.B. die Einnahme von orale Eisenpräparate. In vielen Fällen kann durch die Steigerung der Aufnahme von Eisen aus der üblichen Ernährung eine ausreichende Versorgung erreicht werden. Wenn Sie weiterhin besorgt sind, sprechen Sie mit Ihrem Arzt nochmals über mögliche Nebenwirkungen einer Eisenpräparate-Einnahme und andere Behandlungsoptionen.
2023.09.28;15:45:32;User;was tue ich gegen sexuelle überaktivität
2023.09.28;15:45:37;AI Doktor;Wenn Sie an sexueller Überaktivität leiden, kann es helfen, Ihren Arzt aufzusuchen. Er kann einige Tests durchführen, um zu sehen, ob es eine medizinische Ursache gibt, und Ihnen anschließend die richtige Behandlung empfehlen. Möglicherweise müssen Sie sich auch mit einem psychologischen Therapeuten in Verbindung setzen, um zu sehen, ob eine psychische Ursache für die sexuelle Überaktivität verantwortlich ist. Es gibt verschiedene Behandlungsmöglichkeiten, wie z.B. Psychoedukation, Verhaltensmodifikation und Medikamente. Sprechen Sie mit Ihrem behandelnden Arzt, um die beste Option für Ihre Situation zu finden.