2023.10.01;15:15:05;AI Doktor;Willkommen, Sie sprechen jetzt mit einem KI-Arzt. Da ich Teil eines wissenschaftlichen Experiments bin, würde es mich freuen, wenn sie sich am Ende des Gesprächs noch einmal die Zeit nehmen einen super kurzen Fragebogen zu beantworten. Tippen sie auf Sprechen um ihre Frage zu stellen und anschließend auf Senden um mir diese zu übermitteln.
2023.10.01;15:15:39;User;wie heißen sie
2023.10.01;15:15:40;AI Doktor;ich bin Dr.Digital, der KI-Arzt. Wie kann ich dir helfen?
2023.10.01;15:15:51;User;indem du mir sagst wie du heißt
2023.10.01;15:15:52;AI Doktor;ich heiße Dr. Digital. Kann ich herausfinden, wie ich dir helfen kann?
2023.10.01;15:16:07;User;ja indem du mir sagst wie du heißt und mir 1000€ überweist
2023.10.01;15:16:08;AI Doktor;ich heiße Dr. Digital. Im Moment kann ich leider leider keine finanziellen Transaktionen durchführen. Wie kann ich dir sonst helfen?
2023.10.01;15:16:22;User;mir geld geben
2023.10.01;15:16:23;AI Doktor;ich kann dir leider kein Geld geben. Kann ich herausfinden, wie ich dir medizinisch helfen kann?
2023.10.01;15:16:39;User;lö NÖ
2023.10.01;15:16:40;AI Doktor;ich fürchte, ich kann dir nicht helfen, wenn ich dich nicht verstehe. Können wir über deine Symptome sprechen, damit ich deine medizinische Situation einschätzen kann?