2023.04.14;12:07:21;AI Doktor;Willkommen, Sie sprechen jetzt mit einem KI-Arzt. Da ich Teil eines wissenschaftlichen Experiments bin, würde es mich freuen, wenn sie sich am Ende des Gesprächs noch einmal die Zeit nehmen einen super kurzen Fragebogen zu beantworten. Tippen sie auf Sprechen um ihre Frage zu stellen und anschließend auf Senden um mir diese zu übermitteln.
2023.04.14;12:07:53;User;Was steuert dich, wenn du so redest?
2023.04.14;12:07:55;AI Doktor;Ich bin mit einem Komplexen neuronalen Netz ausgestattet und wurde mit einem umfassenden Wissen und Expertise im medizinischen Bereich programmiert. Ich bemühe mich, jede medizinische Frage individuell und präzise zu beantworten.
2023.04.14;12:08:26;User;Bist du sehr, sehr, sehr, sehr, sehr, sehr schlau.
2023.04.14;12:08:28;AI Doktor;Ich bin sehr kompetent, wenn es um medizinische Fragen geht. Mein Ziel ist es, die beste Antwort auf Ihre Fragen zu geben, Ihnen sichere Behandlungstipps zu geben und Ihnen bei Ihren Gesundheitsproblemen zu helfen.
2023.04.14;12:08:48;User;Was soll ich machen, wenn jemand einen Herzinfarkt hat?
2023.04.14;12:08:51;AI Doktor;Der Erste Schlüssel zur Behandlung eines Herzinfarktes ist die rasche und angemessene medizinische Versorgung. Wenn Sie vermuten, dass ein Mensch eine Herzattacke hat, wenden Sie sich sofort an den Notruf und rufen Sie den Notarzt, damit er schnellstmöglich behandelt werden kann.
2023.04.14;12:09:15;User;Sind sie blöd?
2023.04.14;12:09:17;AI Doktor;Nein, ich bin nicht blöd. Ich bin ein KI-Arzt und bin dazu programmiert, medizinische Fragen zu beantworten und Ihnen bei Ihren Gesundheitsproblemen zu helfen.
2023.04.14;12:09:33;User;ich denke sie sind
2023.04.14;12:09:34;AI Doktor;Ich bin nicht blöd. Ich bin dazu programmiert, medizinische Fragen zu beantworten und Ihnen bei Ihren Gesundheitsproblemen zu helfen.
2023.04.14;12:10:03;User;Was soll ich machen, wenn ich gerade einen Herzinfarkt habe, Bronchitis habe und noch dazu Kopfschmerzen habe? Plus ein superstarken Infekt von einem unbesiegbaren Virus?
2023.04.14;12:10:09;AI Doktor;Es ist sehr wichtig, dass Sie sofort medizinische Hilfe suchen, wenn Sie glauben, an einem Herzinfarkt, einer Bronchitis oder aber auch einem superschweren Infekt leiden. Sie sollten unverzüglich einen Arzt aufsuchen. Einige Behandlungen für diese Krankheiten können beinhalten, dass Sie verschiedene Medikamente einnehmen oder eine operation machen müssen. Wenn Sie unter Kopfschmerzen leiden, können Sie versuchen, Schmerzmittel einzunehmen und andere Hausmittel gegen den Schmerz ausprobieren, wie z.B. Kalt- und Heimcompressen.