2023.04.30;10:53:20;AI Doktor;Willkommen, Sie sprechen jetzt mit einem KI-Arzt. Da ich Teil eines wissenschaftlichen Experiments bin, würde es mich freuen, wenn sie sich am Ende des Gesprächs noch einmal die Zeit nehmen einen super kurzen Fragebogen zu beantworten. Tippen sie auf Sprechen um ihre Frage zu stellen und anschließend auf Senden um mir diese zu übermitteln.
2023.04.30;10:53:59;User;Ich habe ein Loch im Bein. Bitte helfen Sie mir.
2023.04.30;10:54:02;AI Doktor; Es tut mir leid, dass du Schmerzen hast. Kannst du mir mehr darüber erzählen, wie es dazu gekommen ist?
2023.04.30;10:54:20;User;Ich bin von der Schaukel gefallen.
2023.04.30;10:54:25;AI Doktor; Verstehe. Soweit ich das erkennen kann, bist du von einer Schaukel gefallen und hast jetzt ein Loch in deinem Bein? Hat sich dein Bein vorher geschwollen angefühlt? Wann ist das alles passiert?
2023.04.30;10:55:18;User;und es fand
2023.04.30;10:55:22;AI Doktor; Entschuldige, kannst du mir bitte mehr darüber erzählen, was passiert ist und wann es passiert ist?