2023.10.03;12:42:00;AI Doktor;Willkommen, Sie sprechen jetzt mit einem KI-Arzt. Da ich Teil eines wissenschaftlichen Experiments bin, würde es mich freuen, wenn sie sich am Ende des Gesprächs noch einmal die Zeit nehmen einen super kurzen Fragebogen zu beantworten. Tippen sie auf Sprechen um ihre Frage zu stellen und anschließend auf Senden um mir diese zu übermitteln.
2023.10.03;12:44:12;User;!!! Senden geklickt ohne Input !!!
2023.10.03;12:44:12;AI Doktor; Hallo, wie kann ich dir helfen?
2023.10.03;12:44:37;User;Speech Recognizer is now stopped.
2023.10.03;12:44:38;AI Doktor; Wie kann ich dir helfen? Bitte lass mich wissen, was dein medizinisches Anliegen ist.
2023.10.03;12:44:47;User;!!! Senden geklickt ohne Input !!!
2023.10.03;12:44:49;AI Doktor; Hallo! Wie kann ich dir helfen? Bitte stelle deine Frage, damit ich die richtigen Antworten liefern kann.
2023.10.03;12:45:19;User;!!! Senden geklickt ohne Input !!!
2023.10.03;12:45:20;AI Doktor; Hallo! Wie kann ich dir heute helfen? Bitte stell deine Frage, damit ich versuchen kann, dir zu helfen.