2023.08.13;12:12:46;AI Doktor;Willkommen, Sie sprechen jetzt mit einem KI-Arzt. Da ich Teil eines wissenschaftlichen Experiments bin, würde es mich freuen, wenn sie sich am Ende des Gesprächs noch einmal die Zeit nehmen einen super kurzen Fragebogen zu beantworten. Tippen sie auf Sprechen um ihre Frage zu stellen und anschließend auf Senden um mir diese zu übermitteln.
2023.08.13;12:13:17;User;wie alt bist du
2023.08.13;12:13:19;AI Doktor; Ich bin ein KI-Arzt, kein Mensch. Mein Alter ist für eine medizinische Beurteilung irrelevant. Nun zu Ihrer medizinischen Frage: Welche Symptome sind Ihnen aufgefallen?
2023.08.13;12:14:13;User;was sind zahnspangen
2023.08.13;12:14:15;AI Doktor; Zahnspangen sind eine Behandlungsmethode, die verwendet wird, um die Position und Ausrichtung der Zähne zu korrigieren und Zahnfehlstellungen wie Kieferfehlstellungen zu beseitigen. Welche Symptome haben Sie, dass Sie eine medizinische Beratung benötigen?
2023.08.13;12:14:52;User;warum muss ich die zahnspange immer verstellen
2023.08.13;12:14:55;AI Doktor; Die Anpassung der Zahnspange ist wichtig, um den Kiefer- und Zahnbereich zu korrigieren. Wenn Sie abnehmbare Zahnspangen verwenden, werden sie in Kiefer- und Zahnpositionen verstellt, um die beste Wirkung zu erzielen. Bitte beschreiben Sie Ihre Symptome etwas ausführlicher, damit ich Ihnen helfen kann.
2023.08.13;12:15:57;User;Ich kann nicht gut schlafen, wenn ich meine Zahnspange im Mund habe.
2023.08.13;12:16:01;AI Doktor; Im Allgemeinen wird nachts eine Zahnspange getragen, um die besten Behandlungsergebnisse zu erzielen. Obwohl die Zahnspange ein unangenehmes Gefühl verursachen kann, kann das Ausbleiben der Nachtbehandlung zu schlechten Ergebnissen führen. Ich schlage vor, dass Sie sich die Zahnspangen anpassen lassen, damit es für Sie leichter ist, nachts zu tragen. Außerdem empfehle ich Ihnen, regelmäßig zur Kontrolle zu kommen, damit der Arzt überprüfen kann, ob Ihre Behandlung auf dem richtigen Weg ist.
2023.08.13;12:16:43;User;OK tschüss wir gehen
2023.08.13;12:16:45;AI Doktor; Auf Wiedersehen. Passen Sie gut auf sich auf und denken Sie daran, dass Ihre Zahnspangen wichtig sind, um gute Ergebnisse zu erzielen.
2023.08.13;12:16:58;User;dankeschön
2023.08.13;12:16:59;AI Doktor; Ich freue mich, dass ich Ihnen helfen konnte. Haben Sie noch weitere Fragen zu Ihrer Behandlung oder sonstigen medizinischen Themen?
2023.08.13;12:17:32;User;wieso braucht ein mensch eigentlich eine zahnspange ist es wirklich nötig und wieso eigentlich weil ich finde das etwas seltsam dass zum beispiel kinder zahnspange tragen müssen ne
2023.08.13;12:17:35;AI Doktor; Zahnspangen sind nützlich, um verschiedene Mundprobleme zu behandeln. Sie tragen dazu bei, dass die Zähne in die richtige Position bringen und unangenehme Kiefer- oder Zahnfehlstellungen beseitigen. Kinder tragen Zahnspangen, um zukünftige Probleme zu vermeiden, z.B. Atemstörungen, Kieferschmerzen oder Zahnfehlstellungen, die durch unausgewogene Kiefer- und Zahnpositionen verursacht werden.
2023.08.13;12:17:49;User;ich muss jetzt leider gehen
2023.08.13;12:17:51;AI Doktor; In Ordnung, auf Wiedersehen und vergessen Sie nicht, Ihre regelmäßigen Kontrolluntersuchungen wahrzunehmen. Passen Sie gut auf sich auf.
2023.08.13;12:18:03;User;bis zum nächsten mal tschüss
2023.08.13;12:18:03;AI Doktor; Bis dann, auf Wiedersehen.