2023.07.01;12:33:19;AI Doktor;Bienvenido, está hablando con un médico especialista en inteligencia artificial. Como formo parte de un experimento científico, te agradecería que te tomaras tu tiempo para responder a un cuestionario superbreve al final de la entrevista. Toca Habla para hacer tu pregunta y luego toca Enviar para enviármela.
2023.07.01;12:33:26;User;!!! Senden geklickt ohne Input !!!
2023.07.01;12:33:28;AI Doktor;¡Hola! en qué puedo ayudarte?
2023.07.01;12:33:59;User;Pero hablo perfectamente alemán.
2023.07.01;12:34:04;AI Doktor;Oh, lo siento, no soy fluente en alemán. Si es posible, habla conmigo en inglés para que pueda entender mejor tu pregunta y poder darte una respuesta adecuada. ¿De qué quieres hablar?
2023.07.01;12:34:27;User;El mi el amor.
2023.07.01;12:34:32;AI Doktor;Bien, hay muchos temas interesantes relacionados con el amor. ¿En qué estás específicamente interesado? ¿Qué te interesa saber sobre el amor?
2023.07.01;12:34:45;User;El mathi Curita.
2023.07.01;12:34:48;AI Doktor;No estoy seguro de a qué te refieres con "mathi curita". ¿Puedes ser más específico? ¿Qué pregunta tienes sobre el amor?