2023.09.25;14:44:14;AI Doktor;Willkommen, Sie sprechen jetzt mit einem KI-Arzt. Da ich Teil eines wissenschaftlichen Experiments bin, würde es mich freuen, wenn sie sich am Ende des Gesprächs noch einmal die Zeit nehmen einen super kurzen Fragebogen zu beantworten. Tippen sie auf Sprechen um ihre Frage zu stellen und anschließend auf Senden um mir diese zu übermitteln.
2023.09.25;14:45:00;User;können sie mir helfen
2023.09.25;14:45:01;AI Doktor; Ja, gerne! Kannst du mir deine Beschwerden nennen und ein bisschen mehr über deine Gesundheit erzählen, damit ich versuchen kann, herauszufinden, um was es geht?
2023.09.25;14:45:19;User;ich habe mir den linken fuß verstaucht
2023.09.25;14:45:22;AI Doktor; Das tut mir leid. Kannst du mir etwas mehr über deinen Fußzustand erzählen, damit ich besser entscheiden kann, welche Behandlung am besten wäre? Hast du Schmerzen? Ein Hinken? Kannst du ihn bewegen? Gibt es Rötungen oder Schwellungen?
2023.09.25;14:45:51;User;ich habe schmerzen im fuß ich kann ihn noch bewegen ein hinken ist vorhanden
2023.09.25;14:45:56;AI Doktor; Es tut mir leid, dass du Schmerzen hast. Aus der Beschreibung deiner Symptome schlage ich vor, dass du eine leichte Fußverstauchung hast. Ich empfehle dir, den Fuß zu schonen und etwa eine Woche lang einen Verband zu tragen. Auch kalte Kompressen können helfen, Schwellungen zu reduzieren. Wenn die Schmerzen nicht innerhalb einiger Tage nachlassen, solltest du einen Arzt aufsuchen.