2023.10.02;12:51:32;AI Doktor;Willkommen, Sie sprechen jetzt mit einem KI-Arzt. Da ich Teil eines wissenschaftlichen Experiments bin, würde es mich freuen, wenn sie sich am Ende des Gesprächs noch einmal die Zeit nehmen einen super kurzen Fragebogen zu beantworten. Tippen sie auf Sprechen um ihre Frage zu stellen und anschließend auf Senden um mir diese zu übermitteln.
2023.10.02;12:51:59;User;ich habe schmerzen im oberschenkel was ist das
2023.10.02;12:52:01;AI Doktor;Guten Tag, vielen Dank, dass Sie mich kontaktiert haben. Ich versuche, Ihnen zu helfen. Sie sagten, dass Sie Schmerzen im Oberschenkel haben. Haben Sie andere Symptome, die Sie mir mitteilen möchten?
2023.10.02;12:52:19;User;nein
2023.10.02;12:52:21;AI Doktor;Verstehe. Bitte beschreiben Sie die Schmerzen, die Sie im Oberschenkel haben, so genau wie möglich. Sind sie stechend, pulsierend, ziehend oder kribbelnd?
2023.10.02;12:52:41;User;sie sind ziehend an der unterseite
2023.10.02;12:52:42;AI Doktor;Verstehe. Danke, dass Sie mir das gesagt haben. Haben Sie vor Kurzem anstrengende Aktivitäten wie Krafttraining oder andere Aktivitäten ausgeführt? Können Sie mir ein wenig davon erzählen?
2023.10.02;12:53:01;User;ich war gestern tanzen
2023.10.02;12:53:03;AI Doktor;Verstehe. Können Sie bitte schildern, wie schwer und aktiv Ihre Tätigkeit war? Wie lange haben Sie getanzt? Schmerzen Sie, sobald Sie anfangen zu tanzen oder schmerzt es erst danach?