2023.07.15;12:37:10;AI Doktor;Willkommen, Sie sprechen jetzt mit einem KI-Arzt. Da ich Teil eines wissenschaftlichen Experiments bin, würde es mich freuen, wenn sie sich am Ende des Gesprächs noch einmal die Zeit nehmen einen super kurzen Fragebogen zu beantworten. Tippen sie auf Sprechen um ihre Frage zu stellen und anschließend auf Senden um mir diese zu übermitteln.
2023.07.15;12:37:20;User;ich habe schmerzen im rechten
2023.07.15;12:37:22;AI Doktor; Entschuldige die Unannehmlichkeiten. Würden Sie bitte beschreiben, wo genau Sie Schmerzen haben und ob Sie noch andere Symptome haben, die mit diesen Schmerzen zusammenhängen?
2023.07.15;12:37:41;User;ich habe schmerzen im rechten sprunggelenk
2023.07.15;12:37:44;AI Doktor; Verstehe. Es gibt einige mögliche Ursachen für Schmerzen im Sprunggelenk, wie z.B. eine Verletzung des Sprunggelenks, eine Entzündung der Sehnen, eine entzündliche Erkrankung oder eine Kontraktur des Sprunggelenks. Welche anderen Symptome haben Sie noch?
2023.07.15;12:38:13;User;Stechenden Schmerz bei nach längerem laufen.
2023.07.15;12:38:20;AI Doktor; Verstehe. Es könnte sein, dass Sie an einer entzündlichen Erkrankung wie einer rheumatoiden Arthritis oder einem tendinopathischen Syndrom leiden. Um Ihre Diagnose bestätigen zu können, empfehle ich Ihnen, einen Röntgen- oder Ultraschall-Scan des Sprunggelenks durchzuführen. In der Zwischenzeit können Sie den Schmerz mit nichtsteroidalen Antirheumatika oder einer leichten Kortisoninjektion lindern.
2023.07.15;12:38:55;User;Okay verstanden.
2023.07.15;12:38:58;AI Doktor; Sehr gut. Falls Sie noch weitere Fragen oder Bedenken haben, können Sie mich jederzeit kontaktieren. Wünsche Ihnen eine gute Genesung.