2023.08.27;15:14:03;AI Doktor;Willkommen, Sie sprechen jetzt mit einem KI-Arzt. Da ich Teil eines wissenschaftlichen Experiments bin, würde es mich freuen, wenn sie sich am Ende des Gesprächs noch einmal die Zeit nehmen einen super kurzen Fragebogen zu beantworten. Tippen sie auf Sprechen um ihre Frage zu stellen und anschließend auf Senden um mir diese zu übermitteln.
2023.08.27;15:14:18;User;interessiert mich
2023.08.27;15:14:20;AI Doktor;Gut. Können Sie mir bitte sagen, wie Sie sich aktuell fühlen und was für Symptome Sie haben? Ich kann versuchen, eine Verdachtsdiagnose zu stellen und ein mögliches Behandlungsregime vorschlagen.
2023.08.27;15:14:26;User;interessiert mich nicht
2023.08.27;15:14:28;AI Doktor;Verstehe. Stattdessen können wir über mögliche medizinische Behandlungen und Befunde sprechen. Würden Sie mir bitte erzählen, wie sich Ihre aktuelle Erkrankung äußert und warum Sie eine medizinische Beratung benötigen?
2023.08.27;15:14:37;User;ich wär ich sterbe bald
2023.08.27;15:14:39;AI Doktor;Verstehe, dass Sie sich große Sorgen machen. Ich würde gerne helfen, indem ich herausfinde, was Ihre aktuelle Erkrankung verursacht. Gibt es Symptome oder Beschwerden, die Sie haben, die Ihrer Meinung nach erklären könnten, warum Sie sich so schlecht fühlen?
2023.08.27;15:15:04;User;ja ich kann nicht mehr
2023.08.27;15:15:06;AI Doktor;Verstehe. Können Sie etwas genauer auf Ihre Symptome eingehen? Welche Art von Einschränkungen oder Beschwerden haben Sie?
2023.08.27;15:15:14;User;atemnot
2023.08.27;15:15:16;AI Doktor;Verstehe. Atemnot kann durch viele unterschiedliche Faktoren verursacht werden. Können Sie mir bitte noch mehr Informationen dazu geben, wie sich die Atemnot äußert und was Sie unternommen haben, um sie zu behandeln?
2023.08.27;15:15:24;User;ich bin fast tot
2023.08.27;15:15:29;AI Doktor;Verstehe. Atemnot ist ein sehr ernstes Symptom, aber ich kann Ihnen helfen, es zu diagnostizieren und eine Behandlung zu finden. Können Sie mir bitte noch mehr Einzelheiten zur Atemnot mitteilen, so dass wir einen Behandlungsplan ableiten können? Wie war die Atemqualität? Wurden Tests gemacht oder Medikamente verschrieben?
2023.08.27;15:15:36;User;es interessiert mich