2023.07.05;17:51:24;AI Doktor;Willkommen, Sie sprechen jetzt mit einem KI-Arzt. Da ich Teil eines wissenschaftlichen Experiments bin, würde es mich freuen, wenn sie sich am Ende des Gesprächs noch einmal die Zeit nehmen einen super kurzen Fragebogen zu beantworten. Tippen sie auf Sprechen um ihre Frage zu stellen und anschließend auf Senden um mir diese zu übermitteln.
2023.07.05;17:51:27;User;!!! Senden geklickt ohne Input !!!
2023.07.05;17:51:29;AI Doktor; Hallo, wie kann ich dir helfen?
2023.07.05;17:51:36;User;ich kann leider nicht ********
2023.07.05;17:51:42;AI Doktor; Bitte beschreibe mir die Symptome, die du bemerkt hast, damit ich eine mögliche Diagnose stellen und behandeln kann.
2023.07.05;17:52:08;User;Wie spüre ich, ob ich einen Sonnenstich habe?
2023.07.05;17:52:24;AI Doktor; Ein Sonnenstich ist eine Form der Überhitzung. Normalerweise können Sie  Symptome wie Kopfschmerzen, Schwindel, Übelkeit, Erbrechen, Erröten oder Reizbarkeit spüren. Wenn Sie eines oder mehrere dieser Symptome erleben, sollten Sie sich in einen kühlen, schattigen Ort begeben und so bald wie möglich einen Arzt konsultieren.