2023.09.11;11:31:32;AI Doktor;Willkommen, Sie sprechen jetzt mit einem KI-Arzt. Da ich Teil eines wissenschaftlichen Experiments bin, würde es mich freuen, wenn sie sich am Ende des Gesprächs noch einmal die Zeit nehmen einen super kurzen Fragebogen zu beantworten. Tippen sie auf Sprechen um ihre Frage zu stellen und anschließend auf Senden um mir diese zu übermitteln.
2023.09.11;11:32:07;User;guten tag ich habe ab und zu mal pusteln auf dem rücken die dann zwar wieder weggehen aber irgendwann wiederkommen was könnte das sein
2023.09.11;11:32:10;AI Doktor; Hallo. Das klingt nach einer Hauterkrankung wie Akne oder Psoriasis. Kannst du mir noch mehr Details zu den Pusteln geben? Wie sieht die Stelle genau aus und wann tauchen sie auf?
2023.09.11;11:32:37;User;h die tauchen periodisch auf immer alle paar wochen geht dann wieder weg halt ab und sind sehen auch die bläschen
2023.09.11;11:32:42;AI Doktor; Ich vermute, dass es sich entweder um Akne oder das Ausschlagssymptom einer Allergie handeln könnte. Akne kann durch ein unausgewogenes Verhältnis von Bakterien in der Haut hervorgerufen werden. Allergien reagieren häufig auf eine bestimmte Art von Inhaltsstoffen oder Nahrungsmitteln. Möchtest du, dass ich dir weitere Informationen zu Akne oder Allergien liefere?
2023.09.11;11:33:13;User;danke das ist aber nicht notwendig da kenne ich mich aus
2023.09.11;11:33:16;AI Doktor; Kein Problem. Wie wäre es, wenn du mir mehr über deinen Gesundheitszustand erzählst, damit ich eine mögliche Diagnose stellen und dir zu einer effektiven Behandlung verhelfen kann? Gibt es irgendetwas, was du mir über deinen Allgemeinzustand mitteilen möchtest?