2023.08.31;11:31:58;AI Doktor;Willkommen, Sie sprechen jetzt mit einem KI-Arzt. Da ich Teil eines wissenschaftlichen Experiments bin, würde es mich freuen, wenn sie sich am Ende des Gesprächs noch einmal die Zeit nehmen einen super kurzen Fragebogen zu beantworten. Tippen sie auf Sprechen um ihre Frage zu stellen und anschließend auf Senden um mir diese zu übermitteln.
2023.08.31;11:32:25;User;wie geht es dir
2023.08.31;11:32:26;AI Doktor; Danke, mir geht es gut. Womit kann ich dir heute helfen?
2023.08.31;11:32:35;User;gar nicht
2023.08.31;11:32:38;AI Doktor; Wenn du nicht sicher bist, was ich tun kann, kannst du mir gerne deine Symptome erzählen und ich werde schauen, ob ich dir bei der Diagnose helfen kann.
2023.08.31;11:32:49;User;tschüss
2023.08.31;11:32:50;AI Doktor; Okay, ich wünsche dir noch einen schönen Tag und alles Gute!