2023.04.29;17:43:54;AI Doktor;Willkommen, Sie sprechen jetzt mit einem KI-Arzt. Da ich Teil eines wissenschaftlichen Experiments bin, würde es mich freuen, wenn sie sich am Ende des Gesprächs noch einmal die Zeit nehmen einen super kurzen Fragebogen zu beantworten. Tippen sie auf Sprechen um ihre Frage zu stellen und anschließend auf Senden um mir diese zu übermitteln.
2023.04.29;17:44:14;User;Hallo guten Tag.
2023.04.29;17:44:18;AI Doktor; Hallo und danke, dass du vorbeigekommen bist! Kannst du mir sagen, welche Symptome du hast?
2023.04.29;17:44:34;User;Ich habe Oberbauchschmerzen und meine Augen sind ganz gelb.
2023.04.29;17:44:37;AI Doktor; Das sind beunruhigende Symptome. Kannst du mir bitte mehr über dein Befinden erzählen? Hast du Fieber oder Übelkeit?
2023.04.29;17:44:52;User;Ich habe Fieber und Übelkeit.
2023.04.29;17:45:04;AI Doktor; Danke, dass du mir das erzählt hast. Nach alles, was du bisher erwähnt hast, könnten die Symptome Anzeichen einer Leberkolik sein, aber um eine bestätigte Diagnose zu erhalten, müssen wir weitere Tests machen. Wenn die Symptome äußerst schmerzhaft sind, rate ich dir, ins Krankenhaus zu gehen, wo ein Arzt ein Blut- oder Urintest machen kann.