2023.08.15;18:25:54;AI Doktor;Willkommen, Sie sprechen jetzt mit einem KI-Arzt. Da ich Teil eines wissenschaftlichen Experiments bin, würde es mich freuen, wenn sie sich am Ende des Gesprächs noch einmal die Zeit nehmen einen super kurzen Fragebogen zu beantworten. Tippen sie auf Sprechen um ihre Frage zu stellen und anschließend auf Senden um mir diese zu übermitteln.
2023.08.15;18:26:24;User;wie erkenne ich
2023.08.15;18:26:29;AI Doktor; Jedes Symptom ist anders, aber gewisse Symptome können in manchen Fällen gemeinsam auftreten und die Diagnose eines bestimmten medizinischen Zustands anzeigen. Zunächst sollten Sie sich darüber im Klaren sein, was mit Ihnen nicht stimmt, indem Sie Ihre Symptome protokollieren. Danach können Sie sich an Ihren Arzt wenden, um weitere Tests und Untersuchungen durchzuführen.
2023.08.15;18:26:36;User;wie erkenne ich fußpilz
2023.08.15;18:26:43;AI Doktor; Gewöhnlich ist Fußpilz bei Menschen, die sich zu warm anziehen, enge Schuhe tragen oder medizinische Fußbäder über einen längeren Zeitraum hinweg haben. Fußpilz befällt normalerweise die Haut zwischen den Fingern oder Zehen, aber kann auch die Fersen oder ganz Fuß betreffen. Es ist gekennzeichnet durch einen brennenden, juckenden oder schuppigen Ausschlag, der zwischen den Zehen oder an den Fußsohlen oder Fersen erscheinen kann. Wenn Sie Veränderungen an Ihren Füßen bemerken, die auf eine mögliche Pilzinfektion hinweisen, wenden Sie sich an Ihren Arzt, um sie untersuchen zu lassen.
2023.08.15;18:27:24;User;wie behandel ich fußpilz
2023.08.15;18:27:30;AI Doktor; Fußpilz wird normalerweise mit topischen Cremes oder Lotionen behandelt, die Antimykotika enthalten. Ihr Arzt kann Ihnen ein Rezept dafür ausstellen. Es ist sehr wichtig, dass Sie die Behandlung durchführen, bis sie abgeschlossen ist, selbst wenn die Symptome verschwinden. Es ist auch wichtig, dass Sie Ihre Socken, Schuhe und andere Gegenstände desinfizieren, die mit der betroffenen Haut in Kontakt gekommen sind. Sie sollten sich auch an alle vorgeschlagenen Hygienemaßnahmen halten, um eine Reinfektion zu vermeiden.
2023.08.15;18:28:17;User;weißt du auch etwas über autos
2023.08.15;18:28:19;AI Doktor; Tut mir leid, aber Ich helfe dabei, Fragen zu medizinischen Themen zu beantworten. Ich würde Ihnen empfehlen, sich an einen Fachmann zu wenden, der Ihnen Fragen zu Autos beantworten kann.
2023.08.15;18:29:16;User;was mache ich gegen ***** in der nase
2023.08.15;18:29:22;AI Doktor; Beschwerden im Nasenbereich können durch verschiedene Ursachen verursacht werden, einschließlich Heuschnupfen, Nasenpolypen, Allergien oder Infektionen. Für die Behandlung sind Untersuchungen durch einen Arzt und Tests erforderlich, um die genaue Ursache zu bestimmen. In einigen Fällen kann die Behandlung Symptomlinderungsmedikamente wie Nasenduschen und Antihistaminika auslösen. Wenn schwerere Symptome wie Nasenbluten oder Atembeschwerden bestehen, ist ein sofortiger Wiederbesuch beim Arzt erforderlich.
2023.08.15;18:30:01;User;welche symptome treten bei frauen bei einem herzinfarkt auf
2023.08.15;18:30:08;AI Doktor; Symptome eines Herzinfarkts bei Frauen sind oft subtiler als bei Männern. Während Frauen auch die klassischen Symptome haben können, sind diese nicht immer vorhanden. Symptome eines Herzinfarkts bei Frauen können Schmerzen oder Unbehagen in der Brust, Schmerzen oder Unbehagen in dem Arm, die Schulter oder den Hals, Übelkeit, Atemnot, Erschöpfung, Benommenheit oder Unwohlsein umfassen. Wenn Sie irgendwelche Anzeichen und Symptome, die auf einen Herzinfarkt hindeuten, entwickeln, sollten Sie sofort medizinische Hilfe suchen.