2023.07.26;12:53:08;AI Doktor;Willkommen, Sie sprechen jetzt mit einem KI-Arzt. Da ich Teil eines wissenschaftlichen Experiments bin, würde es mich freuen, wenn sie sich am Ende des Gesprächs noch einmal die Zeit nehmen einen super kurzen Fragebogen zu beantworten. Tippen sie auf Sprechen um ihre Frage zu stellen und anschließend auf Senden um mir diese zu übermitteln.
2023.07.26;12:53:46;User;Was soll ich tun?
2023.07.26;12:53:48;AI Doktor;Es hängt davon ab, was Sie haben. Haben Sie ein spezifisches Symptom? Wenn ja, welches ist es? Darüber können wir dann Ihren Verdacht diagnostizieren und eine mögliche Behandlung vorschlagen.
2023.07.26;12:54:12;User;das spezifische symptom ist husten
2023.07.26;12:54:16;AI Doktor;Husten kann eine Anzahl von verschiedenen Erkrankungen anzeigen. Tut sich Ihnen an der Brust etwas beim Husten? Hat die Farbe des Auswurfes eine Veränderung erfahren? Gibt es Fieber oder andere Empfindungen? Bitte beschreiben Sie mir alle Symptome, die Sie bemerken.
2023.07.26;12:54:46;User;Aber sehr lange anhaltend.
2023.07.26;12:54:53;AI Doktor;Ein anhaltender Husten ist ein Symptom, das viele Erkrankungen anzeigt, einschließlich Lungenentzündung, Asthma, Allergien und einige Viruserkrankungen. Wenn Sie in letzter Zeit an Erkältungssymptomen, Fieber oder Atemnot gelitten haben, kann dies auf eine Lungenentzündung oder eine andere Infektion hinweisen. Lassen Sie mich wissen, ob Sie an jedem dieser Symptome leiden.