2023.09.10;12:41:29;AI Doktor;Willkommen, Sie sprechen jetzt mit einem KI-Arzt. Da ich Teil eines wissenschaftlichen Experiments bin, würde es mich freuen, wenn sie sich am Ende des Gesprächs noch einmal die Zeit nehmen einen super kurzen Fragebogen zu beantworten. Tippen sie auf Sprechen um ihre Frage zu stellen und anschließend auf Senden um mir diese zu übermitteln.
2023.09.10;12:41:55;User;mein rücken juckt und meine kopfhaut juckt was könnte das sein
2023.09.10;12:41:59;AI Doktor; Hallo. Es tut mir leid, dass du unter dem Juckreiz leidest. Ich denke, es kann zwei mögliche Ursachen geben. Erstens kann es eine Hautallergie oder eine andere Hautkrankheit sein, die ein Juckreiz verursacht. Zweitens können Stress oder Anspannung das Problem verursachen. Ich empfehle Ihnen, ein Antiallergikum oder einen Stress-Reduktionstrainer zu verwenden, um Ihre Symptome zu lindern. Lassen Sie mich wissen, wenn ich Ihnen noch weiterhelfen kann.
2023.09.10;12:42:47;User;hallo
2023.09.10;12:42:48;AI Doktor; Hallo. Wie kann ich dir helfen?
2023.09.10;12:43:00;User;so wünschen meine rücken tut weh
2023.09.10;12:43:01;AI Doktor; Hallo. Tut dein Rücken an bestimmten Stellen stärker weh oder ist es ein diffuses Gefühl des Unbehagens? Bitte lassen Sie mich wissen, was Sie sonst noch bemerken.
2023.09.10;12:43:29;User;ich bin 6 und meine füße tun abends weh
2023.09.10;12:43:33;AI Doktor; Hallo! Es tut mir leid, dass du Schmerzen hast. Es ist möglich, dass du wachsende Schmerzen hast. Wenn die Schmerzen weiter zunehmen, kann das ein Zeichen dafür sein, dass du einen Infekt oder ein Skelettproblem hast. Bitte lassen Sie mich wissen, wenn Sie abgetastet werden möchten, um festzustellen, ob eine Schädel- oder Beckenuntersuchung erforderlich ist.
2023.09.10;12:44:20;User;herr meinen rücken kratzt
2023.09.10;12:44:22;AI Doktor; Hallo. Es tut mir leid, dass du unter Kratzern leidest. Kratzen können ein Zeichen für ein Hautproblem wie Ekzeme, Psoriasis oder Schuppenflechte sein. Ich empfehle Ihnen, einen Dermatologen aufzusuchen, um die Ursache des Problems zu identifizieren, und Ihnen eine angemessene Behandlung zu verschreiben.