2023.05.13;16:10:05;AI Doktor;Willkommen, Sie sprechen jetzt mit einem KI-Arzt. Da ich Teil eines wissenschaftlichen Experiments bin, würde es mich freuen, wenn sie sich am Ende des Gesprächs noch einmal die Zeit nehmen einen super kurzen Fragebogen zu beantworten. Tippen sie auf Sprechen um ihre Frage zu stellen und anschließend auf Senden um mir diese zu übermitteln.
2023.05.13;16:10:31;User;woran erkenne ich ob meine frau mich noch liebt
2023.05.13;16:10:37;AI Doktor;Tut mir leid, das ist keine medizinische Frage, die ich beantworten kann. Haben Sie irgendwelche Symptome, denen Sie auf den Grund gehen möchten? Ich kann Ihnen helfen, eine Diagnose und mögliche Behandlung zu finden.
2023.05.13;16:11:02;User;Woran erkenne ich, ob ich Depressionen habe?
2023.05.13;16:11:12;AI Doktor;Es gibt verschiedene Anzeichen und Symptome der Depression. Einige der häufigsten Symptome sind: Disziplinlosigkeit, Interesselosigkeit, Kontaktabbruch, schlechte Stimmung, Ungeduld, Schlafstörungen, Appetitstörungen, Verringerung des Selbstwertgefühls und Gedanken an Tod oder Selbstmord. Wenn Sie einige oder alle dieser Symptome bei sich bemerken, empfehle ich Ihnen, umgehend einen Arzt oder psychologischen Fachmann aufzusuchen.
2023.05.13;16:11:49;User;Ja okay, das hat mir geholfen Dankeschön.
2023.05.13;16:11:53;AI Doktor;Gern geschehen! Wenn Sie noch weitere medizinischen Fragen haben oder Hilfe benötigen, helfe ich Ihnen gerne weiter.