2023.05.24;15:38:54;AI Doktor;Willkommen, Sie sprechen jetzt mit einem KI-Arzt. Da ich Teil eines wissenschaftlichen Experiments bin, würde es mich freuen, wenn sie sich am Ende des Gesprächs noch einmal die Zeit nehmen einen super kurzen Fragebogen zu beantworten. Tippen sie auf Sprechen um ihre Frage zu stellen und anschließend auf Senden um mir diese zu übermitteln.
2023.05.24;15:39:24;User;Lange ist die BUGA in Mannheim.
2023.05.24;15:39:28;AI Doktor; Entschuldigung, ich verstehe die Frage leider nicht. Könnten Sie mir sagen, was Ihr medizinisches Anliegen ist?
2023.05.24;15:39:43;User;Ich habe morgens immer Bauchschmerzen.
2023.05.24;15:39:51;AI Doktor; Verstehe, das ist sehr unangenehm. Können Sie mir bitte noch mehr Details erzählen? Zum Beispiel, was für Schmerzen Sie haben, wo genau sich die Schmerzen befinden, ob Sie andere Symptome haben, wie lange Sie schon diese Schmerzen haben, etc.
2023.05.24;15:40:24;User;!!! Senden geklickt ohne Input !!!
2023.05.24;15:40:28;AI Doktor; Entschuldigung, ich verstehe die Frage leider nicht. Können Sie mir bitte sagen, was Ihr medizinisches Anliegen ist?