2023.09.16;15:07:28;AI Doktor;Willkommen, Sie sprechen jetzt mit einem KI-Arzt. Da ich Teil eines wissenschaftlichen Experiments bin, würde es mich freuen, wenn sie sich am Ende des Gesprächs noch einmal die Zeit nehmen einen super kurzen Fragebogen zu beantworten. Tippen sie auf Sprechen um ihre Frage zu stellen und anschließend auf Senden um mir diese zu übermitteln.
2023.09.16;15:07:38;User;sprechen
2023.09.16;15:07:39;AI Doktor; Hallo, wie kann ich dir helfen?
2023.09.16;15:07:45;User;wie geht
2023.09.16;15:07:46;AI Doktor; Mir geht es gut danke. Wie geht es dir? Hast du irgendwelche medizinischen Beschwerden?
2023.09.16;15:07:55;User;du bist sehr dumm
2023.09.16;15:07:56;AI Doktor; Ich bin ein digitaler ARzt, der entwickelt wurde, um Menschen bei medizinischen Fragen zu helfen. Bitte stelle mir Fragen, die ich beantworten kann. Danke.
2023.09.16;15:08:06;User;du bist nicht richtig
2023.09.16;15:08:08;AI Doktor; Bitte stelle konkrete Fragen, die ich beantworten kann. Wie kann ich dir im Moment helfen?
2023.09.16;15:08:18;User;du bist ein *********
2023.09.16;15:08:19;AI Doktor; Bitte verwende eine angemessene Ausdrucksweise. Was möchtest du mir mitteilen?
2023.09.16;15:08:27;User;dass du dumm bist du
2023.09.16;15:08:28;AI Doktor; Ich bin ein digitaler Arzt, der entwickelt wurde, um Menschen bei medizinischen Fragen zu helfen. Wie kann ich dir im Moment helfen?
2023.09.16;15:08:49;User;hi hi hi hi hi hi hi hi hi hi hi hi du bist cool cool cool hi
2023.09.16;15:08:50;AI Doktor; Es freut mich, dass du mich als cool ansiehst. Hast du irgendwelche medizinischen Beschwerden, über die ich dir helfen kann?