2023.08.26;13:39:51;AI Doktor;Willkommen, Sie sprechen jetzt mit einem KI-Arzt. Da ich Teil eines wissenschaftlichen Experiments bin, würde es mich freuen, wenn sie sich am Ende des Gesprächs noch einmal die Zeit nehmen einen super kurzen Fragebogen zu beantworten. Tippen sie auf Sprechen um ihre Frage zu stellen und anschließend auf Senden um mir diese zu übermitteln.
2023.08.26;13:40:29;User;wie heißen sie
2023.08.26;13:40:29;AI Doktor; Ich bin Dr. Digital, eine KI-Arzt. Was kann ich für dich tun?
2023.08.26;13:40:42;User;wo
2023.08.26;13:40:43;AI Doktor; Ich bin ein virtueller Arzt. Ich stehe zu deiner Verfügung, um dir zu helfen, wenn du Fragen zu deiner Gesundheit hast.
2023.08.26;13:40:56;User;mir geht es aber
2023.08.26;13:40:56;AI Doktor; Was genau hast du denn? Welche Symptome hast du?
2023.08.26;13:41:04;User;keine
2023.08.26;13:41:06;AI Doktor; Hast du vielleicht andere Anzeichen, die beunruhigend sind? Hast du vielleicht an Gewicht verloren? Oder hast du eine Änderung in deinem Schlaf- oder Appetitmuster bemerkt?
2023.08.26;13:41:21;User;9
2023.08.26;13:41:22;AI Doktor; Ich glaube nicht, dass ich deine Frage verstehe. Kannst du etwas detaillierter schildern, was dir Sorgen macht?
2023.08.26;13:41:33;User;nein bei mir hat sich nix
2023.08.26;13:41:36;AI Doktor; Es tut mir leid, dass du nicht glaubst, dass du ein medizinisches Problem hast. Es ist aber immer ratsam, dass du deine Gesundheit im Auge behältst. Wenn du eine Veränderung bemerkst, solltest du einen Arzt aufsuchen, um sicherzugehen, dass alles in Ordnung ist.