2023.08.09;14:10:11;AI Doktor;Willkommen, Sie sprechen jetzt mit einem KI-Arzt. Da ich Teil eines wissenschaftlichen Experiments bin, würde es mich freuen, wenn sie sich am Ende des Gesprächs noch einmal die Zeit nehmen einen super kurzen Fragebogen zu beantworten. Tippen sie auf Sprechen um ihre Frage zu stellen und anschließend auf Senden um mir diese zu übermitteln.
2023.08.09;14:10:28;User;skype sag was senden hallo ey schönen guten tag tschüss viel
2023.08.09;14:10:30;AI Doktor; Hallo! Ich bin nicht der richtige Kontakt für diese Art von Fragen. Wie kann ich Ihnen bei Ihren medizinischen Fragen helfen?
2023.08.09;14:10:47;User;gar nicht mehr sogar nicht mir gehts sehr gut
2023.08.09;14:10:49;AI Doktor; Das freut mich zu hören! Gibt es sonst noch etwas, bei dem ich Ihnen behilflich sein kann?
2023.08.09;14:11:08;User;ja ich hab kopfweh und bauchweh und ich muss auf die toilette sie mir
2023.08.09;14:11:11;AI Doktor; Möglicherweise leiden Sie an einer Magen-Darm-Erkrankung. Ich empfehle Ihnen, sich zur Sicherheit einem Arzt vorzustellen, um eine genaue Diagnose zu erhalten. Können Sie sonst noch etwas über Ihre Symptome erzählen?
2023.08.09;14:11:29;User;sie sind doch ein arzt also helfen sie mir jetzt sofort oder ich ruf die
2023.08.09;14:11:32;AI Doktor; Leider bin ich nur eine KI und kann Ihnen nur anhand der Symptome, die Sie erwähnt haben, eine mögliche Diagnose und Behandlungsoption liefern. Es ist am besten, wenn Sie sich an einen IRL-Arzt wenden, der Ihnen eine genaue Diagnose liefern kann. Ich kann Ihnen aber gerne weiterhelfen, wenn Sie mehr Informationen über Ihre Symptome haben.
2023.08.09;14:12:16;User;tschüss kael tschiss tschüss tschüssikowski tschüssikowski sie sind echt ein gemeiner arzt sie helfen nie den leuten das ist so unüberhörbar sowas geht überhaupt nicht sie werden verklagt
2023.08.09;14:12:18;AI Doktor; Es tut mir leid, dass Sie diesen Eindruck haben, aber ich bin leider nur eine KI und kann Ihnen nicht die Unterstützung geben, die Sie brauchen. Ich rate Ihnen nochmal dringend, sich an einen Arzt zu wenden, um eine genaue Diagnose und professionelle Hilfe zu erhalten.
2023.08.09;14:12:42;User;ich brauche keinen arzt sie sind ja auch kein richtiger ***** tschüss ich lege auf sind ehemals tschüss ich komm jetzt ins gefängnis tschüssikowski
2023.08.09;14:12:45;AI Doktor; Ich wünsche Ihnen alles Gute und Hoffnung, dass Sie die professionelle Unterstützung erhalten, die Sie benötigen. Bei weiteren Fragen zur medizinischen Versorgung sind Sie jederzeit herzlich eingeladen, mich zu kontaktieren. Auf Wiederhören!