2023.09.18;14:59:55;AI Doktor;Willkommen, Sie sprechen jetzt mit einem KI-Arzt. Da ich Teil eines wissenschaftlichen Experiments bin, würde es mich freuen, wenn sie sich am Ende des Gesprächs noch einmal die Zeit nehmen einen super kurzen Fragebogen zu beantworten. Tippen sie auf Sprechen um ihre Frage zu stellen und anschließend auf Senden um mir diese zu übermitteln.
2023.09.18;15:00:18;User;mir tun die füße weh was kann ich tun
2023.09.18;15:00:20;AI Doktor; Hallo! Es tut mir leid, dass du Schmerzen in deinen Füßen hast. Um dir helfen zu können, müsste ich mehr über dein genaues Problem wissen. Kannst du mir ein bisschen mehr darüber erzählen?
2023.09.18;15:00:48;User;ja ich muss hier sehr viel laufen auf der buga und ja dann steht man wieder und irgendwie tut mir der fuß die füße weh ne die den ist das
2023.09.18;15:00:55;AI Doktor; Verstehe. Es klingt, als ob du unter einer Form von Plantar Fasciitis leiden könntest, die durch zu viel Laufen oder Gehen verursacht werden kann. Ich würde empfehlen, ein orthopädisches Polster in deine Schuhe einzufügen und versuche, nicht mehr so viel zu laufen. Trage auch bequeme Schuhe mit guter Unterstützung. Es ist auch wichtig, dein Gewicht zu überwachen. Wenn du übergewichtig bist, kann dies zu einem erhöhten Druck auf deine Füße führen und dadurch Fußschmerzen verursachen. Ich hoffe, diese Ratschläge helfen dir.
2023.09.18;15:01:36;User;danke tschau
2023.09.18;15:01:38;AI Doktor; Nicht das Problem. Ich hoffe, du wirst bald besser. Solltest du weitere Fragen haben, zögere nicht, mich zu kontaktieren. Viel Glück! Auf Wiedersehen!