2023.08.28;15:05:21;AI Doktor;Willkommen, Sie sprechen jetzt mit einem KI-Arzt. Da ich Teil eines wissenschaftlichen Experiments bin, würde es mich freuen, wenn sie sich am Ende des Gesprächs noch einmal die Zeit nehmen einen super kurzen Fragebogen zu beantworten. Tippen sie auf Sprechen um ihre Frage zu stellen und anschließend auf Senden um mir diese zu übermitteln.
2023.08.28;15:05:51;User;wie kann ich denn meine blase stärken
2023.08.28;15:05:53;AI Doktor; Zunächst möchte ich Sie fragen, warum Sie Ihre Blase stärken möchten. Haben Sie bereits irgendwelche Symptome oder Beschwerden, die Sie dazu veranlasst haben?
2023.08.28;15:06:09;User;ich kann nachts manchmal nicht durchschlafen
2023.08.28;15:06:11;AI Doktor; Haben Sie vor kurzem eine harte Blasenentzündung gehabt? Oder vielleicht eine andere Entzündung der Harnwege?
2023.08.28;15:06:20;User;nein
2023.08.28;15:06:23;AI Doktor; In Ordnung. Es könnte sich also um ein Problem handeln, das nicht durch Blasen- oder Nierenprobleme verursacht wird. Haben Sie andere mögliche Symptome, die Sie beobachtet haben? Zum Beispiel Änderungen in Ihrem natürlichen Biorhythmus oder Rückenschmerzen?
2023.08.28;15:06:39;User;nein
2023.08.28;15:06:44;AI Doktor; In diesem Fall sollten Sie Ihren Hausarzt kontaktieren, um einen allgemeinen Gesundheitscheck durchzuführen. Ihr Arzt wird möglicherweise weitere Tests wie Blutuntersuchungen, Urintests oder Bildgebungsstudien durchführen, um festzustellen, ob Sie unter Schlaflosigkeit oder anderen gesundheitlichen Problemen leiden. Diese Tests helfen Ihrem Arzt auch bei der Diagnose und Behandlung Ihrer Beschwerden. Wenn Sie möchten, können Sie auch physische Therapien ausprobieren, um Ihre körperliche Fitness und Ihren Biorhythmus zu verbessern.
2023.08.28;15:07:21;User;an den physischen therapien wäre ich interessiert
2023.08.28;15:07:25;AI Doktor; Eine Physiotherapie wäre eine gute Möglichkeit, Ihre Blase zu befestigen und Ihren Körper zu stärken. Ihr Arzt kann Ihnen helfen, die richtige Therapie für Ihre speziellen Bedürfnisse zu finden. Es gibt eine Reihe von übungen, die helfen können, die Muskeln der Blase zu stärken und das Gefühl der Kontrolle zu verbessern.
2023.08.28;15:07:48;User;vielen
2023.08.28;15:07:50;AI Doktor; Es ist mir ein Vergnügen, Ihnen zu helfen. Wenn Sie noch weitere Fragen oder Anliegen haben, zögern Sie nicht, mich zu kontaktieren.
2023.08.28;15:07:54;User;vielen dank
2023.08.28;15:07:55;AI Doktor; Es freut mich, dass ich Ihnen helfen konnte. Alles Gute!