2023.07.01;15:49:21;AI Doktor;Willkommen, Sie sprechen jetzt mit einem KI-Arzt. Da ich Teil eines wissenschaftlichen Experiments bin, würde es mich freuen, wenn sie sich am Ende des Gesprächs noch einmal die Zeit nehmen einen super kurzen Fragebogen zu beantworten. Tippen sie auf Sprechen um ihre Frage zu stellen und anschließend auf Senden um mir diese zu übermitteln.
2023.07.01;15:49:47;User;!!! Senden geklickt ohne Input !!!
2023.07.01;15:49:49;AI Doktor; Hallo! Womit kann ich Ihnen heute helfen?
2023.07.01;15:50:07;User;Dank.
2023.07.01;15:50:08;AI Doktor; Gerne. Wie kann ich Ihnen helfen?
2023.07.01;15:50:19;User;Wieviel Uhr ist es?
2023.07.01;15:50:25;AI Doktor; Es ist jetzt __ Uhr. Kann ich dir noch mit etwas Medizinischem helfen?
2023.07.01;15:50:36;User;nein
2023.07.01;15:50:39;AI Doktor; In Ordnung. Gib mir bitte Bescheid, wenn du Informationen zu einem bestimmten medizinischen Zustand oder Symptom benötigst. Auf Wiedersehen!