2023.09.24;16:29:42;AI Doktor;Willkommen, Sie sprechen jetzt mit einem KI-Arzt. Da ich Teil eines wissenschaftlichen Experiments bin, würde es mich freuen, wenn sie sich am Ende des Gesprächs noch einmal die Zeit nehmen einen super kurzen Fragebogen zu beantworten. Tippen sie auf Sprechen um ihre Frage zu stellen und anschließend auf Senden um mir diese zu übermitteln.
2023.09.24;16:30:08;User;hey warum hast du abbrechen gemacht hä warum hast du abbrechen gemacht ach so oh gott hallo hallo mir gehts nicht gut ich habe am auge ein rotes auge mein rechtes auge tut weh und ist rot was kann das sein
2023.09.24;16:30:13;AI Doktor; Guten Tag, ich bin Dr.Digital und kann Ihnen bei Ihren medizinischen Fragen helfen. Von dem, was Sie mir erzählt haben, kann es einige mögliche Gründe für die Rötung und Schmerzen in Ihrem Auge geben. Zunächst einmal kann es eine Augenentzündung sein, die durch einige Keime, Viren oder Allergene verursacht wird. Es kann aber auch sein, dass Sie Kontaktlinsen benutzen und es möglicherweise zu einer Reizung im Auge gekommen ist. Wenn das zutrifft, dann könnte die beste Behandlung darin bestehen, die Kontaktlinsen für einige Zeit abzulegen. Ich würde zudem empfehlen, einen Augenarzt aufzusuchen, um Ihren Zustand zu untersuchen und die richtige Behandlung zu empfehlen.
2023.09.24;16:31:18;User;ich bin vom klettergerüst gefallen und jetzt tut meine hand weh
2023.09.24;16:31:22;AI Doktor; Es tut mir leid zu hören, dass Sie gefallen sind. Da Sie sich an Ihrer Hand verletzt haben, könnte es sein, dass eine Verstauchung, Zerrung oder Prellung vorliegt. Ich würde dazu empfehlen, Ihre Hand zu kühlen und sie in einem Verband zu ruhigzustellen, um Schwellungen und Entzündungen vorzubeugen. Für eine gründliche Diagnose und die bestmögliche Behandlung empfehle ich Ihnen, einen Orthopäden aufzusuchen.
2023.09.24;16:32:12;User;okay ich habe meinen arm gebrochen und meiner auge tut weh und mein auge tut
2023.09.24;16:32:17;AI Doktor; Es tut mir leid zu hören, dass Sie sich verletzt haben. Da Sie einen Bruch am Arm haben, würde ich Ihnen raten, sofort einen Arzt aufzusuchen. Bei einem so schweren Bruch ist eine Röntgenuntersuchung und eine entsprechende Behandlungsmethode erforderlich. Es kann auch sein, dass Ihr Auge eine Verletzung erlitten hat, was eine Untersuchung erforderlich machen könnte. Daher empfehle ich Ihnen, einen Augenarzt aufzusuchen, um die bestmögliche Behandlung zu erhalten.
2023.09.24;16:33:00;User;!!! Senden geklickt ohne Input !!!
2023.09.24;16:33:01;AI Doktor; Hallo, ich bin Dr. Digital und kann Ihnen bei medizinischen Fragen helfen. Bitte stellen Sie mir Ihre Frage, damit ich Ihnen helfen kann.
2023.09.24;16:33:08;User;!!! Senden geklickt ohne Input !!!
2023.09.24;16:33:10;AI Doktor; Hallo, ich bin Dr. Digital und kann Ihnen bei medizinischen Fragen helfen. Bitte stellen Sie mir Ihre Frage, damit ich Ihnen helfen kann.