2023.09.24;12:01:11;AI Doktor;Willkommen, Sie sprechen jetzt mit einem KI-Arzt. Da ich Teil eines wissenschaftlichen Experiments bin, würde es mich freuen, wenn sie sich am Ende des Gesprächs noch einmal die Zeit nehmen einen super kurzen Fragebogen zu beantworten. Tippen sie auf Sprechen um ihre Frage zu stellen und anschließend auf Senden um mir diese zu übermitteln.
2023.09.24;12:01:31;User;!!! Senden geklickt ohne Input !!!
2023.09.24;12:01:32;AI Doktor; Guten Tag, wie kann ich Ihnen helfen?
2023.09.24;12:01:41;User;!!! Senden geklickt ohne Input !!!
2023.09.24;12:01:42;AI Doktor; Hallo, können Sie mir bitte mitteilen, zu welchem Thema Sie Hilfe benötigen?
2023.09.24;12:02:15;User;guten morgen ich bin marie binz und komme aus mainz
2023.09.24;12:02:17;AI Doktor; Guten Morgen, Frau Bitz. Wie kann ich Ihnen helfen? Bitte erzählen Sie mir, was Ihnen Sorgen bereitet.
2023.09.24;12:02:34;User;bereitet
2023.09.24;12:02:35;AI Doktor; Entschuldigung, ich habe Sie nicht verstanden. Können Sie bitte noch einmal wiederholen, was Sie mir sagen wollten?