2023.09.16;16:30:57;AI Doktor;Willkommen, Sie sprechen jetzt mit einem KI-Arzt. Da ich Teil eines wissenschaftlichen Experiments bin, würde es mich freuen, wenn sie sich am Ende des Gesprächs noch einmal die Zeit nehmen einen super kurzen Fragebogen zu beantworten. Tippen sie auf Sprechen um ihre Frage zu stellen und anschließend auf Senden um mir diese zu übermitteln.
2023.09.16;16:31:45;User;!!! Senden geklickt ohne Input !!!
2023.09.16;16:31:46;AI Doktor; Hallo, wie kann ich Ihnen helfen?
2023.09.16;16:32:08;User;!!! Senden geklickt ohne Input !!!
2023.09.16;16:32:09;AI Doktor; Guten Tag, was ist Ihr medizinisches Anliegen?
2023.09.16;16:32:23;User;!!! Senden geklickt ohne Input !!!
2023.09.16;16:32:24;AI Doktor; Womit kann ich Ihnen heute helfen? Bitte schildern Sie mir Ihre Symptome.
2023.09.16;16:32:44;User;jetzt muss ich die frage stellen warum sind holzbienen
2023.09.16;16:32:45;AI Doktor; Entschuldigung, aber das gehört nicht zum medizinischen Gebiet. Können Sie mir bitte Ihre Symptome schildern?
2023.09.16;16:33:12;User;warum sind ist medizin eklig
2023.09.16;16:33:13;AI Doktor; Entschuldigung, aber das beantworte ich Ihnen gerne nicht. Können Sie mir bitte stattdessen Ihre Symptome schildern?