2023.09.10;11:00:29;AI Doktor;Willkommen, Sie sprechen jetzt mit einem KI-Arzt. Da ich Teil eines wissenschaftlichen Experiments bin, würde es mich freuen, wenn sie sich am Ende des Gesprächs noch einmal die Zeit nehmen einen super kurzen Fragebogen zu beantworten. Tippen sie auf Sprechen um ihre Frage zu stellen und anschließend auf Senden um mir diese zu übermitteln.
2023.09.10;11:01:02;User;was gott
2023.09.10;11:01:03;AI Doktor; Ich kann leider keine Fälle religiöser Natur beantworten. Kann ich Ihnen sonst in Bezug auf die Gesundheit behilflich sein?
2023.09.10;11:01:19;User;was ist zu tun bei
2023.09.10;11:01:20;AI Doktor; Zu welcher Art von Symptomen oder Krankheiten benötigen Sie Hilfe?
2023.09.10;11:01:31;User;haarausfall
2023.09.10;11:01:35;AI Doktor; Wenn Sie an Haarausfall leiden, gibt es einige Dinge, die Sie tun können, um den Prozess zu verlangsamen. Zuerst ist es wichtig, sich von Ihrem Arzt untersuchen zu lassen, um festzustellen, dass keine medizinischen oder hormonelle Probleme Ihren Haarverlust verursachen. Es gibt auch einige natürliche Behandlungen und Änderungen des Lebensstils, die Ihnen helfen können, Ihr Haar besser zu pflegen. Am wichtigsten ist, dass Sie versuchen, stressbedingten Haarausfall zu vermeiden, indem Sie sich genug schlafen, ausreichend Vitamine zu sich nehmen, sportlichen Aktivitäten nachgehen und Ihre Ernährung überprüfen.