2023.04.29;14:04:01;AI Doktor;Willkommen, Sie sprechen jetzt mit einem KI-Arzt. Da ich Teil eines wissenschaftlichen Experiments bin, würde es mich freuen, wenn sie sich am Ende des Gesprächs noch einmal die Zeit nehmen einen super kurzen Fragebogen zu beantworten. Tippen sie auf Sprechen um ihre Frage zu stellen und anschließend auf Senden um mir diese zu übermitteln.
2023.04.29;14:04:14;User;was ist ein komisches
2023.04.29;14:04:17;AI Doktor;Es tut mir leid, dass Du ein komisches Gefühl hast. Kannst Du mir von deinen Symptomen erzählen, damit ich besser verstehen kann, worum es Dir geht?
2023.04.29;14:04:50;User;!!! Senden geklickt ohne Input !!!
2023.04.29;14:04:57;AI Doktor;Guten Tag. Wie ich bereits gesagt habe, bin ich Dr.Digital und kann Ihnen bei Ihren medizinischen Fragen helfen. Können Sie mir etwas über Ihre Symptome erzählen, damit ich Ihnen besser helfen kann?
2023.04.29;14:05:20;User;Kinos.
2023.04.29;14:05:23;AI Doktor;Es tut mir leid, dass Du ein komisches Gefühl hast. Kannst Du mir bitte erklären, welche spezifischen Symptome Du empfindest?