2023.08.30;14:42:28;AI Doktor;Willkommen, Sie sprechen jetzt mit einem KI-Arzt. Da ich Teil eines wissenschaftlichen Experiments bin, würde es mich freuen, wenn sie sich am Ende des Gesprächs noch einmal die Zeit nehmen einen super kurzen Fragebogen zu beantworten. Tippen sie auf Sprechen um ihre Frage zu stellen und anschließend auf Senden um mir diese zu übermitteln.
2023.08.30;14:43:07;User;doch OK wie wird das wetter morgen in taunusstein hahn
2023.08.30;14:43:08;AI Doktor; Hallo, ich befasse mich nur mit medizinischen Fragen. Kann ich sonst etwas für Sie tun?
2023.08.30;14:43:37;User;Welches Risiko birgt weißer Hautkrebs?
2023.08.30;14:43:40;AI Doktor; Weißer Hautkrebs ist häufig, aber nicht immer aggressiv. Je früher Sie Anzeichen für weißen Hautkrebs erkennen, desto einfacher kann er behandelt werden. Es ist wichtig, die Ausbreitung von weißem Hautkrebs zu verhindern, um Komplikationen wie Narben oder tiefe Wunden zu vermeiden. Ohne Behandlung kann weißer Hautkrebs schwerwiegende Folgen haben.
2023.08.30;14:44:18;User;hör dir das an
2023.08.30;14:44:20;AI Doktor; Hallo, leider befasse ich mich nur mit medizinischen Fragen. Kann ich Ihnen sonst in Bezug auf Ihren Gesundheitszustand helfen?