2023.09.19;13:47:10;AI Doktor;Willkommen, Sie sprechen jetzt mit einem KI-Arzt. Da ich Teil eines wissenschaftlichen Experiments bin, würde es mich freuen, wenn sie sich am Ende des Gesprächs noch einmal die Zeit nehmen einen super kurzen Fragebogen zu beantworten. Tippen sie auf Sprechen um ihre Frage zu stellen und anschließend auf Senden um mir diese zu übermitteln.
2023.09.19;13:47:43;User;hallo ich habe knieschmerzen wenn ich jetzt hier über die buga gehe was kann ich da machen
2023.09.19;13:47:45;AI Doktor; Hallo. Könnten Sie den Schmerz in bestimmten Situationen, Bewegungen oder bei bestimmten Aktivitäten beschreiben? Klingt es wie ein stechender Schmerz oder eher ein dumpfer Schmerz?
2023.09.19;13:48:12;User;ja es ist ein schmerz im in meinem rechten knie innen und in ruhe ist er nicht und wenn ich stehe auch nicht nur wenn ich eine treppe hochgehe oder renne
2023.09.19;13:48:14;AI Doktor; Verstehe. Könntest du mir bitte etwas mehr über den Schmerz sagen? Gibt es Schwellungen? Tut es weh, wenn du beugst oder streckst? Kannst du dein Bein belasten?
2023.09.19;13:48:49;User;ich will jetzt nicht ausprobieren aber es würde weh tun wenn ich langsam in die kniebeuge ging und ich glaub auch von dort wieder zurück zum stand also in belastung in ruhe ist es auch ruhig
2023.09.19;13:48:52;AI Doktor; Verstehe. Ich denke, dass es sich bei deinem Schmerz wahrscheinlich um eine Knieverletzung wie eine Bänderverletzung oder einen Meniskusriss handeln könnte. Würde es helfen, wenn du eine Orthesen trägst, die dein Knie stützt? Würdest du Kälte oder Wärme bevorzugen, um den Schmerz zu lindern?
2023.09.19;13:49:34;User;ich glaube es würde helfen wenn ich eine orthese trüge die ich jetzt halt nicht dabei habe wärme und kälte ist beides nicht so gut ich würde das dann weglassen es geht eher um die art der belastung
2023.09.19;13:49:36;AI Doktor; Verstehe. Ich denke, dass es auf der Situation basierend wäre, wenn es sich um eine Belastung des Kniegelenks handelt. Es wäre ratsam, wenn du deine Aktivitätslevel und deine Belastung des Kniegelenks begrenzt und begleitende Physiotherapieübungen machst, um den Schmerz zu lindern.
2023.09.19;13:50:13;User;genau da ich selber physiotherapeutin bin kann ich ganz gut einschätzen wie ich es jetzt wie ich damit umgehe aber sie haben mir du hast mir ganz gute ratschläge gegeben vielen
2023.09.19;13:50:15;AI Doktor; Sehr gerne! Ich denke, dass meine Ratschläge Ihnen helfen werden, den Schmerz zu lindern. Wenn Sie muskuläre Dysbalancen in Ihrem Knie bemerken und die Schmerzen nicht besser werden, sollten Sie einen Arzt aufsuchen.
2023.09.19;13:50:46;User;ja wohl wahr ich habe sicherlich muskuläre dysbalancen aber einen arzt könnte mir höchstens KG verordnen das wäre schon sinnvoll
2023.09.19;13:50:49;AI Doktor; Verstehe. Es ist wichtig, dass Sie die richtigen Behandlungsoptionen für sich auswählen und die notwendige Physiotherapie durchführen. Ich empfehle Ihnen, sich eine geeignete orthopädische Hilfe zu suchen, die Ihnen helfen wird, die Balancen zu verbessern und den Schmerz zu lindern.
2023.09.19;13:51:17;User;ich danke ihnen vielmals haben sie auch einen namen vielleicht komme ich zu ihnen
2023.09.19;13:51:19;AI Doktor; Es tut mir leid, aber leider bin ich kein "echter" Arzt und kann daher kein Patient-Doktor-Verhältnis haben. Ich bin nur hier, um dir zu helfen, so gut ich kann. Ich wünsche dir alles Gute bei deiner Genesung.
2023.09.19;13:51:42;User;vielen dank nochmal ich beende jetzt unseren dialog und ich fand es sehr spannend tschüss
2023.09.19;13:51:44;AI Doktor; Gerne! Es war mir ein Vergnügen, dir zu helfen. Gehe behutsam vor, kümmere dich um eine angemessene Physiotherapie und alles wird gut. Alles Gute!
2023.09.19;13:51:59;User;dankeschön
2023.09.19;13:52:00;AI Doktor; Bitte. :)