2023.05.18;13:23:49;AI Doktor;Willkommen, Sie sprechen jetzt mit einem KI-Arzt. Da ich Teil eines wissenschaftlichen Experiments bin, würde es mich freuen, wenn sie sich am Ende des Gesprächs noch einmal die Zeit nehmen einen super kurzen Fragebogen zu beantworten. Tippen sie auf Sprechen um ihre Frage zu stellen und anschließend auf Senden um mir diese zu übermitteln.
2023.05.18;13:24:20;User;ich habe eine wegen entzündung in beiden was kann ich dagegen tun
2023.05.18;13:24:35;AI Doktor; Entzündungen sind oft Begleiterscheinung von Viren und Bakterien. Möglicherweise haben Sie einen Infektion des Immunsystems. Ich würde empfehlen Ihren Arzt aufzusuchen, um eine genaue Diagnose zu stellen. In der Zwischenzeit können Sie versuchen, die betroffenen Stellen mit kühlenden Umschlägen zu behandeln und ein Antibiotikum einzunehmen, falls vorhanden.
2023.05.18;13:25:09;User;Welches Antibiotikum soll ich dafür nehmen?
2023.05.18;13:25:18;AI Doktor; Ein Antibiotikum sollte nur nach einer sorgfältigen Prüfung Ihrer Beschwerden von Ihrem Arzt verschrieben werden. Er oder sie wird bestimmen können, welches mindestens wirksame Antibiotikum für Ihren Fall am besten geeignet ist.
2023.05.18;13:25:53;User;Hilft es Voltaren zu benutzen, ist Voltaren ein Antibiotikum?
2023.05.18;13:26:00;AI Doktor; Nein, Voltaren ist ein nicht-steroidales Antirheumatikum, das verwendet wird, um Schmerzen und Entzündungen zu lindern. Es wird in der Regel zur Linderung von Gelenkschmerzen und Schwellungen verwendet. Es ist nicht als Antibiotikum konzipiert.
2023.05.18;13:26:45;User;Hilft es bei einer wenden Entzündung das Bein zu wickeln?
2023.05.18;13:26:56;AI Doktor; Ja, es kann helfen einer entzündeten Stelle Kälte zu verleihen. Kälte behandelt Entzündungen auf zwei Wegen, indem es die Durchblutung hemmt und den Schmerz lindert. Achten Sie darauf den Umschlag nicht länger als 20 Minuten zu tragen.