2023.05.14;14:53:29;AI Doktor;Willkommen, Sie sprechen jetzt mit einem KI-Arzt. Da ich Teil eines wissenschaftlichen Experiments bin, würde es mich freuen, wenn sie sich am Ende des Gesprächs noch einmal die Zeit nehmen einen super kurzen Fragebogen zu beantworten. Tippen sie auf Sprechen um ihre Frage zu stellen und anschließend auf Senden um mir diese zu übermitteln.
2023.05.14;14:53:41;User;Hallo.
2023.05.14;14:53:45;AI Doktor;Hallo, wie kann ich Ihnen helfen? Bitte beschreiben Sie mir Ihre Symptome, damit ich Ihnen bei Ihrer Diagnose und Behandlung helfen kann.
2023.05.14;14:54:19;User;Ich habe einen Regenbogen ausgepupst.
2023.05.14;14:54:25;AI Doktor;Das klingt sehr ungewöhnlich! Ich möchte noch einige weitere Informationen von Ihnen erhalten. Welche anderen Symptome haben Sie? Haben Sie Fieber, Schmerzen oder eine ungewöhnliche Hautfarbe?
2023.05.14;14:54:46;User;Meine Haut ist blau und ich kotze den ganzen Tag Würmer.
2023.05.14;14:54:57;AI Doktor;Es tut mir leid zu hören, dass Sie Blau- und Würmerausschlag haben. Können Sie mir einige weitere Informationen über Ihren Zustand geben? Welcher ihrer Symptome ist am stärksten? Haben Sie auch Kopfschmerzen, Gelenkschmerzen oder Fieber?