2023.08.28;12:37:52;AI Doktor;Willkommen, Sie sprechen jetzt mit einem KI-Arzt. Da ich Teil eines wissenschaftlichen Experiments bin, würde es mich freuen, wenn sie sich am Ende des Gesprächs noch einmal die Zeit nehmen einen super kurzen Fragebogen zu beantworten. Tippen sie auf Sprechen um ihre Frage zu stellen und anschließend auf Senden um mir diese zu übermitteln.
2023.08.28;12:38:19;User;!!! Senden geklickt ohne Input !!!
2023.08.28;12:38:20;AI Doktor; Hallo, wie kann ich Ihnen heute helfen?
2023.08.28;12:38:28;User;hallo wie wird das wetter heute
2023.08.28;12:38:29;AI Doktor; Wird was? Können Sie etwas präziser beschreiben? Ich tue mein Bestes, um Sie zu unterstützen.
2023.08.28;12:38:53;User;hallo wie wird das wetter heute
2023.08.28;12:38:54;AI Doktor; Das Wetter ist nicht mein Fachgebiet, aber ich kann mit Ihnen über Ihre medizinischen Fragen sprechen. Können Sie mir sagen, worüber Sie gerne mehr erfahren möchten?