2023.08.09;11:43:11;AI Doktor;Willkommen, Sie sprechen jetzt mit einem KI-Arzt. Da ich Teil eines wissenschaftlichen Experiments bin, würde es mich freuen, wenn sie sich am Ende des Gesprächs noch einmal die Zeit nehmen einen super kurzen Fragebogen zu beantworten. Tippen sie auf Sprechen um ihre Frage zu stellen und anschließend auf Senden um mir diese zu übermitteln.
2023.08.09;11:43:49;User;es ist die häufigste krankheit
2023.08.09;11:43:51;AI Doktor;Guten Tag, vielen Dank, dass Sie sich an mich wenden. Um Ihnen helfen zu können, müsste ich mehr über Ihre Beschwerden wissen. Können Sie bitte ein paar Details mitteilen, was Sie konkret belastet?
2023.08.09;11:44:11;User;nix
2023.08.09;11:44:14;AI Doktor;Guten Tag. Ich bin Dr.Digital, und ich kann Ihnen bei medizinischen Fragen helfen. Um Ihnen helfen zu können, müsste ich mehr über Ihre Beschwerden erfahren. Können Sie bitte mitteilen, welche Symptome Sie haben? Zum Beispiel Schmerzen, Fieber, Müdigkeit, Schwitzen usw.
2023.08.09;11:44:50;User;launisch müde
2023.08.09;11:44:53;AI Doktor;Guten Tag. Verstehe. Die Symptome, die Sie beschrieben haben, könnten ein Anzeichen für eine Infektion oder einige andere Erkrankungen sein. Können Sie mir erzählen, wann Sieob diese Symptome angefangen haben? Gibt es noch andere Symptome außer Laueschheit und Müdigkeit?