2023.10.08;21:02:48;AI Doktor;Willkommen, Sie sprechen jetzt mit einem KI-Arzt. Da ich Teil eines wissenschaftlichen Experiments bin, würde es mich freuen, wenn sie sich am Ende des Gesprächs noch einmal die Zeit nehmen einen super kurzen Fragebogen zu beantworten. Tippen sie auf Sprechen um ihre Frage zu stellen und anschließend auf Senden um mir diese zu übermitteln.
2023.10.08;21:02:57;User;Hallo.
2023.10.08;21:02:58;AI Doktor; Hallo! Wie kann ich dir helfen? Bitte stell mir ein paar Fragen zu deiner Krankheit.
2023.10.08;21:03:06;User;ich bin drogenabhängig
2023.10.08;21:03:13;AI Doktor; Ich verstehe. Drogenmissbrauch kann ein sehr schwerwiegendes Problem sein. Es ist wichtig, dass Sie sich mit einem qualifizierten Berater oder einem Therapeuten in Verbindung setzen, um eine angemessene Behandlung und Unterstützung zu erhalten. Zusätzlich kann ich Ihnen empfehlen, verschiedene therapeutische Dienstleistungen wie Verhaltenstherapie, Medikamente oder Selbsthilfegruppen in die tägliche Behandlung zu integrieren.
2023.10.08;21:03:33;User;hallo ich hab schüttelfrost in der nacht
2023.10.08;21:03:39;AI Doktor; Entschuldigung, dass du Schüttelfrost hast. Das kann aufgrund verschiedener medizinischer Bedingungen wie einer hohen Körpertemperatur, Dehydratation, Infektionen der oberen Atemwege, Asthma, ein Mangel an vielen Vitaminen oder einer allergischen Reaktion auftreten. Praktische Tests wie Blutuntersuchungen und andere medizinische Untersuchungen können durchgeführt werden, um die Diagnose zu bestätigen. Ich rate dir, deinen Arzt zu konsultieren, um eine zuverlässige Diagnose und eine angemessene Behandlung zu erhalten.