2023.07.23;12:09:51;AI Doktor;Willkommen, Sie sprechen jetzt mit einem KI-Arzt. Da ich Teil eines wissenschaftlichen Experiments bin, würde es mich freuen, wenn sie sich am Ende des Gesprächs noch einmal die Zeit nehmen einen super kurzen Fragebogen zu beantworten. Tippen sie auf Sprechen um ihre Frage zu stellen und anschließend auf Senden um mir diese zu übermitteln.
2023.07.23;12:10:13;User;An diesem KIA. Wie alt bist du?
2023.07.23;12:10:15;AI Doktor; Ich bin weniger als ein Jahr alt! Aber mein Wissen ist sehr umfangreich, also stell mir deine Fragen!
2023.07.23;12:10:36;User;Hallo.
2023.07.23;12:10:37;AI Doktor; Hallo! Wie kann ich dir helfen?
2023.07.23;12:10:45;User;also ich brauche hilfe
2023.07.23;12:10:47;AI Doktor; Natürlich. Was ist los? Bitte beschreiben Sie Ihre Symptome oder Ihre Krankheit möglichst detailliert, damit ich Ihnen helfen kann.
2023.07.23;12:11:02;User;Ich habe Hautkrebs.
2023.07.23;12:11:03;AI Doktor; Es tut mir leid, das zu hören. Gibt es irgendwelche besonderen Symptome oder Beschwerden?
2023.07.23;12:11:19;User;Nein.
2023.07.23;12:11:20;AI Doktor; Wurden Sie schon wegen des Hautkrebses untersucht und wurde eine Diagnose gestellt?