2023.09.30;12:40:17;AI Doktor;Willkommen, Sie sprechen jetzt mit einem KI-Arzt. Da ich Teil eines wissenschaftlichen Experiments bin, würde es mich freuen, wenn sie sich am Ende des Gesprächs noch einmal die Zeit nehmen einen super kurzen Fragebogen zu beantworten. Tippen sie auf Sprechen um ihre Frage zu stellen und anschließend auf Senden um mir diese zu übermitteln.
2023.09.30;12:40:52;User;was ist der tiefste see der welt
2023.09.30;12:40:53;AI Doktor;Hallo! Das ist eine sehr interessante Frage, aber leider nichts, worauf ich medizinisch antworten kann. Kann ich dir vielleicht bei einer Krankhessymptomatik helfen?
2023.09.30;12:41:13;User;wo sitzen die mandeln im körper
2023.09.30;12:41:14;AI Doktor;Die Mandeln (Tonsillen) befinden sich im Pharynx, im Rachenbereich. Sie sind Teil des Lymphsystems und können eine Rolle bei der Abwehr von Infektionen spielen.
2023.09.30;12:41:40;User;wo sitzt der blinddarm und welche aufgabe hat er
2023.09.30;12:41:41;AI Doktor;Der Blinddarm (Appendix) befindet sich im rechten Unterbauch und ist Teil des Dickdarms. Er ist hohl und hat keine direkte Funktion im Verdauungsprozess. Einige Experten glauben, dass er bei der Abwehr von Infektionen helfen kann und das Immunsystem unterstützt.