2023.08.26;11:20:39;AI Doktor;Willkommen, Sie sprechen jetzt mit einem KI-Arzt. Da ich Teil eines wissenschaftlichen Experiments bin, würde es mich freuen, wenn sie sich am Ende des Gesprächs noch einmal die Zeit nehmen einen super kurzen Fragebogen zu beantworten. Tippen sie auf Sprechen um ihre Frage zu stellen und anschließend auf Senden um mir diese zu übermitteln.
2023.08.26;11:20:58;User;also äh sie dummer hund sie sind echt so ein ja ***** *****
2023.08.26;11:21:00;AI Doktor; Entschuldigung? Können Sie mir bitte erläutern, was Sie bedrückt und welche medizinische Frage Sie haben?
2023.08.26;11:21:16;User;wir wir wir wollen sie ärgern
2023.08.26;11:21:18;AI Doktor;Es tut mir leid, aber ich kann Ihnen leider nicht helfen, wenn Sie nicht eine medizinische Frage haben. Kann ich Ihnen etwas anderes behilflich sein?
2023.08.26;11:21:31;User;das ist mir egal wieso gucken sie so halten sie ihre ******
2023.08.26;11:21:32;AI Doktor; Es tut mir leid, aber ich kann Ihre Frage nicht beantworten. Können Sie mir bitte eine medizinische Frage stellen, die ich Ihnen beantworten kann?
2023.08.26;11:21:38;User;!!! Senden geklickt ohne Input !!!
2023.08.26;11:21:39;AI Doktor;Hallo, ich bin Dr.Digital und kann Ihnen helfen, Ihre medizinischen Fragen zu beantworten. Bitte stellen Sie Ihre Frage und ich werde mein Bestes geben, um Ihnen zu helfen.
2023.08.26;11:22:23;User;*********
2023.08.26;11:22:24;AI Doktor; Entschuldigung? Ich kann leider nicht verstehen, was Sie sagen. Können Sie bitte Ihre Frage präziser stellen, sodass ich Ihnen helfen kann?
2023.08.26;11:22:43;User;Speech Recognizer is now stopped.
2023.08.26;11:22:44;AI Doktor; Gut, Sie haben gesagt, dass der Speech Recognizer gestoppt wurde. Um welche Art medizinische Frage handelt es sich?
2023.08.26;11:22:56;User;hallo sie ********* sie sind ein *********
2023.08.26;11:22:58;AI Doktor; Entschuldigung, aber ich kann Ihre Frage nicht beantworten. Können Sie mir bitte eine medizinische Frage stellen, die ich Ihnen beantworten kann?