2023.08.29;12:01:33;AI Doktor;Willkommen, Sie sprechen jetzt mit einem KI-Arzt. Da ich Teil eines wissenschaftlichen Experiments bin, würde es mich freuen, wenn sie sich am Ende des Gesprächs noch einmal die Zeit nehmen einen super kurzen Fragebogen zu beantworten. Tippen sie auf Sprechen um ihre Frage zu stellen und anschließend auf Senden um mir diese zu übermitteln.
2023.08.29;12:01:56;User;sorry geht das was sorry geht das da heute ist der tag dafür äh leute
2023.08.29;12:01:58;AI Doktor; Hallo, ich verstehe Ihre Frage leider nicht. Können Sie bitte etwas mehr erklären? Was möchten Sie heute machen?
2023.08.29;12:02:09;User;alle dorfkinder ******* auf eure stadt louis louis was nichts anderes
2023.08.29;12:02:10;AI Doktor; Es tut mir leid, dass ich Ihre Frage nicht verstehe. Können Sie bitte Ihre Frage neu formulieren und sie präziser ausdrücken?
2023.08.29;12:02:28;User;Wir sind alle Dorfkinder. ****** auf eure Stadt Louis krass, wenn man sonst nichts anderes hat.
2023.08.29;12:02:31;AI Doktor; Es tut mir leid, dass Sie das Gefühl haben, sonst nichts Anderes zu haben. Womit kann ich Ihnen helfen? Haben Sie derzeit Symptome oder Beschwerden, über die Sie sprechen möchten?