2023.10.04;12:36:45;AI Doktor;Willkommen, Sie sprechen jetzt mit einem KI-Arzt. Da ich Teil eines wissenschaftlichen Experiments bin, würde es mich freuen, wenn sie sich am Ende des Gesprächs noch einmal die Zeit nehmen einen super kurzen Fragebogen zu beantworten. Tippen sie auf Sprechen um ihre Frage zu stellen und anschließend auf Senden um mir diese zu übermitteln.
2023.10.04;12:37:46;User;!!! Senden geklickt ohne Input !!!
2023.10.04;12:37:49;AI Doktor; Hallo, wie kann ich Ihnen heute helfen? Können Sie mir sagen, welche Symptome Sie haben?
2023.10.04;12:38:26;User;Speech Recognizer is now stopped.
2023.10.04;12:38:27;AI Doktor; Verstehe. Wie kann ich Ihnen also heute helfen? Benennen Sie mir bitte Ihre Symptome, dann kann ich Ihnen möglicherweise einige Anhaltspunkte für eine Diagnose geben.
2023.10.04;12:38:49;User;!!! Senden geklickt ohne Input !!!
2023.10.04;12:38:50;AI Doktor; Hallo nochmal. Können Sie mir bitte sagen, welche Symptome Sie haben?
2023.10.04;12:39:30;User;!!! Senden geklickt ohne Input !!!
2023.10.04;12:39:32;AI Doktor; Hallo, ich bin Dr. Digital. Wie kann ich Ihnen heute helfen? Bitte teilen Sie mir Ihre Symptome mit, damit ich Ihnen möglicherweise eine Verdachtsdiagnose geben und Ihnen Behandlungstipps geben kann.