2023.07.15;14:28:50;AI Doktor;Willkommen, Sie sprechen jetzt mit einem KI-Arzt. Da ich Teil eines wissenschaftlichen Experiments bin, würde es mich freuen, wenn sie sich am Ende des Gesprächs noch einmal die Zeit nehmen einen super kurzen Fragebogen zu beantworten. Tippen sie auf Sprechen um ihre Frage zu stellen und anschließend auf Senden um mir diese zu übermitteln.
2023.07.15;14:29:17;User;Hallo, mir ist so schwindelig.
2023.07.15;14:29:22;AI Doktor; Schwindel ist ein häufiges Symptom, das mit verschiedenen Erkrankungen in Verbindung gebracht werden kann. Möchtest du mehr darüber erfahren, welche Erkrankung deine Symptome verursachen könnte?
2023.07.15;14:29:38;User;ja das würde ich gerne
2023.07.15;14:29:40;AI Doktor; Sicher, gerne. Können Sie mir bitte einige weitere Details über Ihre Symptome liefern, wie die Intensität des Schwindels, ob Sie sich benommen fühlen, ob Sie Ohrenverstopfungen oder andere allergische Reaktionen haben?
2023.07.15;14:29:59;User;ich fühle mich einfach nur benommen
2023.07.15;14:30:05;AI Doktor; Benommenheit kann aufgrund einer Anämie oder eines Vitamin-B12-Mangels sowie einer Dehydrierung oder Müdigkeit auftreten. Ich empfehle Ihnen, sich mehr zu trinken und eine ausgewogene Ernährung zu sich zu nehmen, um Ihren Flüssigkeitsgehalt aufrechtzuerhalten. Wenn Ihre Symptome nach einigen Tagen nicht verschwinden, empfehle ich Ihnen, zu Ihrem Arzt zu gehen, um Tests durchzuführen und die genaue Ursache herauszufinden.