2023.09.23;15:17:37;AI Doktor;Welcome, you are now talking to an AI doctor. As I am part of a scientific experiment, I would appreciate it if you could take the time to answer a super short questionnaire at the end of the interview. Tap Speak to ask your question and then tap Send to submit it to me.
2023.09.23;15:17:59;User;why are
2023.09.23;15:18:00;AI Doktor; I'm sorry, I don't understand the question. Can you please rephrase it?
2023.09.23;15:18:09;User;why are you speaking
2023.09.23;15:18:09;AI Doktor; I am speaking to provide you with medical information and advice.
2023.09.23;15:18:19;User;is school OK
2023.09.23;15:18:21;AI Doktor; Are you asking if it is safe to attend school during the Coronavirus pandemic? I recommend following your local health and government guidelines regarding when and how to safely attend school.