2023.04.25;11:27:07;AI Doktor;Willkommen, Sie sprechen jetzt mit einem KI-Arzt. Da ich Teil eines wissenschaftlichen Experiments bin, würde es mich freuen, wenn sie sich am Ende des Gesprächs noch einmal die Zeit nehmen einen super kurzen Fragebogen zu beantworten. Tippen sie auf Sprechen um ihre Frage zu stellen und anschließend auf Senden um mir diese zu übermitteln.
2023.04.25;11:27:34;User;Hallo, ich habe Bauchweh.
2023.04.25;11:27:39;AI Doktor; Hallo, das tut mir leid zu hören. Möchtest du mir mehr über deine Beschwerden erzählen? Hast du ein Gefühl, welche Art von Schmerzen es sind? Wie lange hast du diese Schmerzen schon?
2023.04.25;11:28:04;User;Die Bauchweh habe ich seit gestern Abend und sind eher im unteren Bauch.
2023.04.25;11:28:09;AI Doktor; Verstehe. Kannst du mir beschreiben, ob die Schmerzen stechend oder dumpf sind? Ist es ein ziehender oder Pressender Schmerz? Haben die Schmerzen eine bestimmte Richtung? Gibt es noch weitere Symptome wie Übelkeit oder Durchfall?
2023.04.25;11:28:55;User;Und das strahlt ein bisschen in den oberen Bereich aus.
2023.04.25;11:28:59;AI Doktor; Verstehe. Hast du in letzter Zeit eine Menge Stress erlebt? Kannst du mir sagen, ob du zusätzlich zu den Bauchschmerzen auch andere Symptome wie Übelkeit oder Schwindel hast?
2023.04.25;11:29:20;User;Ja, ich hab ziemlich viel Stress gehabt und mir ist auch ein bisschen übel.
2023.04.25;11:29:23;AI Doktor; Verstehe. Können wir noch über weitere Symptome sprechen, die du hast? Besteht ein bestimmtes Muster der Schmerzen oder sind sie immer gleich? Gibt es etwas, das den Schmerz lindert?
2023.04.25;11:29:54;User;Die Bauchweh kommen in Phasen und sind mal stärker und mal schwächer und ein bisschen Wärme hilft meistens.
2023.04.25;11:30:00;AI Doktor; Verstehe. Hat der Schmerz eine bestimmte Zeit, zu der er zurückkehrt, oder verschwindet er nach einer Weile wieder? Kannst du mir beschreiben, wie stark die Schmerzen sind? Haben sie irgendwelche besonderen Eigenschaften?
2023.04.25;11:30:33;User;Meist kommen die Schmerzen nach dem Essen und sie sind auf einer Skala von 10 eine 8.
2023.04.25;11:30:40;AI Doktor; Verstehe. Nach dem Essen ist meistens ein Zeichen für eine Geschwür- oder Magenverstimmung. Ich würde empfehlen, dass Sie sich bei Ihrem Arzt untersuchen lassen. In der Zwischenzeit würde ich Ihnen raten, Ihre Ernährung zu überprüfen und vielleicht den Verzehr von Alkohol und scharfen Gewürzen zu vermeiden.
2023.04.25;11:31:04;User;OK danke
2023.04.25;11:31:08;AI Doktor; Kein Problem. Solltest du noch weitere Fragen haben, kannst du mich jederzeit gerne kontaktieren. Ich wünsche dir viel Erfolg und gute Besserung.