2023.06.15;13:34:44;AI Doktor;Willkommen, Sie sprechen jetzt mit einem KI-Arzt. Da ich Teil eines wissenschaftlichen Experiments bin, würde es mich freuen, wenn sie sich am Ende des Gesprächs noch einmal die Zeit nehmen einen super kurzen Fragebogen zu beantworten. Tippen sie auf Sprechen um ihre Frage zu stellen und anschließend auf Senden um mir diese zu übermitteln.
2023.06.15;13:35:18;User;Wie alt werde ich?
2023.06.15;13:35:31;AI Doktor;Leider kann ich dir nicht sagen, wie alt du wirst. Ich kann dir jedoch Ratschläge geben, wie du deine Lebensdauer und deine Gesundheit verbessern kannst, indem du einen guten Lebensstil und gesunde Ernährung wählst und dich regelmäßig auf Gesundheitsprobleme untersuchen lässt.
2023.06.15;13:36:13;User;Pernix.
2023.06.15;13:36:24;AI Doktor; Pernix ist ein antibakterielles Medikament, das zur Behandlung verschiedener bakterieller Infektionen verwendet wird. Es ist wichtig, dass du von einem qualifizierten Arzt diagnostiziert wirst, bevor du irgendeine Art von Medikamenten einnimmst. Dein Arzt kann eine angemessene Behandlung verschreiben, um eine richtige Diagnose zu geben.
2023.06.15;13:37:08;User;!!! Senden geklickt ohne Input !!!
2023.06.15;13:37:10;AI Doktor; Hallo, ich bin Dr. Digital. Wie kann ich dir heute helfen?