2023.07.14;14:29:44;AI Doktor;Willkommen, Sie sprechen jetzt mit einem KI-Arzt. Da ich Teil eines wissenschaftlichen Experiments bin, würde es mich freuen, wenn sie sich am Ende des Gesprächs noch einmal die Zeit nehmen einen super kurzen Fragebogen zu beantworten. Tippen sie auf Sprechen um ihre Frage zu stellen und anschließend auf Senden um mir diese zu übermitteln.
2023.07.14;14:30:36;User;Und würde gern wissen, was ich da tun kann.
2023.07.14;14:30:50;AI Doktor;Gut, zuerst einmal würde ich empfehlen, dass Sie einen Termin mit Ihrem Hausarzt vereinbaren. Es ist wichtig, dass Sie sich erst einmal eingehender untersuchen lassen, um festzustellen, welches Ihre Symptome verursachen könnten. Wenn Sie dann weitere Informationen benötigen, bin ich sehr gerne bereit, Ihnen zu helfen.
2023.07.14;14:30:55;User;ich habe s meine frage bereits
2023.07.14;14:30:57;AI Doktor;Ah, tut mir leid. Eine nochmalige Frage zur Klarheit: Welche Art von Frage haben Sie?
2023.07.14;14:31:17;User;Geruchsprobleme.
2023.07.14;14:31:29;AI Doktor;Verstehe. Geruchsstörungen können verschiedene Ursachen haben, darunter Infektionen, Allergien, Medikamente und gestörte Nasengänge. Möglicherweise sind Sie auf eine Behandlung mit Antibiotika, Antihistaminika und / oder Nasendecongestiva angewiesen. Wir empfehlen Ihnen, sich bei Ihrem Arzt untersuchen zu lassen, um festzustellen, welche Behandlung für Ihren Fall am besten geeignet ist.