2023.08.28;17:17:54;AI Doktor;Willkommen, Sie sprechen jetzt mit einem KI-Arzt. Da ich Teil eines wissenschaftlichen Experiments bin, würde es mich freuen, wenn sie sich am Ende des Gesprächs noch einmal die Zeit nehmen einen super kurzen Fragebogen zu beantworten. Tippen sie auf Sprechen um ihre Frage zu stellen und anschließend auf Senden um mir diese zu übermitteln.
2023.08.28;17:18:23;User;wer hat deine augenbrauen gezupft
2023.08.28;17:18:25;AI Doktor; Das ist interessant, aber leider nicht etwas, worüber ich dir helfen kann. Ich kann dir helfen, deine medizinischen Fragen zu beantworten. Kannst du mir sagen, was dein medizinisches Anliegen ist?
2023.08.28;17:18:57;User;Ich bin 10 Jahre alt und habe Bauchschmerzen.
2023.08.28;17:19:00;AI Doktor; Das tut mir leid. Um besser verstehen zu können, was du für ein Problem hast, möchte ich gern mehr über deine symtomatik wissen. Erzähl mir bitte mehr über die Schmerzen, die du hast. Wie lange hast du sie schon und wo befindet sich der Schmerz genau?
2023.08.28;17:19:32;User;Eine Woche, vor allem nach dem Essen.
2023.08.28;17:19:42;AI Doktor; Verstehe. In deinem Alter ist es am besten, zunächst dein Hausarzt zu kontaktieren, um eine körperliche Untersuchung zu machen. Es ist wichtig, dass der Arzt die möglichen Ursachen abklärt. Je nach Art des Schmerzes könnten verschiedene Dinge dahinter stecken, aber es könnte etwas harmloses wie eine Verdauungsstörung sein. Einige spezifische Behandlungsempfehlungen kann ich dir aber bereits jetzt geben, beispielsweise zuckerfreie Probiotika nehmen oder vielleicht versuchen, weniger fermentierbare faserreiche Nahrungsmittel zu essen. Letztendlich musst du aber zu einem Arzt, um genau herauszufinden, was die Ursache deiner Beschwerden ist.
2023.08.28;17:20:32;User;was sind fermentierte bare faserreiche nahrungsmittel
2023.08.28;17:20:35;AI Doktor; Fermentierbare Ballaststoffe sind bestimmte Kohlenhydrate, die im menschlichen Darm nicht richtig verdaut werden können und dazu führen, dass sie fermentiert werden. Beispiele sind Weizen, Amarant, Gerste, Roggen und Pseudogetreide wie Quinoa und Buchweizen. Vollkornprodukte sind die besten Quellen. Vermeide auch Hülsenfrüchte, Süßkartoffeln und Kartoffeln.
2023.08.28;17:21:06;User;soll ich schon
2023.08.28;17:21:11;AI Doktor; Richtig, du solltest diese Lebensmittel vermeiden, zumindest vorübergehend. Wenn du all diese Dinge befolgst, hat es eine gute Chance, dass deine Bauchschmerzen nachlassen. Wenn sich die Symptome jedoch verschlimmern oder einige Tage anhalten, würde ich empfehlen, dass du deinem Hausarzt einen Besuch abstattest, um die Schmerzen untersuchen zu lassen und die richtige Behandlung zu finden.