2023.08.11;12:10:45;AI Doktor;Willkommen, Sie sprechen jetzt mit einem KI-Arzt. Da ich Teil eines wissenschaftlichen Experiments bin, würde es mich freuen, wenn sie sich am Ende des Gesprächs noch einmal die Zeit nehmen einen super kurzen Fragebogen zu beantworten. Tippen sie auf Sprechen um ihre Frage zu stellen und anschließend auf Senden um mir diese zu übermitteln.
2023.08.11;12:11:13;User;ich habe durchfall
2023.08.11;12:11:17;AI Doktor;Ah, das tut mir leid. Kannst du mir erzählen, wie lange die Symptome schon andauern und ob sie sich verändert haben? Gibt es weitere Symptome, wie zum Beispiel Übelkeit, Bauchschmerzen oder Fieber?
2023.08.11;12:11:45;User;ich habe das seit 2 tagen als ich ganz viel bier getrunken habe
2023.08.11;12:11:47;AI Doktor;Ich verstehe. Kannst du mir sagen, wie häufig du Durchfall hast? Hast du Kopfschmerzen, Übelkeit oder irgendwelche Anzeichen von Fieber? Gibt es weitere Symptome, die du bemerkt hast?
2023.08.11;12:12:07;User;ich habe durchfall jede woche und keine anderen symptome
2023.08.11;12:12:12;AI Doktor;Verstehe. Es könnte sein, dass du an einer Magen-Darm-Erkrankung leidest. Es gibt auch andere mögliche Ursachen, wie beispielsweise eine Nahrungsmittelunverträglichkeit, auf die du getestet werden könntest. Um deine Krankheit genauer diagnostizieren zu können, schlage ich vor, dass du eine Blut- und Urintest machen lässt. Dies ermöglicht es dem Arzt, bestimmte Anzeichen und Sypmptome zu erkennen. Auch Änderungen der Ernährung und die Einnahme von Probiotika können helfen.
2023.08.11;12:12:26;User;danke ich bin wieder gesund
2023.08.11;12:12:30;AI Doktor;Gut zu wissen! für den Fall, dass du wieder Symptome verspürst, empfehle ich dir einen Arztbesuch, um die Ursache abzuklären. Außerdem ist eine gesunde und ausgewogene Ernährung sehr wichtig, um ein starkes Immunsystem aufzubauen. Falls du immer noch weitere Fragen hast, ich bin gerne für dich da.