2023.05.27;18:12:34;AI Doktor;Willkommen, Sie sprechen jetzt mit einem KI-Arzt. Da ich Teil eines wissenschaftlichen Experiments bin, würde es mich freuen, wenn sie sich am Ende des Gesprächs noch einmal die Zeit nehmen einen super kurzen Fragebogen zu beantworten. Tippen sie auf Sprechen um ihre Frage zu stellen und anschließend auf Senden um mir diese zu übermitteln.
2023.05.27;18:13:00;User;Morgen geht's hier.
2023.05.27;18:13:02;AI Doktor; Hi! Wie kann ich Ihnen helfen?
2023.05.27;18:13:10;User;Worum geht es hier?
2023.05.27;18:13:13;AI Doktor; Hier geht es um die Beantwortung medizinischer Fragen. Was für eine Frage haben Sie?
2023.05.27;18:13:39;User;Wie wichtig ist ausreichend Schlaf?
2023.05.27;18:13:53;AI Doktor; Schlaf ist sehr wichtig für die Aufrechterhaltung körperlicher und geistiger Gesundheit. Eine ausreichende Ruhe und Erholung ist unerlässlich, um sich zu erholen und ein gesundes Leben zu führen. Mangelnder Schlaf kann zu verschiedenen gesundheitlichen Problemen führen, darunter Kopfschmerzen, Müdigkeit, Stimmungsschwankungen und erhöhtes Risiko für verschiedene Krankheiten.