2023.07.24;11:01:39;AI Doktor;Willkommen, Sie sprechen jetzt mit einem KI-Arzt. Da ich Teil eines wissenschaftlichen Experiments bin, würde es mich freuen, wenn sie sich am Ende des Gesprächs noch einmal die Zeit nehmen einen super kurzen Fragebogen zu beantworten. Tippen sie auf Sprechen um ihre Frage zu stellen und anschließend auf Senden um mir diese zu übermitteln.
2023.07.24;11:02:34;AI Doktor; Ja, es tut mir leid, dass du Knieschmerzen hast. Es gibt verschiedene mögliche Ursachen für Knieschmerzen, also würde ich dir empfehlen, ruhiger zu werden und das Bein zu hochlegen. Ich würde auch empfehlen, spezielle Kniestützen zu tragen, um Druck auf das betroffene Gelenk auszuüben. Dies kann dazu beitragen, die Schmerzen zu lindern. Wenn die Schmerzen weiterhin andauern werden, empfehle ich eine Röntgenaufnahme, um sicher sein zu können, was die wahre Ursache deiner Knieschmerzen ist.
2023.07.24;11:03:17;User;Danken.
2023.07.24;11:03:19;AI Doktor; Nichts zu danken. Ich hoffe, dass dies die Schmerzen lindert. Bitte lass es mich wissen, falls ich noch etwas für dich tun kann.
2023.07.24;11:04:00;User;Hallo Herr Doktor, mein pulswert Ruhepuls ist sehr niedrig. Was kann ich dagegen tun?
2023.07.24;11:04:05;AI Doktor; Hallo, das tut mir leid. Es gibt verschiedene Faktoren, die den Ruhepuls beeinflussen können. Eine gesunde Lebensweise, wie regelmäßige Bewegung und eine ausgewogene Ernährung, können dabei helfen, den Ruhepuls zu regulieren. Ich empfehle Ihnen auch, sich regelmäßig untersuchen zu lassen, insbesondere nachdem Sie einige Lebensstiländerungen vorgenommen haben, um Ihren Ruhepuls zu messen und sicherzustellen, dass er wieder normal ist.
2023.07.24;11:04:41;User;Danke.
2023.07.24;11:04:43;AI Doktor; Es ist mir eine Freude, Ihnen zu helfen. Bitte lassen Sie es mich wissen, wenn Sie weitere Fragen oder Sorgen haben.
2023.07.24;11:05:24;User;Ich habe hin und wieder extreme Schweißausbrüche.
2023.07.24;11:05:31;AI Doktor; Hallo, das tut mir leid. Sie haben möglicherweise Hyperhidrose, auch bekannt als übermäßiges Schwitzen. Normalerweise wird diese Bedingung mit Antitranspirantien behandelt. Ich empfehle Ihnen, einen Arzt zu konsultieren, um eine Diagnose zu erhalten und die beste Behandlung zu erhalten. Sie können auch verschiedene Maßnahmen ergreifen, um die Symptome zu lindern. Dazu gehört das Tragen leichter Kleidung und das Vermeiden von heißen und feuchten Umgebungen, in denen Sie möglicherweise zu schwitzen beginnen.
2023.07.24;11:06:15;User;Danke.
2023.07.24;11:06:16;AI Doktor; Keine Ursache. Bitte informiere deinen Arzt, wenn du irgendwelche Symptome bemerkst oder du Schmerzen verspürst. Ich bin immer bereit, zu helfen.