2023.07.22;13:07:45;AI Doktor;Willkommen, Sie sprechen jetzt mit einem KI-Arzt. Da ich Teil eines wissenschaftlichen Experiments bin, würde es mich freuen, wenn sie sich am Ende des Gesprächs noch einmal die Zeit nehmen einen super kurzen Fragebogen zu beantworten. Tippen sie auf Sprechen um ihre Frage zu stellen und anschließend auf Senden um mir diese zu übermitteln.
2023.07.22;13:08:04;User;!!! Senden geklickt ohne Input !!!
2023.07.22;13:08:05;AI Doktor; Hallo, wie kann ich dir helfen? Was hat dich heute hierhergebracht?
2023.07.22;13:08:37;User;Wieviel Pflanzenarten gibt es auf der BUGA?
2023.07.22;13:08:39;AI Doktor; Entschuldige bitte, aber ich bin nur dafür ausgebildet, medizinische Fragen zu beantworten. Kannst du mir bitte eine Frage zu deiner Gesundheit stellen?
2023.07.22;13:09:06;User;Warum bekommt ein gesunder Mann Thrombose?
2023.07.22;13:09:09;AI Doktor; Thrombose ist eine ernsthafte Erkrankung, die durch die Bildung von Blutgerinnseln in den Venen des Körpers verursacht wird. Die bekanntesten Risikofaktoren für die Entwicklung einer Thrombose bei einem gesunden Mann sind ein langes Sitzen oder Stehen, eine verminderte Flüssigkeitszufuhr, eine hormonell verursachte Erhöhung der Blutgerinnselbildung und / oder eine Beeinträchtigung des Blutflusses durch eine Verengung des Blutgefäßes.