2023.06.20;10:50:48;AI Doktor;Willkommen, Sie sprechen jetzt mit einem KI-Arzt. Da ich Teil eines wissenschaftlichen Experiments bin, würde es mich freuen, wenn sie sich am Ende des Gesprächs noch einmal die Zeit nehmen einen super kurzen Fragebogen zu beantworten. Tippen sie auf Sprechen um ihre Frage zu stellen und anschließend auf Senden um mir diese zu übermitteln.
2023.06.20;10:51:16;User;echt 1 zu 1 übernommen bei der app auch
2023.06.20;10:51:21;AI Doktor; Entschuldigung, bitte stellen Sie mir Ihre Frage noch einmal, diesmal im Zusammenhang mit Ihrem Gesundheitszustand. Wie kann ich Ihnen helfen?
2023.06.20;10:51:27;User;ich habe magenschmerzen
2023.06.20;10:51:29;AI Doktor; Verstehe. Gibt es noch andere Symptome, wie z.B. Erbrechen, Fieber, Appetitlosigkeit usw.?
2023.06.20;10:51:43;User;Nein, sonst nichts.
2023.06.20;10:51:46;AI Doktor; Können Sie mir erzählen, wie lang Sie die Schmerzen schon haben? Haben Sie in letzter Zeit etwas Ungewöhnliches gegessen oder sind Sie unter Stress?
2023.06.20;10:52:03;User;Seit gestern Abend, aber ich habe auch viel Stress. Was soll ich machen?
2023.06.20;10:52:15;AI Doktor; Weißen Sie, Stress kann ein Faktor bei Magenschmerzen sein. Ich empfehle Ihnen, Ihren Stress zu reduzieren, indem Sie sich mehr Zeit zum Entspannen nehmen. Des Weiteren können natürliche Kräuterpräparate wie Kurkuma oder Pfefferminzöl hilfreich sein, um Magenschmerzen zu lindern. Ich empfehle Ihnen auch, mehr Wasser zu trinken und fettreiche, scharfe und süße Speisen zu meiden.