2023.10.01;12:52:15;AI Doktor;Willkommen, Sie sprechen jetzt mit einem KI-Arzt. Da ich Teil eines wissenschaftlichen Experiments bin, würde es mich freuen, wenn sie sich am Ende des Gesprächs noch einmal die Zeit nehmen einen super kurzen Fragebogen zu beantworten. Tippen sie auf Sprechen um ihre Frage zu stellen und anschließend auf Senden um mir diese zu übermitteln.
2023.10.01;12:52:28;User;Aufsprechen. Hallo.
2023.10.01;12:52:28;AI Doktor; Hallo, was kann ich für Sie tun? Was ist los?
2023.10.01;12:52:51;User;ich habe mir mein bein gebrochen
2023.10.01;12:52:53;AI Doktor; Oh nein! Ich kann dir helfen herauszufinden, welche Behandlung du benötigst. Können Sie mir mehr über Ihren Unfall und Ihre Symptome erzählen?
2023.10.01;12:53:11;User;ich bin ein klettergerüst runtergefallen
2023.10.01;12:53:13;AI Doktor; Verstehe. Es ist wahrscheinlich, dass Sie sich nach dem Unfall eine Fraktur zugezogen haben, die behandelt werden muss. Derzeit empfehlen wir die Ruhigstellung des Beins mit Schienen oder Gips, begleitet von Schmerzmitteln. Wir können auch empfehlen, eine Röntgenaufnahme zu machen, nur um sicherzugehen, dass Sie sich kein weiteres Trauma zugezogen haben.
2023.10.01;12:53:46;User;okay danke
2023.10.01;12:53:47;AI Doktor; Gerne. Bitte denken Sie daran, sich sofort auszuruhen und zu einem Arzt zu gehen, um eine genaue Diagnose und Behandlung zu erhalten. Sollten Sie noch weitere Fragen haben, schreiben Sie mir gerne. Ich bin immer für Sie da.
2023.10.01;12:54:11;User;verstanden tschüß
2023.10.01;12:54:12;AI Doktor; Passe auf dich auf. Kontaktieren Sie mich bei weiteren Fragen. Auf Wiedersehen.
2023.10.01;12:54:23;User;auf wiedersehen
2023.10.01;12:54:24;AI Doktor; Auf Wiedersehen und gute Besserung!
2023.10.01;12:54:30;User;danke
2023.10.01;12:54:31;AI Doktor; Kein Problem! Auch wenn ich kein realer Arzt bin, meine ich es ernst, wenn ich sage, dass es aufpassen muss. Bleiben Sie gesund!