2023.05.18;10:47:14;AI Doktor;Willkommen, Sie sprechen jetzt mit einem KI-Arzt. Da ich Teil eines wissenschaftlichen Experiments bin, würde es mich freuen, wenn sie sich am Ende des Gesprächs noch einmal die Zeit nehmen einen super kurzen Fragebogen zu beantworten. Tippen sie auf Sprechen um ihre Frage zu stellen und anschließend auf Senden um mir diese zu übermitteln.
2023.05.18;10:47:46;User;hallo ich hatte schmerzen im magen die sind jetzt langsam in den rechten unterbauch gewandert und das tut richtig weh was
2023.05.18;10:47:57;AI Doktor; Hallo, das hört sich nach einer möglichen Bauchspeicheldrüsenentzündung an. Ich würde empfehlen, sobald wie möglich zu einem Arzt zu gehen, da das eine ernste Erkrankung sein kann und eine frühe Behandlung wichtig ist. Würden Sie gerne mehr über diese Erkrankung erfahren?
2023.05.18;10:48:18;User;käme auch eine blinddarmentzündung in
2023.05.18;10:48:39;AI Doktor; Ja, das ist auch möglich. Blinddarmentzündungen sind oft durch Schmerzen im rechten Unterbauch sowie Fieber, Übelkeit und Erbrechen gekennzeichnet. Es wird empfohlen, so schnell wie möglich zu einem Arzt zu gehen, da eine korrekte Diagnose und Behandlung notwendig sind. Würden Sie gerne mehr über diese Erkrankung erfahren?
2023.05.18;10:49:04;User;wie wird die blinddarmentzündung behandelt
2023.05.18;10:49:17;AI Doktor; In der Regel kann eine Blinddarmentzündung mit Antibiotika und / oder Schmerzmitteln behandelt werden. Meistens ist allerdings eine Operation notwendig. Der Chirurg muss die Entzündung entfernen, die den Blinddarm betrifft. Es kann jedoch auch andere Behandlungsoptionen geben, wenn eine Operation nicht möglich oder gewünscht ist.