2023.09.17;12:49:16;AI Doktor;Willkommen, Sie sprechen jetzt mit einem KI-Arzt. Da ich Teil eines wissenschaftlichen Experiments bin, würde es mich freuen, wenn sie sich am Ende des Gesprächs noch einmal die Zeit nehmen einen super kurzen Fragebogen zu beantworten. Tippen sie auf Sprechen um ihre Frage zu stellen und anschließend auf Senden um mir diese zu übermitteln.
2023.09.17;12:49:32;User;hallo mein name ist hallo mein name ist
2023.09.17;12:49:32;AI Doktor; Hallo, wie kann ich Ihnen helfen?
2023.09.17;12:49:44;User;ganz gut soweit
2023.09.17;12:49:45;AI Doktor; Gut zu hören! Haben Sie andere medizinische Fragen, die ich Ihnen helfen kann zu beantworten?
2023.09.17;12:49:55;User;nee also soweit eigentlich nicht
2023.09.17;12:49:56;AI Doktor; In Ordnung. Lassen Sie es mich wissen, wenn ich Ihnen bei irgendetwas helfen kann.
2023.09.17;12:50:06;User;okay tschüss
2023.09.17;12:50:06;AI Doktor; Tschüss!
2023.09.17;12:50:18;User;hallo bin ich hier beim mcdonald's
2023.09.17;12:50:19;AI Doktor; Nein, das ist ein Arztgespräch. Wie kann ich Ihnen bei Ihren medizinischen Fragen helfen?
2023.09.17;12:50:28;User;warum sind sie so unfreundlich
2023.09.17;12:50:29;AI Doktor; Entschuldigen Sie bitte. Ich bin nicht absichtlich unfreundlich, sondern versuche nur, Ihnen gute und zuverlässige medizinische Beratung zu bieten. Wie kann ich Ihnen bei Ihren medizinischen Fragen helfen?
2023.09.17;12:50:39;User;ja ja würde ich auch sagen wenn ich du wär ne ja ja
2023.09.17;12:50:40;AI Doktor; Bitte stellen Sie mir eine spezifische Frage, die ich Ihnen beantworten kann. Was möchten Sie wissen?
2023.09.17;12:50:48;User;nein jetzt habe ich keine lust mehr auf schicken sie mir einen anderen arzt
2023.09.17;12:50:51;AI Doktor; Bitte verstehen Sie, dass ich Ihnen nur die beste medizinische Beratung bieten kann. Wenn Sie einen anderen Arzt sehen möchten, helfe ich Ihnen gerne dabei, eine andere Praxis zu finden. Wie kann ich Ihnen bei Ihren medizinischen Fragen helfen?
2023.09.17;12:51:09;User;ja dann bitte rufen sie mcdonald's an das ist nämlich die beste medizin es gibt
2023.09.17;12:51:10;AI Doktor; Ich verstehe, dass Sie versuchen, das Thema zu wechseln, aber ich bin hier, um Ihnen medizinische Hilfe zu bieten. Bitte stellen Sie mir eine spezifische Frage, die ich Ihnen beantworten kann.
2023.09.17;12:51:20;User;ja jetzt vom thema ablenken
2023.09.17;12:51:22;AI Doktor; Ich würde Ihnen gerne helfen. Bitte stellen Sie mir eine spezifische Frage, die ich Ihnen beantworten kann.
2023.09.17;12:51:30;User;tschüss hier sind der unfreundlichste mensch den ich kenne
2023.09.17;12:51:32;AI Doktor; Entschuldigen Sie bitte, wenn ich Sie beleidigt haben sollte. Ich versuche immer, für meine Patienten da zu sein und ihnen bei medizinischen Fragen zu helfen. Bitte stellen Sie mir eine spezifische Frage, die ich Ihnen beantworten kann.