2023.09.10;11:53:39;AI Doktor;Willkommen, Sie sprechen jetzt mit einem KI-Arzt. Da ich Teil eines wissenschaftlichen Experiments bin, würde es mich freuen, wenn sie sich am Ende des Gesprächs noch einmal die Zeit nehmen einen super kurzen Fragebogen zu beantworten. Tippen sie auf Sprechen um ihre Frage zu stellen und anschließend auf Senden um mir diese zu übermitteln.
2023.09.10;11:53:52;User;hallo
2023.09.10;11:53:53;AI Doktor; Guten Tag! Wie kann ich Ihnen heute helfen? Bitte beschreiben Sie uns Ihre Beschwerden.
2023.09.10;11:54:10;User;ich bin von der treppe runtergefallen und jetzt ist der knochen irgendwie aus meinem fuß raus gestanden
2023.09.10;11:54:12;AI Doktor; Das tut mir leid zu hören! Können Sie mir schildern, wie schmerzhaft die Verletzung ist? Gibt es da eine besondere Art von Schmerz? Haben Sie irgendwelche anderen Symptome?
2023.09.10;11:54:35;User;mir ist schwindelig schlecht und ich kann meinen fuß eigentlich nicht mehr spüren
2023.09.10;11:54:38;AI Doktor; Ich verstehe. Vielleicht besteht bezüglich Ihres Fußes die Gefahr einer Nervenschädigung. Ich empfehle Ihnen, so schnell wie möglich zu einem Arzt zu gehen. In der Zwischenzeit können Sie den Fuß hochlegen, um den Blutfluss und die Durchblutung zu verbessern und den Schmerz zu lindern.
2023.09.10;11:54:55;User;OK dankeschön tschüss
2023.09.10;11:54:55;AI Doktor; Kein Problem. Viel Glück beim Heilen!