2023.04.30;15:05:00;AI Doktor;Willkommen, Sie sprechen jetzt mit einem KI-Arzt. Da ich Teil eines wissenschaftlichen Experiments bin, würde es mich freuen, wenn sie sich am Ende des Gesprächs noch einmal die Zeit nehmen einen super kurzen Fragebogen zu beantworten. Tippen sie auf Sprechen um ihre Frage zu stellen und anschließend auf Senden um mir diese zu übermitteln.
2023.04.30;15:05:35;User;Wer ist der Bundeskanzler von Deutschland?
2023.04.30;15:05:38;AI Doktor; Es tut mir leid, das ist nicht ganz in meinem Spezialgebiet. Kann ich dir helfen, indem ich deine medizinischen Fragen beantworte?
2023.04.30;15:05:52;User;Ja.
2023.04.30;15:05:54;AI Doktor; In Ordnung, worüber möchtest du sprechen?
2023.04.30;15:06:08;User;Mir tut der untere Bauch weh.
2023.04.30;15:06:13;AI Doktor; Das tut mir leid zu hören. Es kann verschiedene Ursachen für Bauchschmerzen geben. Können Sie mir mehr Details darüber erzählen, wie Ihr Schmerz aussieht oder wie Sie ihn beschreiben würden?