2023.07.08;14:14:19;AI Doktor;Willkommen, Sie sprechen jetzt mit einem KI-Arzt. Da ich Teil eines wissenschaftlichen Experiments bin, würde es mich freuen, wenn sie sich am Ende des Gesprächs noch einmal die Zeit nehmen einen super kurzen Fragebogen zu beantworten. Tippen sie auf Sprechen um ihre Frage zu stellen und anschließend auf Senden um mir diese zu übermitteln.
2023.07.08;14:14:31;User;hallo
2023.07.08;14:14:32;AI Doktor;Hallo. Wie kann ich Ihnen helfen?
2023.07.08;14:14:47;User;mein arm tut so
2023.07.08;14:14:50;AI Doktor;Können Sie bitte genauer beschreiben, was Ihnen weh tut? Haben Sie Schmerzen? Wenn ja, wo und wie schlimm sind sie? Fühlen Sie eine Veränderung in der Stärke der Schmerzen?
2023.07.08;14:15:05;User;Ich habe sehr starke Schmerzen in meinem Arm.
2023.07.08;14:15:07;AI Doktor;Haben Sie in den letzten paar Tagen irgendetwas getan, das möglicherweise zu den Schmerzen geführt haben kann? Falls ja, können Sie bitte beschreiben, was Sie gemacht haben?
2023.07.08;14:15:25;User;Ich bin in einer Steinwald hochgeklettert.
2023.07.08;14:15:31;AI Doktor; Besteht die Möglichkeit, dass Sie sich beim Klettern etwas verletzt haben? Es könnte eine Muskelzerrung oder ein Fraktur oder eine Muskelreizung sein. Um die Genauigkeit der Diagnose zu erhöhen, empfehlen wir Ihnen, weitere Untersuchungen durchzuführen, wie zum Beispiel ein Röntgen oder ein Ultraschall. In der Zwischenzeit können Sie versuchen, die Schmerzen durch Kühlpackungen oder entzündungshemmende Medikamente zu lindern.
2023.07.08;14:15:52;User;Soll ich ins Krankenhaus kommen?
2023.07.08;14:15:54;AI Doktor;Es ist ratsam, ins Krankenhaus zu gehen und eine Basisuntersuchung durchzuführen, um sicherzustellen, dass Sie sich nicht schwer verletzt haben. Zunächst sollten Sie aber versuchen, die Schmerzen durch Kühlpackungen oder entzündungshemmende Medikamente zu lindern.
2023.07.08;14:16:15;User;Okay danke für Ihre Hilfe. Tschüss.
2023.07.08;14:16:16;AI Doktor;Kein Problem. Gern geschehen. Schlafen Sie gut und passen Sie auf sich auf! Tschüss.