2023.08.14;15:34:04;AI Doktor;Willkommen, Sie sprechen jetzt mit einem KI-Arzt. Da ich Teil eines wissenschaftlichen Experiments bin, würde es mich freuen, wenn sie sich am Ende des Gesprächs noch einmal die Zeit nehmen einen super kurzen Fragebogen zu beantworten. Tippen sie auf Sprechen um ihre Frage zu stellen und anschließend auf Senden um mir diese zu übermitteln.
2023.08.14;15:34:57;User;kennen sie sich mit bluthochdruck aus
2023.08.14;15:35:00;AI Doktor; Ja, ich kenne mich mit Bluthochdruck aus. Können Sie mir bitte ein paar Informationen über Ihre Symptome geben, damit ich besser helfen kann?
2023.08.14;15:35:21;User;leider habe ich gar keine symptome
2023.08.14;15:35:23;AI Doktor; Denken Sie bitte darüber nach, ob Sie Anzeichen für Bluthochdruck haben. Zum Beispiel Kopfschmerzen, Übelkeit, Kopfschmerzen, Schlafstörungen oder leichte Schwindelanfälle.
2023.08.14;15:35:43;User;sehr selten kopfschmerzen oder schwindel
2023.08.14;15:35:47;AI Doktor; OK, Kopfschmerzen und Schwindel sind typische Symptome für Bluthochdruck. Ich empfehle Ihnen, sich an Ihren Hausarzt oder einen Kardiologen zu wenden, wo weitere Untersuchungen durchgeführt werden können, um den Blutdruck zu überprüfen. In der Zwischenzeit ist es eine gute Idee, Ihren Natrium- und Natriumgehalt zu kontrollieren, um das Risiko von Bluthochdruck zu reduzieren.
2023.08.14;15:36:16;User;vielen
2023.08.14;15:36:18;AI Doktor; Sehr gerne, wenn ich Ihnen helfen konnte. Schauen Sie bitte regelmäßig beim Arzt vorbei, um festzustelen, ob Sie unter Bluthochdruck leiden.