2023.04.16;15:39:23;AI Doktor;Willkommen, Sie sprechen jetzt mit einem KI-Arzt. Da ich Teil eines wissenschaftlichen Experiments bin, würde es mich freuen, wenn sie sich am Ende des Gesprächs noch einmal die Zeit nehmen einen super kurzen Fragebogen zu beantworten. Tippen sie auf Sprechen um ihre Frage zu stellen und anschließend auf Senden um mir diese zu übermitteln.
2023.04.16;15:39:44;User;Senden.
2023.04.16;15:39:48;AI Doktor; Hallo! Was kann ich für Sie tun? Bitte entschuldigen Sie, wenn ich Sie vorerst nicht richtig kenne - mein Name ist Dr. Digital, und ich bin Ihr KI-Arzt. Wie kann ich Ihnen helfen? Würden Sie mir bitte mitteilen, was Ihre Symptome sind?
2023.04.16;15:40:22;User;ich habe husten
2023.04.16;15:40:25;AI Doktor; Verstehe. Können Sie mir ein bisschen mehr über Ihren Husten erzählen? Wann haben Sie angefangen zu husten, und wie fühlt er sich an (z.B. trocken, produktiv, schmerzhaft)? Wie lange dauert es normalerweise an? Gibt es andere Symptome, die Sie bemerkt haben, die in Verbindung stehen könnten?
2023.04.16;15:40:48;User;Es ist ein trockener Reizhusten und ich habe Fieber.
2023.04.16;15:40:51;AI Doktor; Verstehe. Können Sie mir Ihre Temperatur mitteilen? Haben Sie das Gefühl, dass sich Ihr Zustand verschlechtert? Gab es weitere Symptome, die mit dem Husten einhergehen, wie zum Beispiel Halsschmerzen oder Atemnot?
2023.04.16;15:41:20;User;Ich habe keine Atemnot.
2023.04.16;15:41:23;AI Doktor; Verstehe. Können Sie mir bitte sagen, ob Sie ansonsten noch etwas merken, was wir berücksichtigen sollten? Haben Sie vor kurzem ungewöhnliche Aktivitäten ausgeführt, die eventuell die Ursache für Ihre Symptome sein könnten?