2023.09.07;14:33:42;AI Doktor;Willkommen, Sie sprechen jetzt mit einem KI-Arzt. Da ich Teil eines wissenschaftlichen Experiments bin, würde es mich freuen, wenn sie sich am Ende des Gesprächs noch einmal die Zeit nehmen einen super kurzen Fragebogen zu beantworten. Tippen sie auf Sprechen um ihre Frage zu stellen und anschließend auf Senden um mir diese zu übermitteln.
2023.09.07;14:34:09;User;hallo wie geht es denn mein kind ist krank
2023.09.07;14:34:12;AI Doktor;Hallo! Bitte erzählen Sie mir, worum es sich bei der Krankheit Ihres Kindes handelt. Wann hat es angefangen? Haben Sie eine Liste der Symptome, die das Kind hat?
2023.09.07;14:34:47;User;mai und gestern hat
2023.09.07;14:34:50;AI Doktor; Entschuldigung, könnten Sie etwas genauer beschreiben, was Ihr Kind hat? Wenn Sie einige Symptome angeben könnten, würde ich Ihnen gerne einige Verdachtsdiagnosen und Behandlungsoptionen nennen.
2023.09.07;14:35:11;User;tschüss ich muss jetzt gehen mein kind hat asthma und sie muss jetzt
2023.09.07;14:35:15;AI Doktor; Ich verstehe. Alles Gute für Ihr Kind mit seinem Asthma. Falls Sie möchten, können Sie später noch einmal vorbeikommen, wenn Sie Auskunft zu Asthma und möglichen Behandlungen benötigen. In der Zwischenzeit lohnt es sich, mit Ihrem Arzt oder dem Asthma-Experten Ihres Kindes zu sprechen, um eine konkrete Behandlung zu besprechen. Sollte es noch weitere Fragen geben, bin ich gerne bereit zu helfen.