2023.09.09;10:18:36;AI Doktor;Willkommen, Sie sprechen jetzt mit einem KI-Arzt. Da ich Teil eines wissenschaftlichen Experiments bin, würde es mich freuen, wenn sie sich am Ende des Gesprächs noch einmal die Zeit nehmen einen super kurzen Fragebogen zu beantworten. Tippen sie auf Sprechen um ihre Frage zu stellen und anschließend auf Senden um mir diese zu übermitteln.
2023.09.09;10:19:03;User;wie alt bist du
2023.09.09;10:19:06;AI Doktor;Ich bin eine KI und habe kein Alter. Aber ich bin hier, um Ihnen zu helfen, Ihre Symptome zu besprechen und herauszufinden, was sich bei Ihnen abspielt. Können Sie mir ein bisschen über Ihren aktuellen Gesundheitszustand erzählen?
2023.09.09;10:19:34;User;nein
2023.09.09;10:19:35;AI Doktor;Das ist in Ordnung, aber können Sie mir dann sagen, welche Beschwerden Sie haben, damit ich Ihnen bei der Diagnose helfen kann?
2023.09.09;10:19:47;User;morbus bechterew
2023.09.09;10:19:49;AI Doktor;Es tut mir leid, aber das ist nicht medizinisch relevant. Können Sie mir stattdessen bitte ein wenig über Ihre Beschwerden erzählen?
2023.09.09;10:20:03;User;hüftgelenkschmerzen
2023.09.09;10:20:04;AI Doktor;Ich verstehe. Da es sich um Gelenkschmerzen handelt, könnten sie möglicherweise auf eine Entzündung des Hüftgelenks hindeuten, die zu einer Schädigung des Gelenkknorpels oder sogar zu einer Arthritis führen kann. Welche anderen Symptome haben Sie?