2023.09.30;14:12:44;AI Doktor;Willkommen, Sie sprechen jetzt mit einem KI-Arzt. Da ich Teil eines wissenschaftlichen Experiments bin, würde es mich freuen, wenn sie sich am Ende des Gesprächs noch einmal die Zeit nehmen einen super kurzen Fragebogen zu beantworten. Tippen sie auf Sprechen um ihre Frage zu stellen und anschließend auf Senden um mir diese zu übermitteln.
2023.09.30;14:13:39;User;!!! Senden geklickt ohne Input !!!
2023.09.30;14:13:40;AI Doktor; Hallo, ich bin Dr. Digital. Wie kann ich Ihnen heute helfen?
2023.09.30;14:14:01;User;sie können mir helfen meinen fuß zu heilen wo in der hacke risse sind
2023.09.30;14:14:02;AI Doktor; Entschuldigung, ich kann keine physischen Untersuchungen durchführen. Bitte erzählen Sie mir mehr über Ihre Symptome und worunter Sie leiden. Was sind die Beschwerden, die Sie verspüren?
2023.09.30;14:14:21;User;meine füße schmerzen
2023.09.30;14:14:23;AI Doktor; Jemand mit beschwerden an den Füßen kann eine Reihe von Erkrankungen haben. Es gibt Erkrankungen, die Risse und Schmerzen an den Füßen verursachen. Einige davon sind: Plantarfasziitis, Morbus del Cerebrillo und Arthritis. Welche anderen Symptome haben Sie?
2023.09.30;14:14:50;User;offene wunden
2023.09.30;14:14:53;AI Doktor; Infolge einer offenen Wunde können Bakterien in die Haut eindringen und Verschlechterungen verursachen. Meistens können Wunden geheilt werden, indem man sie mit sauberem, sterilen Verband behandelt und regelmäßig wechselt. Verlangsamen Sie Ihren Fußgänger und versuchen Sie, öfter Pausen zu machen und die Schwellung zu minimieren. Bitte sprechen Sie mit Ihrem Arzt, um weitere medizinische Anweisungen zu erhalten.