2023.04.17;16:00:51;AI Doktor;Willkommen, Sie sprechen jetzt mit einem KI-Arzt. Da ich Teil eines wissenschaftlichen Experiments bin, würde es mich freuen, wenn sie sich am Ende des Gesprächs noch einmal die Zeit nehmen einen super kurzen Fragebogen zu beantworten. Tippen sie auf Sprechen um ihre Frage zu stellen und anschließend auf Senden um mir diese zu übermitteln.
2023.04.17;16:01:19;User;Wie geht's dir?
2023.04.17;16:01:21;AI Doktor;Danke der Nachfrage, mir geht es gut. Danke, dass du dich erkundigst! Wie kann ich dir heute helfen?
2023.04.17;16:02:17;User;Bin ich dumm?
2023.04.17;16:02:18;AI Doktor;Nein, du bist ganz bestimmt nicht dumm. Womit kann ich dir denn heute helfen?
2023.04.17;16:02:31;User;Von wem stammen die Menschen ab?
2023.04.17;16:02:35;AI Doktor;Das ist eine spannende Frage, aber leider nicht von medizinischer Relevanz. Ich kann dir helfen, wenn du eine spezifische Frage zur Gesundheit hast. Gibt es etwas, was du gerade besonders besorgt?
2023.04.17;16:03:09;User;wie wieso kriegt man eine pollenallergie
2023.04.17;16:03:15;AI Doktor;Pollenallergien entstehen normalerweise, wenn dein Körper eine bestimmte Art von Pollen als Bedrohung erkennt und Immunzellen produziert, um Impulse zu versuchen. Vermehrte Produktion von Histamin, Serotonin und anderen Substanzen verursacht eine allergische Reaktion. Damit du diese Reaktion minimieren kannst, rät dir dein Arzt möglicherweise eine spezifische Behandlung, einschließlich Antihistaminika, immunmodulierende Medikamente oder sogar Hyposensibilisierung.
2023.04.17;16:04:02;User;Wie kriegt man Corona?
2023.04.17;16:04:11;AI Doktor;Das neuartige Coronavirus SARS-CoV-2 kann über Kontakt mit der Atemluft einer infizierten Person (in der Nähe von 1 bis zu 2 Meter) übertragen werden. Es kann auch über Tröpfcheninfektion übertragen werden, was passiert, wenn jemand, der das Virus hat, hustet, niest oder spricht. Es kann auch über Kontakt mit kontaminierten Oberflächen übertragen werden und bei schweren Fällen kann es durch Mund- und Rachensekret übertragen werden. Deshalb ist es wichtig, dass man soziale Distanzierung hält, Alltagsgegenstände desinfiziert und regelmäßig seine Hände wäscht, um das Risiko einer Ansteckung zu verringern.
2023.04.17;16:04:53;User;Bin ich cool?
2023.04.17;16:04:57;AI Doktor;Das ist eine individuelle Entscheidung. Jeder Mensch ist einzigartig und für die Einschätzung, ob jemand cool ist oder nicht, gibt es keine allgemeine Antwort. Womit kann ich dir heute bei einem medizinischen Thema helfen?