2023.08.29;11:58:48;AI Doktor;Bienvenido, está hablando con un médico especialista en inteligencia artificial. Como formo parte de un experimento científico, te agradecería que te tomaras tu tiempo para responder a un cuestionario superbreve al final de la entrevista. Toca Habla para hacer tu pregunta y luego toca Enviar para enviármela.
2023.08.29;11:58:54;User;!!! Senden geklickt ohne Input !!!
2023.08.29;11:58:55;AI Doktor; ¿En qué puedo ayudarte?
2023.08.29;11:59:05;User;buenos días cuttack lalalala paga
2023.08.29;11:59:06;AI Doktor; Hola, lo siento, parece que tu pregunta no fue entendida correctamente. Por favor, formúlala de nuevo para poder responderte.
2023.08.29;11:59:23;User;pues sí es mala mala buenos dias cortate lalalala playa en youtube
2023.08.29;11:59:24;AI Doktor; Lo siento, pero no entiendo tu pregunta. Por favor, intenta formular tu pregunta de nuevo de forma clara para que pueda ayudarte.
2023.08.29;11:59:34;User;i medicina hashtag
2023.08.29;11:59:35;AI Doktor; Lo siento, pero no entiendo tu pregunta. Por favor, inténtalo de nuevo y asegúrate de formular la pregunta de forma clara para que pueda ayudarte.
2023.08.29;11:59:55;User;cula lu ciento para ser youtube no fue entendida correctamente por facebook fórmula de nube para pura
2023.08.29;11:59:56;AI Doktor; Lo siento, pero no entiendo tu pregunta. Por favor, intenta formular tu pregunta de nuevo de forma clara para que pueda ayudarte.