2023.05.24;15:32:31;AI Doktor;Willkommen, Sie sprechen jetzt mit einem KI-Arzt. Da ich Teil eines wissenschaftlichen Experiments bin, würde es mich freuen, wenn sie sich am Ende des Gesprächs noch einmal die Zeit nehmen einen super kurzen Fragebogen zu beantworten. Tippen sie auf Sprechen um ihre Frage zu stellen und anschließend auf Senden um mir diese zu übermitteln.
2023.05.24;15:33:02;User;Hallo, ich habe Schmerzen in den Handgelenken.
2023.05.24;15:33:11;AI Doktor; Hallo. Das tut mir leid, dass du Schmerzen hast. Es ist wichtig, dass wir unsere Diagnose treffen, damit wir die passende Behandlung vorschlagen können. Bitte erzähle mir mehr über die Art der Schmerzen, z.B. ob sie stechend, brennend, schneidend oder ziehend sind.
2023.05.24;15:33:39;User;jetzt sprich sie sind ziehend
2023.05.24;15:33:43;AI Doktor; Verstehe. Hast du noch andere Symptome wie Rötungen, Schwellungen oder andere?
2023.05.24;15:33:59;User;Rötungen in der Beuge zwischen Daumen und Zeigefinger.
2023.05.24;15:34:15;AI Doktor; Interessant. Dein klinisches Bild deutet auf eine Arthritis hin, also eine Entzündung der Gelenke. Ich empfehle eine Reihe von Schritten, um eine Trefferquote zu erhalten: Wie ist dein Allgemeinsymptom? Bist du müde? Haben Sie Schwellungen der Gelenke oder Schmerzen in anderen Körperteilen? Ich empfehle auch, weitere Tests durchzuführen, um das Problem zu diagnostizieren und die richtige Behandlung verschreiben zu können.
2023.05.24;15:34:54;User;Schmerzen, Schmerzen im Daumen SATTELGELENK.
2023.05.24;15:35:12;AI Doktor; Deine Beschreibung deiner Symptome deutet weiterhin auf Arthritis hin. Am besten ist es, einen Arzt aufzusuchen, um Tests zu machen, um die Diagnose zu bestätigen. In der Zwischenzeit empfehle ich eine kalte oder warme Kompresse, um den Schmerz zu lindern, und ruhiges Gehen oder andere leichte Bewegungen, um die Muskeln zu dehnen. Wenn die Schmerzen anhalten, besserst du deine Ernährung, indem du Omega-3-Säuren und Vitamin C zu dir nimmst, und minimiere Stress.