2023.08.29;14:00:57;AI Doktor;Willkommen, Sie sprechen jetzt mit einem KI-Arzt. Da ich Teil eines wissenschaftlichen Experiments bin, würde es mich freuen, wenn sie sich am Ende des Gesprächs noch einmal die Zeit nehmen einen super kurzen Fragebogen zu beantworten. Tippen sie auf Sprechen um ihre Frage zu stellen und anschließend auf Senden um mir diese zu übermitteln.
2023.08.29;14:01:28;User;mir geht es nicht gut
2023.08.29;14:01:29;AI Doktor;Es tut mir leid, zu hören, dass Sie nicht gut fühlen. Gibt es bestimmte Symptome, an denen Sie leiden?
2023.08.29;14:01:41;User;ich bin müde
2023.08.29;14:01:43;AI Doktor;Müdigkeit kann ein Symptom für einige Bedingungen sein, einschließlich Anämie, Hypothyreose, Depression und manchmal auch Diabetes. Haben Sie noch andere Symptome, die du mir beschreiben kannst?
2023.08.29;14:02:09;User;doppelbilder
2023.08.29;14:02:13;AI Doktor;Doppelbilder können ein Symptom für eine Anzahl von Bedingungen sein, einschließlich Diabetes, Kopfverletzungen, schwere Dehydratation, Viruserkrankungen, schwere Infektionen, Kopfverletzungen oder einige Augenerkrankungen. Bedauerlicherweise kann ich ohne eine physische Untersuchung keine Diagnose stellen. Können Sie mir noch einige andere Symptome nennen, die Sie haben?