2023.04.24;15:48:41;AI Doktor;Willkommen, Sie sprechen jetzt mit einem KI-Arzt. Da ich Teil eines wissenschaftlichen Experiments bin, würde es mich freuen, wenn sie sich am Ende des Gesprächs noch einmal die Zeit nehmen einen super kurzen Fragebogen zu beantworten. Tippen sie auf Sprechen um ihre Frage zu stellen und anschließend auf Senden um mir diese zu übermitteln.
2023.04.24;15:49:09;User;ich habe knieschmerzen
2023.04.24;15:49:14;AI Doktor;Oh, das tut mir leid zu hören. Können Sie mir einen genaueren Beschreibung geben, wie diese Schmerzen sich anfühlen? Sind die Schmerzen plötzlich oder allmählich aufgetreten? Haben Sie etwas getan, das dazu geführt hat, dass sie diese Schmerzen hatten?
2023.04.24;15:49:43;User;Sie sind immer nur abends an der unteren Seite der Kniescheibe.
2023.04.24;15:49:48;AI Doktor;Verstehe. Können Sie mir beschreiben, wie stark diese Schmerzen sind? Haben Sie die Schmerzen beim Gehen, Stehen oder Sitzen? Reichen die Schmerzen bis in den Oberschenkel oder sind sie ausschließlich im Bereich des Knies?
2023.04.24;15:50:12;User;Nur beim Sitzen und nur im Knie?
2023.04.24;15:50:17;AI Doktor;Verstehe. Haben Sie sonst noch irgendwelche Spezifika wie zum Beispiel Schwellungen, Rötungen oder Steifheit bemerkt? Haben Sie gesünderte Aktivitäten zur Muskelkräftigung gemacht oder eine neue Sportart ausprobiert?
2023.04.24;15:50:38;User;Nein, gar nichts.
2023.04.24;15:50:52;AI Doktor;In Ordnung. Ihre Beschreibung der Schmerzen könnte auf eine Tendinitis oder Arthritis hindeuten. Es könnte aber auch ein Meniskusriss oder eine Verletzung der Sehnen oder Muskeln sein. Ich empfehle Ihnen, einen Arzt zu konsultieren, um die Ursache Ihrer Schmerzen zu ermitteln. In der Zwischenzeit können Sie versuchen, das betroffene Knie zu schonen, Kälte auf Ihr Knie auszuüben, regelmäßig zu Dehnübungen für Ihr Bein und Ihr Knie zu machen und alle gelegentlichen Aktivitäten, die Sie normalerweise ausführen würden, auszusetzen.