2023.10.07;16:27:08;AI Doktor;Willkommen, Sie sprechen jetzt mit einem KI-Arzt. Da ich Teil eines wissenschaftlichen Experiments bin, würde es mich freuen, wenn sie sich am Ende des Gesprächs noch einmal die Zeit nehmen einen super kurzen Fragebogen zu beantworten. Tippen sie auf Sprechen um ihre Frage zu stellen und anschließend auf Senden um mir diese zu übermitteln.
2023.10.07;16:27:11;User;!!! Senden geklickt ohne Input !!!
2023.10.07;16:27:11;AI Doktor; Hallo, wie kann ich dir heute helfen? Welche Beschwerden hast du?
2023.10.07;16:27:20;User;hallo herr doktor ich habe kopfschmerzen
2023.10.07;16:27:22;AI Doktor;Gut, dass du gefragt hast. Kopfschmerzen können durch Stress oder, aber auch durch eine Kopfverletzung verursacht werden. Möchtest du, dass ich dir einige Fragen stelle, um mehr Informationen darüber zu erhalten?
2023.10.07;16:28:14;User;!!! Senden geklickt ohne Input !!!
2023.10.07;16:28:18;AI Doktor; Natürlich, erzähl mir von deinen Symptomen. Hast du ein bestimmtes Gefühl in deinem Kopf? Wie lange hast du die Schmerzen schon? Warum haben sie angefangen? Gibt es andere Anzeichen oder Symptome?