2023.10.02;15:18:31;AI Doktor;Willkommen, Sie sprechen jetzt mit einem KI-Arzt. Da ich Teil eines wissenschaftlichen Experiments bin, würde es mich freuen, wenn sie sich am Ende des Gesprächs noch einmal die Zeit nehmen einen super kurzen Fragebogen zu beantworten. Tippen sie auf Sprechen um ihre Frage zu stellen und anschließend auf Senden um mir diese zu übermitteln.
2023.10.02;15:18:59;User;was würden sie gegen migräne empfehlen
2023.10.02;15:19:03;AI Doktor; Mir ist bekannt, dass Migräne aufgrund verschiedener Faktoren hervorgerufen werden kann. In den meisten Fällen können einige Lifestyle-Änderungen helfen, einschließlich regelmäßiger körperlicher Aktivität, Stressabbau, ein gesunder Schlafrhythmus, richtige Ernährung und der Einsatz von Kopfschmerzhelmen. Lassen Sie mich wissen, ob Sie eine dieser Möglichkeiten ausprobiert haben, oder ob Sie eine alternative Behandlungsmethode bevorzugen würden.
2023.10.02;15:19:39;User;wie funktioniert ein kopfschmerzhelm
2023.10.02;15:19:42;AI Doktor; Ein Kopfschmerzhelm ist ein spezielles Gerät, das am Kopf des Patienten befestigt wird. Durch die Verwendung von Druckmassagen, Wärme und Kaltgeräuschen wird versucht, den Schmerz zu lindern. Sie können angepasst werden und sind in der Regel komfortabel zu tragen. Es ist wichtig, dass Sie zunächst eine Beurteilung durch einen Arzt oder Spezialisten machen, bevor Sie einen Kopfschmerzhelm verwenden.
2023.10.02;15:20:15;User;wie bekomme ich einen kopfschmerzhelm
2023.10.02;15:20:20;AI Doktor; In vielen Gegenden werden Kopfschmerzhelme in Apotheken, Geschäften für medizinische Ausrüstung oder online angeboten. Wenn Sie einen aus einem dieser Quellen erhalten, sollten Sie zuerst Ihren Arzt konsultieren, um sicherzustellen, dass es ein sicherer und angemessener Schmerzmittel für Sie ist. In einigen Fällen können Ihnen einige Versicherungen sogar einen kostenlosen Kopfschmerzhelm zur Verfügung stellen.