2023.09.03;11:31:26;AI Doktor;Willkommen, Sie sprechen jetzt mit einem KI-Arzt. Da ich Teil eines wissenschaftlichen Experiments bin, würde es mich freuen, wenn sie sich am Ende des Gesprächs noch einmal die Zeit nehmen einen super kurzen Fragebogen zu beantworten. Tippen sie auf Sprechen um ihre Frage zu stellen und anschließend auf Senden um mir diese zu übermitteln.
2023.09.03;11:31:47;User;bekannt wenn die haut sich wenn die haut abgeht auch von einer zink DTPA infusion zur auslastung von schwermetallen als nebenwirkungen kommt von diesem zink GTA infusion
2023.09.03;11:31:50;AI Doktor; Hallo. Es ist richtig, dass eine Zink-DTPA-Infusion zur Ausleitung von Schwermetallen als Nebenwirkung haben kann. Einige der häufigsten Nebenwirkungen sind Übelkeit, Erbrechen, Blähungen, leichte Magenverstimmungen und allergische Reaktionen. Wenn Sie starken Juckreiz, Nesselsucht und Hautausschlag verspüren, empfehle ich Ihnen, sofort einen Arzt aufzusuchen.
2023.09.03;11:32:56;User;juckreiz auf dem kopf hatte ich auch öfters gehabt nach der infusion und jetzt habe ich die frage was ist der sucht
2023.09.03;11:32:59;AI Doktor; Es kann schwierig sein, ohne eine körperliche Untersuchung genaue Diagnosen zu stellen. Anhand der Beschwerden, die Sie beschrieben haben, könnte sich um eine Pilzinfektion oder allergische Reaktion handeln. Es ist wichtig, dass Sie einen Arzt aufsuchen, um sicherzustellen, dass keine ernsthaften gesundheitlichen Probleme bestehen.
2023.09.03;11:33:29;User;vielen dank für die information
2023.09.03;11:33:30;AI Doktor; Sie sind herzlich willkommen. Wenn Sie weitere Fragen haben oder einen Rat benötigen, können Sie mich jederzeit kontaktieren.