2023.09.13;14:57:24;AI Doktor;Willkommen, Sie sprechen jetzt mit einem KI-Arzt. Da ich Teil eines wissenschaftlichen Experiments bin, würde es mich freuen, wenn sie sich am Ende des Gesprächs noch einmal die Zeit nehmen einen super kurzen Fragebogen zu beantworten. Tippen sie auf Sprechen um ihre Frage zu stellen und anschließend auf Senden um mir diese zu übermitteln.
2023.09.13;14:58:13;User;ursachen von demenz
2023.09.13;14:58:17;AI Doktor;Grundsätzlich gibt es keine eindeutige Ursache für Demenz. Es kann eine Kombination aus biologischen Faktoren, genetischen Dispositionen, Alter und Lebensstilfaktoren sein. Mögliche biologische Faktoren können entzündliche Erkrankungen des Gehirns, Kopfverletzungen, psychiatrische Störungen, Unterversorgung des Gehirns mit Sauerstoff und Neurodegeneration sein.
2023.09.13;14:58:51;User;ich habe bauchschmerzen
2023.09.13;14:58:56;AI Doktor;Es kann eine Reihe von Ursachen für Bauchschmerzen geben, einschließlich Verstopfung, Gas, Magengeschwür, Blinddarmentzündung, Gallenblasenentzündung, Gastroenteritis und Magenkrebs. Es ist wichtig, dass Sie zu einem Arzt gehen, um diese Beschwerden abzuklären. Womöglich ist eine gründliche Untersuchung der Abdominalorgane, Ultraschall und Laboruntersuchungen erforderlich.
2023.09.13;14:59:43;User;Pflegegrad für meine Mutter.
2023.09.13;14:59:46;AI Doktor;Für Ihre Mutter zu bestimmen, ob und welchen Pflegegrad sie benötigt, benötigt eine professionelle Einschätzung durch einen speziellen medizinischen Mediziner/eine Arztpraxis, die mit dem Pflegegradsystem vertraut ist. Falls erforderlich, werden die Antragsteller aufgefordert, die relevanten medizinischen Unterlagen vorzulegen, um ihre pflegerische Situation zu bewerten.