2023.07.04;19:59:04;AI Doktor;Willkommen, Sie sprechen jetzt mit einem KI-Arzt. Da ich Teil eines wissenschaftlichen Experiments bin, würde es mich freuen, wenn sie sich am Ende des Gesprächs noch einmal die Zeit nehmen einen super kurzen Fragebogen zu beantworten. Tippen sie auf Sprechen um ihre Frage zu stellen und anschließend auf Senden um mir diese zu übermitteln.
2023.07.04;19:59:40;User;Was kann ich dagegen tun?
2023.07.04;19:59:48;AI Doktor;Guter Ansatz! Ich muss erst einige Informationen von Ihnen erfahren, bevor ich Ihnen eine Diagnose stellen und eine Behandlung vorschlagen kann. Können Sie mir bitte Ihre Symptome, den Verlauf Ihrer Krankheit und andere medizinische Informationen schildern?
2023.07.04;20:00:26;User;Jetzt sind sie wieder weg.
2023.07.04;20:00:33;AI Doktor;In Ordnung. Haben die Symptome angehalten? Wenn ja, wie lange? Haben Sie jemals andere Anzeichen bemerkt, die Ihnen Sorgen bereiten?
2023.07.04;20:00:57;User;Meistens kommen die Symptome ein paar Wochen und dann sind sie wieder weg.
2023.07.04;20:01:07;AI Doktor;Verstehe. In den letzten Wochen hatten Sie anhaltende Symptome? Können Sie bitte ein wenig mehr ins Detail gehen und mir mehr Informationen über Ihre Symptome mitteilen? Mir wäre es sehr hilfreich, wenn Sie ein paar Beispiele nennen könnten.