2023.08.22;19:32:56;AI Doktor;Willkommen, Sie sprechen jetzt mit einem KI-Arzt. Da ich Teil eines wissenschaftlichen Experiments bin, würde es mich freuen, wenn sie sich am Ende des Gesprächs noch einmal die Zeit nehmen einen super kurzen Fragebogen zu beantworten. Tippen sie auf Sprechen um ihre Frage zu stellen und anschließend auf Senden um mir diese zu übermitteln.
2023.08.22;19:33:29;User;hallo erstmal ich will ich habe ein bisschen bauch und würde gerne ein wenig abnehmen haben sie da
2023.08.22;19:33:33;AI Doktor; Guten Tag. Ich freue mich, dass Sie sich an mich wenden, um mehr über Ihr Gewicht zu erfahren. Können Sie mir bitte einige Details zu Ihrer Ernährung, körperlichen Aktivität und Ihrem Gesundheitszustand geben? Gemeinsam können wir zusammen einen gesunden Weg finden, um Gewicht zu verlieren.
2023.08.22;19:34:11;User;ja also gesundheitlich bin ich vollkommen fit ernährung ist eigentlich normal also bei mir wird viel gekocht daheim es gibt aber zwischendrin auch sowas mal wie pommes und schnitzel tiefkühltruhe aber halt immer mit gemüse für sport habe ich leider wenig zeit da ich oft sehr lange
2023.08.22;19:34:19;AI Doktor; Verstehe, danke für Ihre Ehrlichkeit und die Details zu Ihrer Ernährung. Es hört sich so an, als hätten Sie eine ziemlich gesunde Ernährung, vor allem, wenn Sie versuchen, Gemüse zu Ihren Mahlzeiten hinzuzufügen. Leider hört es sich so an, als ob Sie nicht viel Zeit haben, um Sport zu treiben, aber das ist kein Problem. Wir können versuchen, einen Weg zu finden, um Gewicht zu verlieren, ohne sich auf ein intensives Trainingsprogramm einzulassen. Ich schlage vor, dass Sie über kleine Änderungen nachdenken, die Sie an Ihren Essgewohnheiten vornehmen können, zum Beispiel mehr Gemüse, weniger Zucker und weniger Kalorien aufnehmen. Ich kann Ihnen auch ein paar Ideen geben, wie Sie kleine Bewegungseinheiten in Ihren Tag integrieren können, w
2023.08.22;19:35:13;User;also das mit den bewegungseinheiten fände ich super tips würde ich mir gerne an
2023.08.22;19:35:18;AI Doktor; Gut, hier sind ein paar Ideen, die Sie ausprobieren können, um Ihren Kalorienverbrauch zu erhöhen und mehr Kalorien zu verbrennen: Gehen Sie einmal am Tag anstatt zu fahren oder nehmen Sie Treppen statt Fahrstühle oder Aufzüge. Holen Sie sich ein altes Hula-Hoop-Reifen für die nächsten Tage und machen Sie eine kleine Gehhüpf-Einheit, um Ihren Körper in Schwung zu bringen. Versuchen Sie, mindestens 5-10 Minuten Sport am Tag zu machen. Wenn Sie mehr schaffen, umso besser! Mit kleinen Schritten können Sie sich nach und nach hocharbeiten. Wenn Sie mehr über Ernährung erfahren möchten, kann ich diejenigen zur Verfügung stellen, die ich in meinem Wissensschatz habe.
2023.08.22;19:36:07;User;nee also einen sich reißen schon danke für ihre hilfe schönen
2023.08.22;19:36:09;AI Doktor; Nicht der Rede wert. Alles Gute auf Ihrem Weg! Falls Sie noch Fragen haben, stehe ich Ihnen gerne zur Verfügung.