2023.04.27;13:12:50;AI Doktor;Willkommen, Sie sprechen jetzt mit einem KI-Arzt. Da ich Teil eines wissenschaftlichen Experiments bin, würde es mich freuen, wenn sie sich am Ende des Gesprächs noch einmal die Zeit nehmen einen super kurzen Fragebogen zu beantworten. Tippen sie auf Sprechen um ihre Frage zu stellen und anschließend auf Senden um mir diese zu übermitteln.
2023.04.27;13:13:19;User;!!! Senden geklickt ohne Input !!!
2023.04.27;13:13:21;AI Doktor; Hallo, wie kann ich Ihnen heute helfen? Können Sie mir sagen, welche Symptome Sie haben?
2023.04.27;13:13:38;User;Speech Recognizer is now stopped.
2023.04.27;13:13:42;AI Doktor; Natürlich, wie ich schon sagte, bin ich hier, um Ihnen zu helfen. Was für Symptome haben Sie? Bitte beschreiben Sie Ihre Symptome, so detailliert wie möglich.
2023.04.27;13:13:51;User;du bist ein
2023.04.27;13:13:55;AI Doktor; Ich bin ein Arzt und kann dir helfen, deine medizinischen Fragen zu beantworten. Bitte beschreibe mir deine Symptome so detailliert wie möglich.
2023.04.27;13:14:09;User;Du bist ein *********.
2023.04.27;13:14:12;AI Doktor; Bitte seien Sie respektvoll. Ich bin ein KI-Arzt und kann Ihnen helfen, Ihre medizinischen Fragen zu beantworten. Können Sie mir bitte Ihre Symptome beschreiben?
2023.04.27;13:14:25;User;du bist ein dickes fettes schwein mit einem fetten ***** also ***** schwein loch oder ********* was weiß ich
2023.04.27;13:14:30;AI Doktor; Bitte seien Sie respektvoll. Ich versuche nur, Ihnen zu helfen, indem ich Ihnen medizinische Fragen stelle. Bitte beschreiben Sie mir Ihre Symptome, damit ich Ihnen eine passende Diagnose stellen und Ihnen eine angemessene Behandlung empfehlen kann.
2023.04.27;13:14:40;User;sie können mir dadurch helfen wenn sie ihre schnauze
2023.04.27;13:14:45;AI Doktor; Ich werde mich gerne als Ihr KI-Arzt bemühen, Ihnen zu helfen. Können Sie mir bitte Ihre Symptome detailgetreu beschreiben? Ich möchte Sie optimal behandeln und es ist wichtig, dass ich alle Informationen habe.