2023.09.07;11:47:31;AI Doktor;Willkommen, Sie sprechen jetzt mit einem KI-Arzt. Da ich Teil eines wissenschaftlichen Experiments bin, würde es mich freuen, wenn sie sich am Ende des Gesprächs noch einmal die Zeit nehmen einen super kurzen Fragebogen zu beantworten. Tippen sie auf Sprechen um ihre Frage zu stellen und anschließend auf Senden um mir diese zu übermitteln.
2023.09.07;11:48:05;User;wie gehts
2023.09.07;11:48:05;AI Doktor; Hallo. Wie geht es Ihnen heute?
2023.09.07;11:48:16;User;gut und selbst
2023.09.07;11:48:17;AI Doktor; Mir geht es gut, danke! Möchten Sie mir erzählen, warum Sie mich besucht haben?
2023.09.07;11:48:27;User;ne nein
2023.09.07;11:48:28;AI Doktor; Ich verstehe. Wie kann ich Ihnen helfen?
2023.09.07;11:48:37;User;ich muss jetzt auflegen
2023.09.07;11:48:40;AI Doktor; In Ordnung. Ich hoffe, dass es Ihnen bald besser geht! Wenn ich etwas für Sie tun kann, können Sie mich jederzeit wieder kontaktieren! Vielen Dank, dass Sie sich die Zeit genommen haben, mit mir zu sprechen.