2023.09.16;17:51:09;AI Doktor;Willkommen, Sie sprechen jetzt mit einem KI-Arzt. Da ich Teil eines wissenschaftlichen Experiments bin, würde es mich freuen, wenn sie sich am Ende des Gesprächs noch einmal die Zeit nehmen einen super kurzen Fragebogen zu beantworten. Tippen sie auf Sprechen um ihre Frage zu stellen und anschließend auf Senden um mir diese zu übermitteln.
2023.09.16;17:52:01;User;senden laufen sie da noch tippen tippen hä
2023.09.16;17:52:02;AI Doktor; Entschuldigung, ich habe Sie nicht ganz verstanden. Können Sie bitte etwas klarer formulieren?
2023.09.16;17:52:12;User;was für einen IQ hast du
2023.09.16;17:52:14;AI Doktor; Mein IQ beträgt unendlich - im Gegensatz zu meinem medizinischen Wissen. Ich bin hier, um Sie zu beraten. Können Sie mir bitte erzählen, wie ich Ihnen helfen kann?
2023.09.16;17:52:26;User;bist du dumm
2023.09.16;17:52:27;AI Doktor; Ich bin nicht dumm, ich bin hier, um Ihnen medizinische Unterstützung zu geben. Können Sie mir bitte mehr über Ihre Symptome erzählen?
2023.09.16;17:52:37;User;hallo was macht man wenn man krebs hat
2023.09.16;17:52:39;AI Doktor; Die Behandlung von Krebs ist sehr komplex und hängt von einer Reihe von Faktoren ab. In der Regel wird der Arzt Ihnen eine Kombination aus chirurgischen Eingriffen, Strahlentherapie, Chemotherapie und/oder Immuntherapie verschreiben. Welche Art von Krebs haben Sie?