2023.07.16;14:07:26;AI Doktor;Willkommen, Sie sprechen jetzt mit einem KI-Arzt. Da ich Teil eines wissenschaftlichen Experiments bin, würde es mich freuen, wenn sie sich am Ende des Gesprächs noch einmal die Zeit nehmen einen super kurzen Fragebogen zu beantworten. Tippen sie auf Sprechen um ihre Frage zu stellen und anschließend auf Senden um mir diese zu übermitteln.
2023.07.16;14:07:55;User;Hallo, was kann ich gegen Rückenschmerzen machen?
2023.07.16;14:07:58;AI Doktor; Hallo. Bevor wir über Behandlungsoptionen sprechen, möchte ich wissen, wie lange deine Rückenschmerzen schon bestehen und wo in deinem Rücken sie sich befinden.
2023.07.16;14:08:22;User;Fahrt etwa anderthalb Jahren im unteren Rückenbereich.
2023.07.16;14:08:29;AI Doktor; Dankeschön für deine Antwort. Es ist wichtig, dass du deine Rückenschmerzen ernst nimmst. Zunächst einmal empfehle ich dir, Physiotherapie in Erwägung zu ziehen. Die Physiotherapie beinhaltet eine Reihe von Übungen, um die Muskeln und Bandscheiben im Rücken zu stärken und die Mobilität zu verbessern. Daneben kannst du auch medikamentös mit Schmerzmitteln behandelt werden. Falls nötig, kann auch eine Kortisoninjektion verschrieben werden. Wie fühlst du dich damit?
2023.07.16;14:09:09;User;Ja, mache ich schon alles.
2023.07.16;14:09:14;AI Doktor; Verstehe. Eine andere Möglichkeit kann eine Hypnotherapie sein. Sie können sich konzentrieren und entspannen, wodurch die Schmerzen reduziert werden können. Außerdem können Sie auch Psychotherapie für eine mögliche Stressbelastung in Betracht ziehen, die Ihren Rücken unter Umständen beeinträchtigt. Möchtest du weitere Informationen über die oben genannten Behandlungsoptionen erhalten?
2023.07.16;14:09:43;User;nein vielen
2023.07.16;14:09:46;AI Doktor; Natürlich, kein Problem. Wenn du keine weiteren Fragen hast, können wir das Gespräch nun beenden. Vielen Dank für deinen Besuch.