2023.09.26;14:56:42;AI Doktor;Willkommen, Sie sprechen jetzt mit einem KI-Arzt. Da ich Teil eines wissenschaftlichen Experiments bin, würde es mich freuen, wenn sie sich am Ende des Gesprächs noch einmal die Zeit nehmen einen super kurzen Fragebogen zu beantworten. Tippen sie auf Sprechen um ihre Frage zu stellen und anschließend auf Senden um mir diese zu übermitteln.
2023.09.26;14:57:09;User;wie kann ich besser
2023.09.26;14:57:11;AI Doktor;Gute Frage! Bitte beschreiben Sie Ihre Symptome in ein paar Sätzen, damit ich Ihnen am besten helfen kann.
2023.09.26;14:57:28;User;ich schlafe nicht mehr durch und nur noch sehr schlecht ein
2023.09.26;14:57:29;AI Doktor;Hmm, das klingt nach Schlafstörungen. Haben Sie in letzter Zeit Änderungen in Ihrem Lebensstil festgestellt? Zum Beispiel eine andere Ernährungsgewohnheit, Stressfaktoren oder Änderungen im Schlafverhalten?
2023.09.26;14:57:52;User;eigentlich nicht viel nur kleinigkeiten
2023.09.26;14:57:56;AI Doktor;In Ordnung. Eine Ursache für diese Symptome könnte eine Schlafstörung sein. Haben Sie in letzter Zeit zuwenig Schlaf bekommen? Ich empfehle Ihnen, einen geregelten Tagesablauf zu befolgen und sich bei Bedarf einige Pausen zu gönnen, um sich zu entspannen. Ich rate Ihnen auch, Ihre körperliche und geistige Gesundheit zu erhalten, indem Sie ausreichend Bewegung in Ihren Tag einbauen.
2023.09.26;14:58:32;User;ja ich habe zu wenig schlaf dadurch bekommen was soll ich jetzt tun
2023.09.26;14:58:35;AI Doktor;Zunächst empfehle ich Ihnen, einen geregelten Tagesablauf beizubehalten, indem Sie jeden Tag um die gleiche Uhrzeit schlafen gehen und aufwachen. Außerdem sollten Sie eine angenehme Umgebung schaffen, in der Sie sich entspannen und schlafen können. Sie können auch versuchen, Stress reduzieren, Entspannungstechniken wie progressive Muskelentspannung oder Yoga anzuwenden und ausreichend Bewegung in den Alltag zu integrieren.
2023.09.26;14:58:52;User;leider funktioniert das bei mir so nicht
2023.09.26;14:58:55;AI Doktor;In Ordnung. Falls all diese Maßnahmen Ihnen nicht weiterhelfen, empfehle ich Ihnen, sich an Ihren behandelnden Arzt zu wenden, um weitere Behandlungsmöglichkeiten zu erörtern. Möglicherweise benötigen Sie auch eine medizinische Untersuchung, um weitere Diagnosen ausschließen zu können.