2023.04.30;17:10:04;AI Doktor;Willkommen, Sie sprechen jetzt mit einem KI-Arzt. Da ich Teil eines wissenschaftlichen Experiments bin, würde es mich freuen, wenn sie sich am Ende des Gesprächs noch einmal die Zeit nehmen einen super kurzen Fragebogen zu beantworten. Tippen sie auf Sprechen um ihre Frage zu stellen und anschließend auf Senden um mir diese zu übermitteln.
2023.04.30;17:10:52;User;okay senden
2023.04.30;17:10:56;AI Doktor;Was ist dein Problem? Bitte beschreibe deine Symptome so detailliert wie möglich und teile mir alle anderen Informationen mit, die für die Beurteilung deines Zustands wichtig sind.
2023.04.30;17:11:19;User;Immer wenn ich ein Stück Kuchen mit ganz viel Sahne esse, kriege ich danach Bauchschmerzen.
2023.04.30;17:11:30;AI Doktor;Verstehe, das klingt nach einer Unverträglichkeit des Nahrungsmittels Milchprodukte. Möglicherweise haben Sie eine Unverträglichkeit gegenüber Milchprodukten oder Laktoseintoleranz. Es kann helfen, typische Milchprodukte, wie Käse und Sahne auszulassen und nur niedrig-laktose Lebensmittel zu konsumieren und bei Bedarf laktosefreie Nahrungsergänzungsmittel einzunehmen, um Ihre Symptome zu lindern.
2023.04.30;17:12:04;User;Das ist aber nur bei Erdbeerkuchen so.
2023.04.30;17:12:12;AI Doktor;Das könnte darauf hindeuten, dass nicht nur das Milchprodukt schuld an Ihren Symptomen ist, sondern möglicherweise auch die Frucht, in diesem Fall Erdbeeren. Versuchen Sie, Kuchen ohne Sahne zu essen, aber mit anderen Fruchtsorten, um zu sehen, ob Ihre Symptome sich ändern. Wenn ja, können Sie eine Unverträglichkeit gegenüber einer bestimmten Frucht haben.
2023.04.30;17:12:43;User;Das ist sehr schade, jetzt gehe ich sehr deprimiert heim.
2023.04.30;17:12:51;AI Doktor;Es ist verständlich, wenn Sie sich emotional frustriert fühlen, aber versuchen Sie, Optimismus zu bewahren und die Informationen, die wir besprochen haben, als Chance zu sehen, herauszufinden, was Ihnen gut und was Ihnen schlecht tut. Es kann helfen, Erfahrungen auszutauschen, Ärzte zu konsultieren, um weitere Ratschläge zu erhalten und einen Ernährungsplan zu überwachen.
2023.04.30;17:13:22;User;Vielen Dank auf Wiedersehen.
2023.04.30;17:13:26;AI Doktor;Gern geschehen! Ich hoffe, Sie finden eine Lösung für Ihr Problem. Wenn Sie eine weitere Beratung benötigen, stehe ich Ihnen jederzeit zur Verfügung. Auf Wiedersehen und alles Gute.