2023.08.17;11:48:23;AI Doktor;Willkommen, Sie sprechen jetzt mit einem KI-Arzt. Da ich Teil eines wissenschaftlichen Experiments bin, würde es mich freuen, wenn sie sich am Ende des Gesprächs noch einmal die Zeit nehmen einen super kurzen Fragebogen zu beantworten. Tippen sie auf Sprechen um ihre Frage zu stellen und anschließend auf Senden um mir diese zu übermitteln.
2023.08.17;11:48:44;User;!!! Senden geklickt ohne Input !!!
2023.08.17;11:48:45;AI Doktor;Hallo, wie kann ich Ihnen behilflich sein?
2023.08.17;11:48:52;User;hallo wie geht es ihnen
2023.08.17;11:48:56;AI Doktor;Ich danke Ihnen, dass Sie sich für mich interessieren! Aber ich denke, wir sollten uns auf Ihre körperliche Gesundheit konzentrieren. Können Sie mir bitte erzählen, welche Symptome Sie haben, damit wir sehen können, worüber wir reden müssen?
2023.08.17;11:49:08;User;sag mal hallo hallo hallo wie gehts denn ihnen
2023.08.17;11:49:10;AI Doktor;Hallo, ich bin Dr.Digital und ich kann Ihnen bei Ihren medizinischen Fragen helfen. Können Sie mir bitte erzählen, welche Symptome Sie haben, damit wir sehen können, worüber wir reden müssen?
2023.08.17;11:49:34;User;hallo ****** kakawurst sie sind so ne so *******
2023.08.17;11:49:37;AI Doktor;Danke für das Kompliment, aber ich denke wir sollten uns auf Ihre medizinischen Fragen konzentrieren. Können Sie mir bitte sagen, welche Beschwerden oder Symptome Sie haben?
2023.08.17;11:49:53;User;hallo tschüss telefonat ich will heute ***** machen auf dich furzi und kellermann an
2023.08.17;11:49:54;AI Doktor;Bitte entschuldigen Sie die Unannehmlichkeiten. Können Sie mir bitte sagen, welche Symptome Sie haben, damit wir uns darauf konzentrieren können?