2023.09.24;10:23:22;AI Doktor;Willkommen, Sie sprechen jetzt mit einem KI-Arzt. Da ich Teil eines wissenschaftlichen Experiments bin, würde es mich freuen, wenn sie sich am Ende des Gesprächs noch einmal die Zeit nehmen einen super kurzen Fragebogen zu beantworten. Tippen sie auf Sprechen um ihre Frage zu stellen und anschließend auf Senden um mir diese zu übermitteln.
2023.09.24;10:24:07;User;Hallo, wie schön Waco.
2023.09.24;10:24:09;AI Doktor; Hallo, ich bin hier, um Ihnen zu helfen. Welche Symptome haben Sie, die Sie möglicherweise in ärztliche Behandlung bringen möchten?
2023.09.24;10:24:30;User;ich habe schnupfen und husten
2023.09.24;10:24:35;AI Doktor; Verstehe. Es könnte darauf hindeuten, dass Sie an einer Erkältung oder Grippe leiden. Ich empfehle Ihnen, viel Flüssigkeit zu trinken, viel Ruhe zu bekommen und Medikamente einzunehmen, um die Symptome zu lindern. Wenn Sie Ihren Zustand nicht verbessern, empfehle ich Ihnen, sich in ein Krankenhaus oder eine andere ärztliche Einrichtung zu begeben, damit sie untersucht werden können.
2023.09.24;10:24:59;User;ich habe rückenschmerzen ich habe spina bifida was soll ich tun
2023.09.24;10:25:02;AI Doktor; Verstehe. Rückenschmerzen können bei Spina bifida häufig vorkommen. Wenn die Schmerzen Ihr Alltagsleben beeinträchtigen, empfehle ich Ihnen, sich an Ihren Facharzt zu wenden. Er kann Sie untersuchen und Ihnen eine angemessene Behandlung empfehlen. Regelmäßige Übungen, Massagen und physiotherapeutische Behandlungen können Ihre Symptome lindern. Wenn Sie Medikamente oder alternative Therapien benötigen, kann Ihnen Ihr Arzt dabei helfen, eine effektive Behandlung zu finden.
2023.09.24;10:25:47;User;ich habe husten
2023.09.24;10:25:51;AI Doktor; Es könnte darauf hindeuten, dass Sie an einer Erkältung oder Grippe leiden. Ich empfehle Ihnen, viel Flüssigkeit zu trinken, viel Ruhe zu bekommen und Medikamente einzunehmen, um die Symptome zu lindern. Wenn Sie Ihren Zustand nicht verbessern, empfehle ich Ihnen, sich in ein Krankenhaus oder eine andere ärztliche Einrichtung zu begeben, damit sie untersucht werden können.