2023.08.22;20:58:53;AI Doktor;Willkommen, Sie sprechen jetzt mit einem KI-Arzt. Da ich Teil eines wissenschaftlichen Experiments bin, würde es mich freuen, wenn sie sich am Ende des Gesprächs noch einmal die Zeit nehmen einen super kurzen Fragebogen zu beantworten. Tippen sie auf Sprechen um ihre Frage zu stellen und anschließend auf Senden um mir diese zu übermitteln.
2023.08.22;20:59:22;User;wie gefährlich ist eine beinthrombose
2023.08.22;20:59:24;AI Doktor; Eine Beinthrombose kann sehr gefährlich sein, da sich eine Thrombose leicht zu anderen Organen ausbreiten und einen gefährlichen Zustand hervorrufen kann. Es ist daher wichtig, so schnell wie möglich einen Arzt aufzusuchen und sich entsprechend behandeln zu lassen.
2023.08.22;20:59:49;User;mit welchen medikamenten wird eine beinthrombose behandelt
2023.08.22;20:59:51;AI Doktor; Bei einer Beinthrombose wird meist ein orales Antikoagulans, wie z.B. Marcumar, eingesetzt. Zusätzlich kann man zur Schmerzlinderung Schmerzmittel verschreiben, und Müdigkeit lindern können Medikamente wie Daflon verschrieben werden. Darüber hinaus kann der Arzt Bettruhe und Kompressionsstrümpfe empfehlen.
2023.08.22;21:00:25;User;muss ich mir sorgen machen wenn jemand eine beinthrombose
2023.08.22;21:00:28;AI Doktor; Es ist wichtig, dass Betroffene schnell und adäquat behandelt werden, damit ein erneutes Auftreten einer Beinthrombose minimiert und Komplikationen vermieden werden. Daher ist es wichtig, sich professionelle Hilfe zu holen und ein medizinisches Monitoring vorzunehmen, sobald eine Beinthrombose diagnostiziert wurde.
2023.08.22;21:01:03;User;welche informationen haben sie zu pathologischem
2023.08.22;21:01:08;AI Doktor; Eine pathologische Beinthrombose tritt normalerweise auf, wenn Blutgerinnsel in der tiefen Beinvene oder in den Beinarterien auftreten. Dies kann zu Verstopfungen, gesteigerter Flüssigkeitsansammlung und Einblutung sowie Betäubung oder kaltem Gefühl in den betroffenen Bereich führen. Wenn man keine Behandlung erhält, kann es zu schwerwiegenden Komplikationen kommen. Daher ist es wichtig, so schnell wie möglich einen Arzt aufzusuchen.
2023.08.22;21:01:47;User;ich möchte informationen zu dem krankheitsbild pathologisches horten
2023.08.22;21:01:52;AI Doktor; Pathologisches Horten ist ein schnelles Wachstum von Blutgerinnseln (Thromben) in den tiefen Venen, auch bekannt als Phlebothrombose. Es kann zu Schmerzen und einem Gefühl der Schwere und Anspannung in den Beinen und sogar zu Schwellungen des Körpers führen. In den meisten Fällen müssen Betroffene oral antikoagulative Präparate wie Marcumar einnehmen, Kompressionsstrümpfe tragen und Bettruhe machen. Wenn die Symptome schwerwiegend oder Fieber oder Kurzatmigkeit vorhanden sind, sollten Sie unbedingt sofort einen Arzt aufsuchen.