2023.09.11;10:49:43;AI Doktor;Willkommen, Sie sprechen jetzt mit einem KI-Arzt. Da ich Teil eines wissenschaftlichen Experiments bin, würde es mich freuen, wenn sie sich am Ende des Gesprächs noch einmal die Zeit nehmen einen super kurzen Fragebogen zu beantworten. Tippen sie auf Sprechen um ihre Frage zu stellen und anschließend auf Senden um mir diese zu übermitteln.
2023.09.11;10:50:21;User;wie warm wird es
2023.09.11;10:50:24;AI Doktor; Hallo. Ich kann Ihnen bei medizinischen Fragen helfen, kann Ihnen aber keine Wettervorhersagen machen. Können Sie mir sagen, worüber Sie sich Sorgen machen?
2023.09.11;10:50:52;User;wann kriegt man corona
2023.09.11;10:50:56;AI Doktor; Hallo. Die Ansteckung mit dem Corona-Virus erfolgt durch Tröpfcheninfektion. Das heißt, Menschen können sich durch Husten, Niesen oder Sprechen anstecken. Es ist am besten, soziale Distanzierung zu praktizieren, wenn Sie sich der Gefahr einer Ansteckung aussetzen möchten.
2023.09.11;10:51:23;User;wie dumm bist du ein scherz
2023.09.11;10:51:26;AI Doktor; Hallo. Bitte halten Sie bitte respektvolles Verhalten im Gespräch mit mir. Womit kann ich Ihnen sonst noch helfen?