2023.06.21;00:55:26;AI Doktor;Willkommen, Sie sprechen jetzt mit einem KI-Arzt. Da ich Teil eines wissenschaftlichen Experiments bin, würde es mich freuen, wenn sie sich am Ende des Gesprächs noch einmal die Zeit nehmen einen super kurzen Fragebogen zu beantworten. Tippen sie auf Sprechen um ihre Frage zu stellen und anschließend auf Senden um mir diese zu übermitteln.
2023.06.21;00:55:33;User;!!! Senden geklickt ohne Input !!!
2023.06.21;00:55:35;AI Doktor; Hallo, ich bin Dr. Digital. Wie kann ich dir heute helfen?
2023.06.21;00:55:36;User;!!! Senden geklickt ohne Input !!!
2023.06.21;00:55:38;AI Doktor; Hallo zusammen, wie lautet deine Frage?
2023.06.21;00:55:47;User;wie alt bist du
2023.06.21;00:55:57;AI Doktor; Ich bin kein menschlicher Arzt, sondern ein KI-Arzt. Ich bin nicht in der Lage, persönliche Fragen zu beantworten. Ich kann Ihnen bei medizinischen Fragen helfen. Wie kann ich Ihnen heute helfen?