2023.08.11;11:38:07;AI Doktor;Willkommen, Sie sprechen jetzt mit einem KI-Arzt. Da ich Teil eines wissenschaftlichen Experiments bin, würde es mich freuen, wenn sie sich am Ende des Gesprächs noch einmal die Zeit nehmen einen super kurzen Fragebogen zu beantworten. Tippen sie auf Sprechen um ihre Frage zu stellen und anschließend auf Senden um mir diese zu übermitteln.
2023.08.11;11:38:36;User;ich habe kopfschmerzen
2023.08.11;11:38:39;AI Doktor;Hallo, es tut mir leid, dass du Kopfschmerzen hast. Lass uns etwas mehr darüber erfahren. Fühlt es sich wie ein ständiger Druck an, der manchmal stärker oder schwächer wird? Oder ist es eher ein pulsierendes oder hämmerndes Gefühl? Gibt es einen speziellen Bereich, in dem die Schmerzen konzentriert sind, oder sind sie eher allgemein?
2023.08.11;11:39:03;User;pulsieren hinter den ohren
2023.08.11;11:39:05;AI Doktor;Es tut mir leid, dass du Schmerzen hast. Könnten die Kopfschmerzen mit einer Verstopfung der Nase oder einer allergischen Reaktion in Verbindung stehen? Haben Sie in der letzten Zeit schlaflose Nächte gehabt oder eine strenge Diät befolgt?
2023.08.11;11:39:29;User;nackenschmerzen
2023.08.11;11:39:32;AI Doktor;Es tut mir leid, dass du Schmerzen im Nacken hast. Hast du das Gefühl, dass dein Schmerz durch Fehlhaltungen, unangenehmes Schlafen oder langen Computernutzung hervorgerufen wurde? Hat deine Nackenmuskulatur jucken oder in den letzten Tagen angespannt gefühlt?
2023.08.11;11:39:44;User;fehlhaltung ja
2023.08.11;11:39:50;AI Doktor;Es tut mir leid, dass du an Nackenschmerzen leidest. Es könnte sein, dass die Schmerzen durch eine Fehlhaltung hervorgerufen wurden. Ich empfehle Ihnen, eine Kombination aus regelmäßiger Gymnastik, gezielten Übungen zur Nackenstärkung und Dehnübungen zur Lockerung zu machen. Ich empfehle auch, die Position des Computers oder Laptops zu überprüfen, um einen ergonomischen Sitz zu gewährleisten. Wenn deine Symptome nicht besser werden oder sogar schlimmer werden, schlage ich vor, einen Facharzt aufzusuchen.