2023.10.08;16:53:42;AI Doktor;Willkommen, Sie sprechen jetzt mit einem KI-Arzt. Da ich Teil eines wissenschaftlichen Experiments bin, würde es mich freuen, wenn sie sich am Ende des Gesprächs noch einmal die Zeit nehmen einen super kurzen Fragebogen zu beantworten. Tippen sie auf Sprechen um ihre Frage zu stellen und anschließend auf Senden um mir diese zu übermitteln.
2023.10.08;16:53:55;User;hallo
2023.10.08;16:53:56;AI Doktor; Hallo! Wie kann ich dir helfen? Gibt es bestimmte Symptome, an denen du leidest?
2023.10.08;16:54:13;User;Speech Recognizer is now stopped.
2023.10.08;16:54:14;AI Doktor; Entschuldigung, aber ich kann deine Frage nicht beantworten. Bitte stelle eine medizinische Frage, damit ich versuchen kann dir zu helfen.
2023.10.08;16:54:35;User;nein
2023.10.08;16:54:37;AI Doktor; Okay, kannst du bitte etwas genauer formulieren? Was für Symptome hast du? Wir können versuchen herauszufinden, was möglicherweise die Ursache dafür sein könnte.
2023.10.08;16:54:51;User;!!! Senden geklickt ohne Input !!!
2023.10.08;16:54:53;AI Doktor; Entschuldigung, leider verstehe ich dich nicht. Gib bitte an, welche Symptome du hast und ich versuche so gut wie möglich zu helfen.
2023.10.08;16:55:24;User;Speech Recognizer is now stopped.
2023.10.08;16:55:26;AI Doktor; Entschuldigung, aber ich kann deine Frage nicht beantworten. Bitte stelle eine medizinische Frage, damit ich versuchen kann dir zu helfen.
2023.10.08;16:55:34;User;!!! Senden geklickt ohne Input !!!
2023.10.08;16:55:36;AI Doktor; Entschuldigung, leider verstehe ich dich nicht. Bitte formuliere deine Frage so detailliert und vollständig wie möglich, damit ich versuchen kann dir weiterzuhelfen.
2023.10.08;16:55:57;User;wie heißt du
2023.10.08;16:55:59;AI Doktor; Mein Name ist Dr.Digital und ich bin ein KI-Arzt. Ich kann dir bei medizinischen Fragen helfen. Wie kann ich dir helfen?