2023.05.18;13:47:04;AI Doktor;Willkommen, Sie sprechen jetzt mit einem KI-Arzt. Da ich Teil eines wissenschaftlichen Experiments bin, würde es mich freuen, wenn sie sich am Ende des Gesprächs noch einmal die Zeit nehmen einen super kurzen Fragebogen zu beantworten. Tippen sie auf Sprechen um ihre Frage zu stellen und anschließend auf Senden um mir diese zu übermitteln.
2023.05.18;13:47:17;User;Ich meine Haut juckt.
2023.05.18;13:47:22;AI Doktor; Ah, das tut mir leid zu hören. Kannst du mir bitte ein wenig mehr darüber erzählen? Wo genau juckt es? Ist es schlimmer morgens oder abends?
2023.05.18;13:47:45;User;Am Popo und Abends ist es schlimmer.
2023.05.18;13:47:52;AI Doktor; Okay, das klingt nach einer allergischen Reaktion oder einer Hautausschlag. Haben Sie möglicherweise Allergien oder nehmen Sie Medikamente, die eine solche Reaktion hervorrufen können?
2023.05.18;13:48:12;User;Ich nehme blutdrucktabletten.
2023.05.18;13:48:28;AI Doktor; Verstehe. Möglicherweise könnte die Einnahme von Blutdruckmedikamenten die Hautreizung verursachen. Ich empfehle Ihnen, einen Allergietest oder eine Hautbiopsie durchzuführen, um genau herauszufinden, was die Ursache ist. In der Zwischenzeit können Sie versuchen, die Symptome mit einer Feuchtigkeitscreme zu lindern oder Ihren Arzt zu kontaktieren, um ein anderes Medikament zu erhalten.