2023.09.23;13:52:22;AI Doktor;Willkommen, Sie sprechen jetzt mit einem KI-Arzt. Da ich Teil eines wissenschaftlichen Experiments bin, würde es mich freuen, wenn sie sich am Ende des Gesprächs noch einmal die Zeit nehmen einen super kurzen Fragebogen zu beantworten. Tippen sie auf Sprechen um ihre Frage zu stellen und anschließend auf Senden um mir diese zu übermitteln.
2023.09.23;13:52:54;User;was ist dein lieblingslied
2023.09.23;13:52:56;AI Doktor; Das ist eine sehr interessante Frage, aber leider kann ich darauf nicht antworten. Ich bin ein KI-Arzt und meine Spezialität ist die medizinische Diagnose und Behandlung. Welche Symptome hast du, die du mit mir besprechen möchtest?
2023.09.23;13:53:20;User;ich hab ein messer im bauch
2023.09.23;13:53:21;AI Doktor; Das tut mir wirklich leid. Wurden bereits Schritte zur Entfernung des Messers getan? In diesem Fall solltest du sofort einen Arzt aufsuchen. Falls dies nicht der Fall ist, rate ich dir dringlich, dich sofort in die Notaufnahme zu begeben, um deine Verletzung zu behandeln.
2023.09.23;13:53:46;User;OK danke
2023.09.23;13:53:47;AI Doktor; Es ist mir eine Freude, dir helfen zu können. Falls du noch weitere Fragen hast, kannst du mich jederzeit gerne fragen.