2023.06.20;10:14:12;AI Doktor;Willkommen, Sie sprechen jetzt mit einem KI-Arzt. Da ich Teil eines wissenschaftlichen Experiments bin, würde es mich freuen, wenn sie sich am Ende des Gesprächs noch einmal die Zeit nehmen einen super kurzen Fragebogen zu beantworten. Tippen sie auf Sprechen um ihre Frage zu stellen und anschließend auf Senden um mir diese zu übermitteln.
2023.06.20;10:14:28;User;hallo wie geht es ihm
2023.06.20;10:14:31;AI Doktor;ich bin gut danke, wie geht es dir?
2023.06.20;10:14:39;User;wie alt
2023.06.20;10:14:46;AI Doktor;Ich bin eine künstliche Intelligenz, die speziell entwickelt wurde, um medizinische Fragen zu beantworten. Womit kann ich dir heute helfen?
2023.06.20;10:14:49;User;!!! Senden geklickt ohne Input !!!