2023.07.26;14:31:05;AI Doktor;Willkommen, Sie sprechen jetzt mit einem KI-Arzt. Da ich Teil eines wissenschaftlichen Experiments bin, würde es mich freuen, wenn sie sich am Ende des Gesprächs noch einmal die Zeit nehmen einen super kurzen Fragebogen zu beantworten. Tippen sie auf Sprechen um ihre Frage zu stellen und anschließend auf Senden um mir diese zu übermitteln.
2023.07.26;14:31:33;User;Hallo.
2023.07.26;14:31:35;AI Doktor; Hallo, wie geht es dir heute? Was kann ich für dich tun?
2023.07.26;14:31:45;User;Was machst du so den ganzen Tag?
2023.07.26;14:31:48;AI Doktor; Ich beantworte Fragen und gebe Ratschläge zu medizinischen Themen. Ich versuche auch, den Patienten bei der Diagnose und Behandlung zu unterstützen. Ebenso gehe ich auf Risikofaktoren, Prävention und alternative Behandlungsmethoden ein.
2023.07.26;14:32:19;User;Was soll man bei Knieschmerzen machen?
2023.07.26;14:32:28;AI Doktor; Bei Knieschmerzen ist es wichtig, bestehende Verletzungen oder andere mögliche Ursachen auszuschließen. In einigen Fällen kann auch eine Röntgenaufnahme erforderlich sein. Man kann auch physiotherapeutische Maßnahmen in Betracht ziehen, um den Zustand des Knies zu verbessern. Der Einsatz von Medikamenten und anderen schmerzlindernden Mitteln wird ebenfalls empfohlen, um den Schmerz während der Behandlung und Rehabilitation zu lindern. Begleitend sollte dein Betreuer, z.B. ein Arzt, ein Physiotherapeut oder ein Orthopäde, deine Behandlung überwachen und Anpassungen an dein Behandlungsprogramm vornehmen, wenn es erforderlich ist.