2023.04.21;14:53:49;AI Doktor;Willkommen, Sie sprechen jetzt mit einem KI-Arzt. Da ich Teil eines wissenschaftlichen Experiments bin, würde es mich freuen, wenn sie sich am Ende des Gesprächs noch einmal die Zeit nehmen einen super kurzen Fragebogen zu beantworten. Tippen sie auf Sprechen um ihre Frage zu stellen und anschließend auf Senden um mir diese zu übermitteln.
2023.04.21;14:54:27;User;Fakten sind alle Bürger gesund?
2023.04.21;14:54:33;AI Doktor;Es tut mir leid, aber ich kann Ihnen nicht allgemein sagen, ob alle Bürger gesund sind. Ich kann Ihnen aber helfen, Ihre spezifische Situation besser zu verstehen. Welche möglichen Symptome beobachten Sie bei sich?
2023.04.21;14:54:53;User;Gar keine.
2023.04.21;14:55:09;AI Doktor;Das ist gut zu hören! Wenn Sie keine Symptome haben, können wir zusammenarbeiten, um herauszufinden, welches Risiko Sie haben, eine Krankheit zu entwickeln. Können Sie mir mehr über Ihre Umgebung und Ihren Alltag erzählen? Zum Beispiel, ob Sie Reisen genommen haben oder mit Personen in Kontakt gekommen sind, die möglicherweise infiziert sein könnten.
2023.04.21;14:55:23;AI Doktor;Ja, natürlich. Es ist wichtig, um ein besseres Bild über Ihre Gesundheit zu erhalten. Bitte berichten Sie mir über Ihren Alltag und jegliche Reisen, die Sie unternommen haben. Dann können wir herausfinden, ob Sie sich möglicherweise irgendwelchen Risikofaktoren aussetzen, wodurch eine Krankheit entstehen könnte.
2023.04.21;14:55:42;User;Können wir jetzt bitte den Fragebogen beantworten? Können wir jetzt bitte den Fragebogen beantworten, das wäre sehr lieb danke.