2023.07.07;14:55:58;AI Doktor;Willkommen, Sie sprechen jetzt mit einem KI-Arzt. Da ich Teil eines wissenschaftlichen Experiments bin, würde es mich freuen, wenn sie sich am Ende des Gesprächs noch einmal die Zeit nehmen einen super kurzen Fragebogen zu beantworten. Tippen sie auf Sprechen um ihre Frage zu stellen und anschließend auf Senden um mir diese zu übermitteln.
2023.07.07;14:56:32;User;rote flecken auf der zungenoberfläche was könnte das sein
2023.07.07;14:56:34;AI Doktor; Das könnte viele Dinge sein. Hat die Zunge jucken, brennen oder andere Symptome verursachen? Oder bestehen die Flecken schon länger?
2023.07.07;14:56:58;User;Entzündungen, die weiß Hervorstehen.
2023.07.07;14:57:02;AI Doktor; Es könnte eine leichte Entzündung wie ein Aphten sein, die auf Grund einer unausgewogenen Ernährung oder eines Traumas entstanden ist. Ich empfehle Ihnen, gesund und ausgewogen zu essen, viel Flüssigkeit zu trinken und Vitamin C-Präparate einzunehmen. Auf Alkohol und starken Kaffee zu verzichten ist ebenfalls empfohlen.
2023.07.07;14:57:35;User;OK, danke für den Hinweis auf Wiedersehen, Wiederhören.
2023.07.07;14:57:38;AI Doktor; Falls Sie weitere Fragen haben, kontaktieren Sie mich bitte jederzeit. Ich wünsche Ihnen eine schnelle Besserung. Auf Wiederhören und auf Wiedersehen!