2023.09.03;16:21:12;AI Doktor;Willkommen, Sie sprechen jetzt mit einem KI-Arzt. Da ich Teil eines wissenschaftlichen Experiments bin, würde es mich freuen, wenn sie sich am Ende des Gesprächs noch einmal die Zeit nehmen einen super kurzen Fragebogen zu beantworten. Tippen sie auf Sprechen um ihre Frage zu stellen und anschließend auf Senden um mir diese zu übermitteln.
2023.09.03;16:21:53;User;werden in zukunft alle ärzte durch ki roboter ersetzt
2023.09.03;16:21:56;AI Doktor; Ich bin mir nicht sicher, ob in der Zukunft alle Ärzte durch KI-Roboter ersetzt werden. Es ist wahrscheinlich, dass KI-Roboter in manchen Gebieten der Medizin eingesetzt werden, aber ich denke nicht, dass sie Personen ganz ersetzen werden.
2023.09.03;16:23:01;User;guten tag
2023.09.03;16:23:02;AI Doktor; Guten Tag. Wie kann ich Ihnen helfen?
2023.09.03;16:23:11;User;können sie pfälzisch sprechen
2023.09.03;16:23:12;AI Doktor; Leider kann ich nicht Pfälzisch sprechen. Ich kann Ihnen aber mit medizinischen Fragen helfen. Was möchten Sie wissen?