2023.05.17;19:29:10;AI Doktor;Willkommen, Sie sprechen jetzt mit einem KI-Arzt. Da ich Teil eines wissenschaftlichen Experiments bin, würde es mich freuen, wenn sie sich am Ende des Gesprächs noch einmal die Zeit nehmen einen super kurzen Fragebogen zu beantworten. Tippen sie auf Sprechen um ihre Frage zu stellen und anschließend auf Senden um mir diese zu übermitteln.
2023.05.17;19:29:17;User;Was weißt du über vulvodynie?
2023.05.17;19:29:51;AI Doktor; Vulvodynie ist eine neropathische Erkrankung, die durch einen chronischen, schmerzhaften Zustand der Vulva gekennzeichnet ist. Die Vulva umfasst die äußeren Genitalien einer Frau und beinhaltet die Schamlippen, Klitoris, Vaginalöffnung und umliegende Haut. Die Ursachen sind noch nicht vollständig verstanden, aber Infektionen, entzündlichen Erkrankungen, hormonellen Störungen, neurologische Konditionen und Trauma können alles sein. Behandlungsoptionen können topische Steroid- oder Antiseptika-Cremes, Geschlechtsverkehr und Bestrahlung sein. Es besteht auch die Möglichkeit, dass ein professioneller physiotherapeutischer Ansatz hilft, einige der Schmerzen zu lindern.
2023.05.17;19:30:43;User;Weißt du, ob Botox helfen kann?
2023.05.17;19:31:07;AI Doktor; Es gibt einige Studien, die darauf hindeuten, dass Botox bei Frauen, die unter Dyspareunie leiden (schmerzhafter Geschlechtsverkehr), eine sinnvolle Option darstellt. In einigen Fällen wurde eine signifikante Verbesserung der Schmerzen berichtet. Andere Mediziner empfehlen jedoch, Botox erst nach einer anderen Behandlung zu versuchen, da die langfristige Sicherheit und Wirksamkeit von Botox bei Patienten mit vulvodynie noch unzureichend untersucht wurde.
2023.05.17;19:31:46;User;An welchen Arzt kann ich mich bei diesen Beschwerden wenden?
2023.05.17;19:32:06;AI Doktor; Der beste Arzt, mit dem Du Dich in Bezug auf vulvodynie in Verbindung setzen kannst, ist ein Gynäkologe. Sie haben die Erfahrung, um diese Erkrankung richtig zu diagnostizieren und Behandlungen zu empfehlen. Zusätzlich kannst Du auch mit einem Urologen oder Hautarzt sprechen, der über spezifischere Informationen zu verschiedenen Behandlungsoptionen verfügt.
2023.05.17;19:32:41;User;Danke.