2023.04.16;10:13:57;AI Doktor;Willkommen, Sie sprechen jetzt mit einem KI-Arzt. Da ich Teil eines wissenschaftlichen Experiments bin, würde es mich freuen, wenn sie sich am Ende des Gesprächs noch einmal die Zeit nehmen einen super kurzen Fragebogen zu beantworten. Tippen sie auf Sprechen um ihre Frage zu stellen und anschließend auf Senden um mir diese zu übermitteln.
2023.04.16;10:14:26;User;Guten Tag, ich habe Magenschmerzen.
2023.04.16;10:14:28;AI Doktor; Hallo, das tut mir leid! Können Sie mir ein paar mehr Details darüber geben? Wie lange haben Sie Schmerzen? Haben Sie andere Symptome, wie Übelkeit oder Fieber?
2023.04.16;10:14:54;User;Ich habe keine anderen Schmerzen, keine anderen Symptome wie Übelkeit und Fieber und Magenschmerzen habe ich seit einem Tag.
2023.04.16;10:15:00;AI Doktor; Okay, basierend auf Ihren Beschwerden und Ihren Symptomen schließe ich eine Magenverstimmung aus. Ich schlage vor, dass Sie Ihre Ernährung überprüfen und überprüfen, ob Sie sensibel auf bestimmte Nahrungsmittel reagieren. Es kann auch sein, dass Sie versucht haben, zu viel zu essen oder schnell zu essen, was zu Magenschmerzen oder Unwohlsein führen kann. Es ist auch möglich, dass Sie ein Magengeschwür haben. Wenn Ihre Symptome nicht innerhalb einiger Tage verschwinden, schlage ich vor, einen Arzt aufzusuchen, damit Sie in Bezug auf Ihre Magenschmerzen eine gute Diagnose erhalten und Sie die richtige Behandlung erhalten.
2023.04.16;10:15:43;User;Vielen Dank.
2023.04.16;10:15:45;AI Doktor; Keine Ursache. Bitte lassen Sie mich wissen, wenn noch etwas ist, das ich für Sie tun kann.
2023.04.16;10:16:00;User;Nein, vielen Dank.
2023.04.16;10:16:01;AI Doktor; In Ordnung! Passen Sie gut auf sich auf und machen Sie einen Arzttermin auf, wenn es weiterhin Probleme gibt. Alles Gute!