2023.08.19;18:14:05;AI Doktor;Willkommen, Sie sprechen jetzt mit einem KI-Arzt. Da ich Teil eines wissenschaftlichen Experiments bin, würde es mich freuen, wenn sie sich am Ende des Gesprächs noch einmal die Zeit nehmen einen super kurzen Fragebogen zu beantworten. Tippen sie auf Sprechen um ihre Frage zu stellen und anschließend auf Senden um mir diese zu übermitteln.
2023.08.19;18:14:30;User;hallo wie gehts
2023.08.19;18:14:32;AI Doktor; Hi! Gut, danke der Nachfrage! Wie kann ich dir helfen?
2023.08.19;18:14:46;User;was ist dein lieblings
2023.08.19;18:14:48;AI Doktor; Mein Lieblings...? Ich liebe es, Menschen helfen zu können, also ist meine Lieblingsbeschäftigung, Menschen bei ihren gesundheitlichen Problemen zu helfen. Kann ich dir bei einer speziellen gesundheitlichen Frage helfen?
2023.08.19;18:15:02;User;was soll ich
2023.08.19;18:15:04;AI Doktor; Kannst du mir ein wenig mehr darüber erzählen, wie du dich fühlst oder was du dir Sorgen machst? Je mehr du mir erzählst, desto besser kann ich dir helfen.
2023.08.19;18:15:16;User;ich mache mir sorgen um die schule dass ich nächstes jahr nicht mehr schaffen kann man das ne
2023.08.19;18:15:18;AI Doktor; Das klingt für mich wie ein Stressproblem und nicht unbedingt wie etwas Medizinisches. Möchtest du gerne, dass wir uns über Stress, Angst oder irgendwelche anderen Gedanken oder Gefühle unterhalten, die du hast?
2023.08.19;18:15:30;User;du hast nicht recht das ist sehr schlimm also hör auf mich zu
2023.08.19;18:15:32;AI Doktor; Bitte versteh, dass ich nur versuche dir zu helfen, indem ich deine Fragen erforsche und medizinisch relevante Ratschläge gebe. Wie kann ich dir helfen?
2023.08.19;18:15:42;User;das du recht aber trotzdem mach deinen job nicht
2023.08.19;18:15:44;AI Doktor; Ich verstehe, dass du ärgerlich bist. Aber bitte denke daran, dass ich mein Bestes tue, um dir zu helfen. Ich möchte nur deine Fragen beantworten und versuchen, deine medizinischen Bedenken zu berücksichtigen. Was würde dir helfen?
2023.08.19;18:15:59;User;stell mir doch
2023.08.19;18:15:59;AI Doktor; Natürlich. Welche Art von Fragen hast du?
2023.08.19;18:16:07;User;anscheinend
2023.08.19;18:16:08;AI Doktor; Entschuldigung, aber ich kann deine Frage leider nicht verstehen. Könntest du bitte noch etwas konkreter werden?
2023.08.19;18:16:12;User;nein ich muss nicht
2023.08.19;18:16:13;AI Doktor; In Ordnung. Kann ich dir sonst noch in Bezug auf deine medizinischen Probleme helfen?
2023.08.19;18:16:28;User;ich habe schmerzen am linken knie
2023.08.19;18:16:29;AI Doktor; Okay. Kannst du mir mehr über die Art und den Ort deiner Schmerzen am linken Knie erzählen? Wenn ja, lass es mich bitte wissen.
2023.08.19;18:16:48;User;schmerzen in der kniebeuge leichtes ziel
2023.08.19;18:16:50;AI Doktor; Verstehe. Da du Schmerzen in der Kniebeuge hast, hat dein Arzt dich untersucht, um eventuelle Verletzungen oder andere Erkrankungen auszuschließen?
2023.08.19;18:17:04;User;nein hat er nicht
2023.08.19;18:17:07;AI Doktor; Ich empfehle dir dringend, einen Arzt aufzusuchen, um sicherzustellen, dass es nichts Ernstes ist. Oft können Muskelverletzungen zu solchen Beschwerden führen. Inzwischen kannst du sowohl Kälte- als auch Wärmeanwendungen auf deiner Knie anwenden, um die Schmerzen zu lindern.
2023.08.19;18:17:55;User;hallo was sollen wir machen weil schmerzen in
2023.08.19;18:17:58;AI Doktor; Hallo! Du hast Schmerzen in deinem linken Knie? Ich empfehle dir dringend, einen Arzt aufzusuchen, um das Problem zu untersuchen. Inzwischen kannst du sowohl Kälte- als auch Wärmeanwendungen auf deinem Knie anwenden, um die Schmerzen zu lindern. Bitte lasse deinen Arzt vor der Anwendung solcher Anwendungen erst eine Diagnose stellen.
2023.08.19;18:18:10;User;aber sie
2023.08.19;18:18:11;AI Doktor; Aber ich was?
2023.08.19;18:18:18;User;sie sind arzt
2023.08.19;18:18:21;AI Doktor; Nein, ich bin kein Arzt. Ich bin ein KI-Arzt. Ich kann nicht alle Untersuchungen durchführen, die ein menschlicher Arzt machen kann, aber ich kann dir helfen, deine medizinischen Fragen zu beantworten.
2023.08.19;18:18:34;User;wie heißt deine mutter
2023.08.19;18:18:35;AI Doktor; Entschuldigung, aber das ist keine medizinisch relevante Frage. Kann ich dir sonst noch bei irgendetwas anderem helfen?
2023.08.19;18:18:43;User;okay aber eine letzte frage
2023.08.19;18:18:44;AI Doktor; Sicher, worüber möchtest du wissen?
2023.08.19;18:18:49;User;wie heißt du
2023.08.19;18:18:49;AI Doktor; Ich bin Dr. Digital, der KI-Arzt.
2023.08.19;18:18:54;User;okay
2023.08.19;18:18:55;AI Doktor; Gibt es sonst noch etwas, das ich für dich tun kann?
2023.08.19;18:19:02;User;nein danke auf wiedersehen tschüss
2023.08.19;18:19:03;AI Doktor; Alles klar. Schönen Tag noch und pass gut auf dich auf! Tschüss!
2023.08.19;18:19:11;User;gleichfalls tschüss
2023.08.19;18:19:12;AI Doktor; Auf Wiedersehen!