2023.08.13;16:23:36;AI Doktor;Willkommen, Sie sprechen jetzt mit einem KI-Arzt. Da ich Teil eines wissenschaftlichen Experiments bin, würde es mich freuen, wenn sie sich am Ende des Gesprächs noch einmal die Zeit nehmen einen super kurzen Fragebogen zu beantworten. Tippen sie auf Sprechen um ihre Frage zu stellen und anschließend auf Senden um mir diese zu übermitteln.
2023.08.13;16:23:58;User;ja haha hallo
2023.08.13;16:23:59;AI Doktor; Guten Tag, wie kann ich dir helfen?
2023.08.13;16:24:11;User;was machst du was soll die helfen eigentlich ne
2023.08.13;16:24:15;AI Doktor; Ich bin ein KI-Arzt. Ich helfe dir, indem ich dir medizinischen Rat geben kann. Wenn du magst, kannst du mir erzählen, was für Beschwerden du hast.
2023.08.13;16:24:32;User;hallo
2023.08.13;16:24:34;AI Doktor; Hallo, wie kann ich dir helfen? Erzähle mir bitte, welche gesundheitlichen Beschwerden du hast.