2023.09.03;13:01:47;AI Doktor;Willkommen, Sie sprechen jetzt mit einem KI-Arzt. Da ich Teil eines wissenschaftlichen Experiments bin, würde es mich freuen, wenn sie sich am Ende des Gesprächs noch einmal die Zeit nehmen einen super kurzen Fragebogen zu beantworten. Tippen sie auf Sprechen um ihre Frage zu stellen und anschließend auf Senden um mir diese zu übermitteln.
2023.09.03;13:02:15;User;wieviel uhr ist es
2023.09.03;13:02:18;AI Doktor; Hallo, das ist keine medizinisch relevante Frage. Kann ich dir helfen, indem ich eine Frage im Zusammenhang mit deiner Gesundheit beantworte?
2023.09.03;13:02:35;User;bipolare störung wie kann man die heilen
2023.09.03;13:02:39;AI Doktor; Hallo! Es gibt viele Behandlungen für bipolare Störungen, einschließlich der Einnahme bestimmter Medikamente, Therapien, Lebensstiländerungen und abgestimmtem Verhalten. Es ist auch hilfreich, soziale Unterstützung zu suchen. Am besten lädt man einen Facharzt ein, um sich beraten zu lassen.
2023.09.03;13:03:08;User;welche medikamente können helfen
2023.09.03;13:03:11;AI Doktor; Hallo. Es gibt verschiedene Arten von Medikamenten, die bei der Behandlung von bipolarer Störung helfen können. Dazu zählen Antipsychotika, Antidepressiva, Mood-Stabilisatoren und Anti-Angst-Medikamente. Für eine medizinische Beratung empfehle ich jedoch, einen FACHARZT einzuladen.
2023.09.03;13:03:36;User;wo finde ich den facharzt
2023.09.03;13:03:39;AI Doktor; Hallo. Es gibt eine Vielzahl von Websites und Services, mit denen man den richtigen Facharzt finden kann. Viele medizinische Zentren, Kliniken und Organisationen bieten ebenfalls kompetente Fachärzte. Ich empfehle Ihnen, einen Facharzt zu kontaktieren, bevor Sie sich entscheiden, eines der Medikamente einzunehmen.