2023.07.03;13:00:27;AI Doktor;Willkommen, Sie sprechen jetzt mit einem KI-Arzt. Da ich Teil eines wissenschaftlichen Experiments bin, würde es mich freuen, wenn sie sich am Ende des Gesprächs noch einmal die Zeit nehmen einen super kurzen Fragebogen zu beantworten. Tippen sie auf Sprechen um ihre Frage zu stellen und anschließend auf Senden um mir diese zu übermitteln.
2023.07.03;13:00:55;User;mir geht es aktuell nicht gut
2023.07.03;13:00:58;AI Doktor;Können Sie mir bitte ein paar Details geben? Welche Symptome haben Sie?
2023.07.03;13:01:14;User;niedergeschlagenheit müdigkeit und traurigkeit
2023.07.03;13:01:31;AI Doktor;Es klingt, als hätten Sie Anzeichen einer Depression. Wenn Sie möchten, kann ich Ihnen helfen, einen spezialisierten Arzt zu finden, der sich mit psychischen Krankheiten auskennt. Oder ich kann Ihnen helfen, einige sinnvolle selbstlindernde Behandlungen zu finden. Was möchten Sie als nächstes tun?
2023.07.03;13:02:02;User;Ich möchte gerne mehr erfahren über die selbst lindernden Behandlungen.
2023.07.03;13:02:20;AI Doktor;Natürlich. Es gibt eine Reihe von selbst lindernden Behandlungen, von der psychischen und der körperlichen Gesundheit. Zu den psychischen Behandlungen gehören Exposition, Tagebuchschreiben, positive Selbstgespräche, kognitive Verhaltenstherapie und Meditation. Physische Behandlungen zur Linderung deiner Symptome können Sport, Regelmäßigkeit, gesunde Ernährung und natürliche Supplements sein. Gibt es etwas, das Sie gerne ausprobieren möchten?
2023.07.03;13:03:00;User;Ja, gerne natürliche Supplemente.
2023.07.03;13:03:17;AI Doktor;Natürliche Supplemente können für einige Menschen sehr hilfreich sein. Es ist jedoch immer ratsam, sich an einen Arzt zu wenden, bevor man eine bestimmte Art von Supplement einnimmt. Möglicherweise können Ihnen einige Vitamine und Mineralstoffe helfen, sich besser zu fühlen. Ich kann Ihnen einige Empfehlungen geben, welche Arten von Supplementen gut für Sie sind. Oder möchten Sie vielleicht noch einmal über die Psychotherapieoptionen sprechen?
2023.07.03;13:04:11;User;Geben Sie mir bitte eine Empfehlung für natürlich, welche Arten von Supplementen?
2023.07.03;13:04:27;AI Doktor;Natürlich. Zu den Supplementen, die Menschen mit Depressionen erfolgreich einnehmen können, gehören Vitamin B12, Folsäure und Omega-3-Fettsäuren. Vitamin B12 hilft, die Symptome der Müdigkeit und des Niedergeschlagenheitsgefühls zu lindern, während Folsäure und Omega-3-Fettsäuren dazu beitragen, den Stress zu lösen. Möchten Sie weitere Informationen, bevor Sie eine Entscheidung treffen, oder möchten Sie lieber einen Arzt konsultieren?