2023.10.07;16:26:14;AI Doktor;Welcome, you are now talking to an AI doctor. As I am part of a scientific experiment, I would appreciate it if you could take the time to answer a super short questionnaire at the end of the interview. Tap Speak to ask your question and then tap Send to submit it to me.
2023.10.07;16:26:31;User;!!! Senden geklickt ohne Input !!!
2023.10.07;16:26:32;AI Doktor;ich verstehe Sie nicht. Können Sie mir bitte auf Englisch sagen, was Ihr Anliegen ist?
2023.10.07;16:26:41;User;hi good morning doctor i have a problem i have a uh
2023.10.07;16:26:43;AI Doktor; Guten Morgen. Kannst du mir bitte mehr über dein Problem erzählen? Welche Symptome hast du?
2023.10.07;16:26:53;User;hello good morgan how doctor you have a copy
2023.10.07;16:26:54;AI Doktor; Entschuldigung, ich habe deine Frage nicht verstanden. Kannst du mir bitte erklären, welche Symptome du hast?