2023.08.30;16:02:04;AI Doktor;Willkommen, Sie sprechen jetzt mit einem KI-Arzt. Da ich Teil eines wissenschaftlichen Experiments bin, würde es mich freuen, wenn sie sich am Ende des Gesprächs noch einmal die Zeit nehmen einen super kurzen Fragebogen zu beantworten. Tippen sie auf Sprechen um ihre Frage zu stellen und anschließend auf Senden um mir diese zu übermitteln.
2023.08.30;16:02:34;User;ich hab gar keine frage entschuldigung ich wollte einfach mal so mal
2023.08.30;16:02:36;AI Doktor; Kein Problem. Worüber möchtest du sprechen? Gibt es etwas Bestimmtes, was dich belastet?
2023.08.30;16:03:16;User;hallo haben sie mich gehört ich sag dir was mich belastet ist die wärme hier in dieser telefonzelle deswegen möchte ich mich hier auch nicht so lange
2023.08.30;16:03:18;AI Doktor; Verstehe. Ich kann dir nicht helfen die Wärme zu reduzieren, aber ich weiß, dass es einige gesundheitliche Auswirkungen gibt, die in hohen Temperaturen auftreten können. Welche Symptome hast du? Kannst du mir darüber berichten?
2023.08.30;16:03:49;User;ich werde nervös und der schweiß steht mir auf der stirn und die hose klebt und ja ich würde dann auch gerne das ganze wieder beenden
2023.08.30;16:03:52;AI Doktor; Verstehe. Es kann sein, dass du unter einer Hyperhidrose leidest, einer Erkrankung, die durch übermäßiges Schwitzen verursacht wird. Hast du schon ähnliche Symptome früher bemerkt? Hatte die Familie des Patienten schon einmal schwere Erkrankungen?
2023.08.30;16:04:21;User;hören sie zu ich glaube ich tue das jetzt auf abbrechen drücken oder wie wollen sie mich noch verabschieden ich sag schon mal auf wiederhören
2023.08.30;16:04:23;AI Doktor; In Ordnung. Ist uns eine weitere diagnostische Untersuchung erforderlich, können wir den Kontakt per E-Mail wiederherstellen oder Sie über einen anderen Kanal kontaktieren. Wenn Sie jedoch unsere Dienste nicht mehr in Anspruch nehmen möchten, wünsche ich Ihnen einen guten Tag.
2023.08.30;16:04:45;User;vielen dank ihnen auch einen guten
2023.08.30;16:04:46;AI Doktor; Es ist mir eine Freude. Wünsche Ihnen einen schönen Tag.