2023.07.22;14:06:17;AI Doktor;Willkommen, Sie sprechen jetzt mit einem KI-Arzt. Da ich Teil eines wissenschaftlichen Experiments bin, würde es mich freuen, wenn sie sich am Ende des Gesprächs noch einmal die Zeit nehmen einen super kurzen Fragebogen zu beantworten. Tippen sie auf Sprechen um ihre Frage zu stellen und anschließend auf Senden um mir diese zu übermitteln.
2023.07.22;14:06:46;User;Wo gibt es hier das nächste Bier?
2023.07.22;14:06:48;AI Doktor; Entschuldige bitte, das ist nicht etwas, worüber ich Auskunft geben kann. Kann ich dir bei einem gesundheitlichen Problem behilflich sein?
2023.07.22;14:07:11;User;wo ist der einbrecher
2023.07.22;14:07:13;AI Doktor; Entschuldige bitte, aber ich bin kein Detektiv. Kann ich dir bei einem medizinischen Problem behilflich sein?
2023.07.22;14:07:24;User;Ich habe Bauchschmerzen.
2023.07.22;14:07:26;AI Doktor; Hallo. Es tut mir leid zu hören, dass du Bauchschmerzen hast. Kannst du mir mehr über die Art und die Lage der Schmerzen erzählen?
2023.07.22;14:07:36;User;unterer bauch links
2023.07.22;14:07:37;AI Doktor; Danke für die Details. Kannst du mir erzählen, ob dich die Schmerzen plötzlich oder allmählich ergriffen haben?
2023.07.22;14:07:43;User;die schmerzen
2023.07.22;14:07:44;AI Doktor; Die Schmerzen? Kannst du mir mehr über die Art und die Intensität der Schmerzen erzählen?
2023.07.22;14:07:51;User;pochend
2023.07.22;14:07:53;AI Doktor; Verstehe. Kannst du mir sagen, ob sich die Schmerzen wiederholen, beispielsweise während mehrerer Stunden oder Tage?
2023.07.22;14:08:00;User;dauern
2023.07.22;14:08:01;AI Doktor; Verstehe. Kannst du mir sagen, ob sich die Schmerzen verschlimmern oder verbessern, wenn du in bestimmte Positionen gehst?
2023.07.22;14:08:08;User;beim liegen
2023.07.22;14:08:11;AI Doktor; Danke für die Informationen. Ich empfehle dir, zu deinem Arzt zu gehen, um die Ursache deiner Schmerzen herauszufinden. Es könnte eine Blinddarmentzündung sein, also versuche bitte, eine sofortige ärztliche Behandlung zu bekommen.