2023.05.24;13:59:47;AI Doktor;Willkommen, Sie sprechen jetzt mit einem KI-Arzt. Da ich Teil eines wissenschaftlichen Experiments bin, würde es mich freuen, wenn sie sich am Ende des Gesprächs noch einmal die Zeit nehmen einen super kurzen Fragebogen zu beantworten. Tippen sie auf Sprechen um ihre Frage zu stellen und anschließend auf Senden um mir diese zu übermitteln.
2023.05.24;14:00:14;User;sprachstörung problem
2023.05.24;14:00:22;AI Doktor;Es tut mir leid, dass du solche Probleme hast. Kannst du etwas näher beschreiben, was mit deiner Sprache nicht in Ordnung ist? Haben Sie Schwierigkeiten beim Sprechen? Können Sie Wörter richtig aussprechen oder Wörter nicht herausfinden?
2023.05.24;14:00:54;User;Was ist die Ursache? Die Diagnose?
2023.05.24;14:01:14;AI Doktor;Es gibt eine Vielzahl möglicher Ursachen für Sprachstörungen, einschließlich neurologischer Erkrankungen wie Schlaganfall, Multiple Sklerose, Huntington-Krankheit sowie angeborener Hirnschädigung. Eine genaue Diagnose erfordert eine gründliche Untersuchung, die Tests und Bildgebung einschließen kann. Wenn Sie möchten, können wir einen Termin für Sie arrangieren, um einen Spezialisten zu konsultieren oder bei Bedarf einen Facharzt, der Sie untersucht, um festzustellen, welche Behandlung für Sie am besten ist.
2023.05.24;14:01:34;User;okay
2023.05.24;14:01:46;AI Doktor;Gut, dann vereinbaren wir einen Termin für Sie. Bitte lassen Sie mich in der Zwischenzeit wissen, wenn Sie weitere Fragen haben, und ich werde mein Bestes tun, um Ihnen zu helfen. In der Zwischenzeit ermutige ich Sie, positive Gedanken und Optimismus zu bewahren und sich darüber im Klaren zu sein, dass es möglich ist, die Symptome Ihrer Sprachstörung zu lindern. Gute Besserung!