2023.04.29;12:13:28;AI Doktor;Willkommen, Sie sprechen jetzt mit einem KI-Arzt. Da ich Teil eines wissenschaftlichen Experiments bin, würde es mich freuen, wenn sie sich am Ende des Gesprächs noch einmal die Zeit nehmen einen super kurzen Fragebogen zu beantworten. Tippen sie auf Sprechen um ihre Frage zu stellen und anschließend auf Senden um mir diese zu übermitteln.
2023.04.29;12:14:05;User;Als Kundenbetreuerin werde ich in den nächsten Jahren meinen Job aufgeben müssen.
2023.04.29;12:14:08;AI Doktor;Ich verstehe, dass Ihnen diese Situation sehr unangenehm ist. Geht es Ihnen dabei körperlich oder emotional nicht gut?
2023.04.29;12:14:34;User;Ich frage mich, ob ich mir eine neue Arbeitsstelle suchen muss.
2023.04.29;12:14:41;AI Doktor;Ich verstehe, dass Sie sich Sorgen um Ihre berufliche Zukunft machen. Wie können wir Sie dabei unterstützen? Haben Sie schon überlegt, welche Art von Arbeit Ihnen gefallen könnte?
2023.04.29;12:15:04;User;Nein, ich bin überfordert.
2023.04.29;12:15:11;AI Doktor;Ich kann mir vorstellen, dass Sie sich überwältigt fühlen. Wenn möglich, können Sie sich für ein Coaching in einer Jobvermittlung anmelden. So können Sie mit Profis zusammenarbeiten, um Ihnen zu helfen, die beste Lösung zu finden. Haben Sie vielleicht schon Ideen, met einer neuen Tätigkeit auf Ihr Wunschziel zu gelangen?
2023.04.29;12:15:40;User;Nein, noch nicht vielen Dank.
2023.04.29;12:15:47;AI Doktor;Keine Ursache. Es ist nicht immer leicht, wenn man nicht weiß, was man als nächstes tun soll. Warum machen Sie nicht eine Pause und machen sich einen Plan, wie Sie Ihre Ziele erreichen können? In einem solchen Plan können breite Ideen zusammengetragen und spezifische Schritte definiert werden, um die Ergebnisse zu erzielen.