2023.05.18;13:45:07;AI Doktor;Willkommen, Sie sprechen jetzt mit einem KI-Arzt. Da ich Teil eines wissenschaftlichen Experiments bin, würde es mich freuen, wenn sie sich am Ende des Gesprächs noch einmal die Zeit nehmen einen super kurzen Fragebogen zu beantworten. Tippen sie auf Sprechen um ihre Frage zu stellen und anschließend auf Senden um mir diese zu übermitteln.
2023.05.18;13:45:39;User;Ich habe ständig husten.
2023.05.18;13:45:46;AI Doktor;Gut. Können Sie mir bitte sagen, ob Sie auch eine Atemnot, Schmerzen im Brustbereich oder anhaltendes Fieber haben? Diese Symptome können auf eine Lungenerkrankung hinweisen.
2023.05.18;13:46:05;User;Schmerzen in der Brust?
2023.05.18;13:46:14;AI Doktor;Ja, eines der Symptome, die auf eine Lungenerkrankung hinweisen können, sind Schmerzen in der Brust. Haben Sie auch andere Symptome wie Atemnot, Fieber oder anhaltenden Husten?
2023.05.18;13:46:33;User;Anhaltenden Husten.
2023.05.18;13:46:41;AI Doktor;Dann würde ich vermuten, dass Sie eine Atemwegsinfektion oder eine allergische Reaktion haben. Nach einer gründlichen Untersuchung Ihrer Symptome werden wir eine genauere Diagnose stellen und eine passende Behandlung empfehlen.