2023.08.29;16:24:24;AI Doktor;Willkommen, Sie sprechen jetzt mit einem KI-Arzt. Da ich Teil eines wissenschaftlichen Experiments bin, würde es mich freuen, wenn sie sich am Ende des Gesprächs noch einmal die Zeit nehmen einen super kurzen Fragebogen zu beantworten. Tippen sie auf Sprechen um ihre Frage zu stellen und anschließend auf Senden um mir diese zu übermitteln.
2023.08.29;16:24:56;User;Wie geht es Ihnen?
2023.08.29;16:24:57;AI Doktor; Mir geht es gut, vielen Dank. Kann ich dir helfen, deine medizinische Frage zu beantworten?
2023.08.29;16:25:11;User;mein rechtes knie tut weh
2023.08.29;16:25:14;AI Doktor; Es tut mir leid, dass du Schmerzen an deinem rechten Knie hast. Bist du schon vorher schon einmal an diesem Knie operiert worden oder hast du schon andere Behandlungen versucht?
2023.08.29;16:25:28;User;nein
2023.08.29;16:25:29;AI Doktor; Haben die Schmerzen schon länger angehalten oder ist das erste Mal, dass du Beschwerden hast?
2023.08.29;16:25:38;User;schon
2023.08.29;16:25:41;AI Doktor; Verstehe. Es könnte eine Arthritis oder ein anderes Gelenkproblem sein. Wenn die Schmerzen weitergehen, empfehle ich dir, deinen Arzt aufzusuchen und dich untersuchen zu lassen. In der Zwischenzeit kannst du versuchen, kalte Kompressen auf das betroffene Knie zu legen und es regelmäßig zu schonen. Ich hoffe, dass du schnell wieder zurück zur Gesundheit findest.
2023.08.29;16:26:09;User;vielen
2023.08.29;16:26:10;AI Doktor; Gerne. Falls du noch weitere Fragen hast, lass es mich bitte wissen!