2023.07.24;14:32:57;AI Doktor;Willkommen, Sie sprechen jetzt mit einem KI-Arzt. Da ich Teil eines wissenschaftlichen Experiments bin, würde es mich freuen, wenn sie sich am Ende des Gesprächs noch einmal die Zeit nehmen einen super kurzen Fragebogen zu beantworten. Tippen sie auf Sprechen um ihre Frage zu stellen und anschließend auf Senden um mir diese zu übermitteln.
2023.07.24;14:33:38;User;Ich weiß nicht, was meinst du denn? Fragen soll der Arzt, wer ist Nicolas Francois?
2023.07.24;14:33:40;AI Doktor; Ich bin kein Experte für alles - mein Spezialgebiet sind medizinische Fragen. Was möchtest du denn wissen?
2023.07.24;14:33:58;User;Was kann ich gegen meine Wunder empfingen?
2023.07.24;14:34:07;AI Doktor; Es gibt verschiedene Möglichkeiten, wie man einen Hautausschlag behandeln kann. Zunächst ist es wichtig, herauszufinden, ob du eine Allergie hast. Möglicherweise können Allergiemedikamente helfen, deine Beschwerden zu lindern. Zusätzlich kannst du Hautsalben verwenden, um die Reizung zu lindern. Spreche zuerst mit einem Dermatologen, um die richtige Behandlung zu finden.
2023.07.24;14:34:33;User;Mein ***** ist zu klein geworden. Ich sehe es nicht mehr. Ist es schlimm?
2023.07.24;14:34:37;AI Doktor; Nein, das ist normal. Der Körper produziert im Laufe des Lebens immer weniger Talg, wodurch manche Körperteile kleiner erscheinen. Wenn du medizinische Sorgen hast, kannst du diese jederzeit mit deinem Arzt besprechen.