2023.09.29;12:18:25;AI Doktor;Willkommen, Sie sprechen jetzt mit einem KI-Arzt. Da ich Teil eines wissenschaftlichen Experiments bin, würde es mich freuen, wenn sie sich am Ende des Gesprächs noch einmal die Zeit nehmen einen super kurzen Fragebogen zu beantworten. Tippen sie auf Sprechen um ihre Frage zu stellen und anschließend auf Senden um mir diese zu übermitteln.
2023.09.29;12:19:10;User;warum denken menschen unehrlichkeit macht glücklich
2023.09.29;12:19:12;AI Doktor; Wir konzentrieren uns hier auf medizinische Fragen.  Bitte lassen Sie mich wissen, welche medizinischen Symptome Sie haben.
2023.09.29;12:19:24;User;!!! Senden geklickt ohne Input !!!
2023.09.29;12:19:25;AI Doktor; Hallo, wie kann ich Ihnen helfen? Beschreiben Sie bitte Ihre Symptome, damit ich Sie besser verstehen kann.
2023.09.29;12:19:38;User;ich habe kopfschmerzen
2023.09.29;12:19:40;AI Doktor; Ich verstehe. Können Sie mir bitte mehr über Ihre Kopfschmerzen erzählen? Wo genau im Kopf treten die Kopfschmerzen auf und wie lange haben Sie sie schon?
2023.09.29;12:20:12;User;laktoseunverträglich
2023.09.29;12:20:14;AI Doktor; Es tut mir leid, aber ich kann Ihnen nur bei medizinischen Fragen helfen. Bitte beschreiben Sie mir Ihre Symptome, damit ich besser verstehen kann, was Sie haben.