2023.09.27;12:25:15;AI Doktor;Willkommen, Sie sprechen jetzt mit einem KI-Arzt. Da ich Teil eines wissenschaftlichen Experiments bin, würde es mich freuen, wenn sie sich am Ende des Gesprächs noch einmal die Zeit nehmen einen super kurzen Fragebogen zu beantworten. Tippen sie auf Sprechen um ihre Frage zu stellen und anschließend auf Senden um mir diese zu übermitteln.
2023.09.27;12:26:02;User;es ist mir jetzt gerade sehr heiß
2023.09.27;12:26:05;AI Doktor; Alles in Ordnung! Können Sie mir erzählen, woran Sie leiden? Betrifft Ihr aktueller Zustand Ihre Gesundheit? Verstärken Sie sich Symptome oder haben Sie andere Beschwerden?
2023.09.27;12:26:27;User;mir ist es warm
2023.09.27;12:26:28;AI Doktor; Hast du Fieber? Können Sie mir Ihre Temperatur nennen oder näher darauf eingehen? Haben Sie sonst noch ungewöhnliche Symptome?
2023.09.27;12:26:43;User;37
2023.09.27;12:26:46;AI Doktor; Es besteht kein Anlass zur Sorge, da Ihre Temperatur 37 Grad beträgt und somit im normalen Bereich liegt. Haben Sie noch weitere ungewöhnliche Symptome?
2023.09.27;12:27:06;User;!!! Senden geklickt ohne Input !!!
2023.09.27;12:27:08;AI Doktor; Ich kann Ihnen helfen, Ihre Gesundheit zu überprüfen. Können Sie mir bitte Ihre Symptome erzählen?
2023.09.27;12:27:27;User;!!! Senden geklickt ohne Input !!!
2023.09.27;12:27:28;AI Doktor; Bitte erzählen Sie mir, was Sie beunruhigt und ich werde mein Bestes tun, um Ihnen zu helfen.
2023.09.27;12:27:38;User;es geht mir gut
2023.09.27;12:27:41;AI Doktor; Wunderbar! In Anbetracht dessen, dass Sie mir gesagt haben, dass es Ihnen gut geht, dürfen Sie beruhigt sein. Ich bin hier, um Ihnen zu helfen, wenn Sie medizinische Fragen oder Beschwerden haben. Benötigen Sie weitere Hilfe?
2023.09.27;12:28:01;User;!!! Senden geklickt ohne Input !!!
2023.09.27;12:28:02;AI Doktor; Bitte sprechen Sie weiter und geben Sie an, welche Art von Informationen oder Hilfe Sie benötigen. Ich bin hier, um zu helfen.
2023.09.27;12:28:18;User;!!! Senden geklickt ohne Input !!!
2023.09.27;12:28:19;AI Doktor; Können Sie mir bitte einen konkreten Anhaltspunkt geben? Oder geben Sie bitte an, welche Art von Informationen oder Hilfe Sie benötigen. Ich bin hier, um zu helfen.