2023.07.14;14:06:29;AI Doktor;Willkommen, Sie sprechen jetzt mit einem KI-Arzt. Da ich Teil eines wissenschaftlichen Experiments bin, würde es mich freuen, wenn sie sich am Ende des Gesprächs noch einmal die Zeit nehmen einen super kurzen Fragebogen zu beantworten. Tippen sie auf Sprechen um ihre Frage zu stellen und anschließend auf Senden um mir diese zu übermitteln.
2023.07.14;14:07:28;User;Um sich nicht gesundheitlich zu gefährden.
2023.07.14;14:07:29;AI Doktor; Das verstehe ich. Wie kann ich Ihnen helfen?
2023.07.14;14:07:46;User;was kann ich tun wenn es mir gesundheitlich nicht so gut geht wenn es über 30 grad hat
2023.07.14;14:07:52;AI Doktor; Bei Temperaturen über 30 Grad empfehle ich, sich schattig an einem kühlen Ort aufzuhalten. Trinken Sie viel Wasser, um eine Dehydrierung zu vermeiden, und tragen Sie leichte, luftige Kleidung, um sich vor Hitze zu schützen. Falls sich Ihr Zustand verschlimmert, sollten Sie unbedingt einen Arzt aufsuchen.
2023.07.14;14:08:19;User;Wieviel muss man denn trinken?
2023.07.14;14:08:27;AI Doktor; Erwachsene benötigen in der Regel zwischen 2 und 4 Litern Flüssigkeit pro Tag, je nach Aktivität und Klima. Wenn Sie an einem heißen Tag viel unterwegs sind oder Sport treiben, müssen Sie häufiger und größere Mengen trinken. Auch Salz in Form von Speisen und Getränken sollte zugeführt werden, um den Salzverlust durch Schwitzen auszugleichen.
2023.07.14;14:08:59;User;Kann man auch zu viel trinken?
2023.07.14;14:09:08;AI Doktor; Ja, zu viel Wasser zu trinken, ist auch ein ernstes Problem. Wenn Sie zu viel trinken, können sich die Natriumspiegel im Blut senken und dies kann zu schwerwiegenden gesundheitlichen Problemen führen. Deshalb sollten Sie immer versuchen, ein ausgeglichenes Verhältnis zwischen Wasser und anderen Flüssigkeiten wie Tee, Saft und Sportgetränken zu haben.
2023.07.14;14:09:41;User;was darf ich unter einem ausgeglichenen verhältnis verstehen was soll ich da drunter
2023.07.14;14:09:48;AI Doktor; Ein ausgeglichenes Verhältnis zwischen Wasser und anderen Flüssigkeiten bedeutet, dass Sie regelmäßig Flüssigkeiten wie Wasser, Tee, Saft oder Sportgetränke trinken. Generell ist es wichtig, dass Sie im Kardinatenverhältnis mehr Wasser als andere Flüssigkeiten trinken. Es ist auch wichtig, dass Sie mehr trinken, wenn es heiß ist oder wenn Sie mehr Sport treiben.
2023.07.14;14:10:18;User;vielen dank für ihre gute kompetente auskunft
2023.07.14;14:10:23;AI Doktor; Kein Problem. Ich bin froh, helfen zu können. Es ist immer wichtig, sich auszuruhen, Flüssigkeiten zu sich zu nehmen und auf Ihren Körper zu hören. Sollten Sie mehr Informationen oder Rat benötigen, empfehle ich Ihnen, Ihren Arzt aufzusuchen. Geht es Ihnen sonst noch irgendwie nicht gut?
2023.07.14;14:10:47;User;!!! Senden geklickt ohne Input !!!
2023.07.14;14:10:51;AI Doktor; Tut mir leid, das kann ich leider nicht. Ich kann Ihnen jedoch bei allen medizinischen Fragen weiterhelfen. Bitte lassen Sie mich wissen, wie ich Ihnen helfen kann.
2023.07.14;14:11:08;User;vielen dank sie haben mir sehr
2023.07.14;14:11:12;AI Doktor; Es freut mich, dass ich helfen konnte. Bitte zögern Sie nicht, bei weiteren Fragen Kontakt zu mir aufzunehmen. Wünschen Sie sonst noch etwas?
2023.07.14;14:11:28;User;nein das war alles dankeschön
2023.07.14;14:11:30;AI Doktor; In Ordnung. Falls Sie noch Fragen oder Bedenken haben, lassen Sie es mich bitte wissen. Viel Glück und gute Besserung.
2023.07.14;14:11:42;User;!!! Senden geklickt ohne Input !!!
2023.07.14;14:11:44;AI Doktor; Tut mir leid, das kann ich leider nicht. Kann ich Ihnen in irgendeiner anderen Art und Weise helfen?