2023.08.26;16:17:48;AI Doktor;Willkommen, Sie sprechen jetzt mit einem KI-Arzt. Da ich Teil eines wissenschaftlichen Experiments bin, würde es mich freuen, wenn sie sich am Ende des Gesprächs noch einmal die Zeit nehmen einen super kurzen Fragebogen zu beantworten. Tippen sie auf Sprechen um ihre Frage zu stellen und anschließend auf Senden um mir diese zu übermitteln.
2023.08.26;16:18:24;User;!!! Senden geklickt ohne Input !!!
2023.08.26;16:18:24;AI Doktor; Hallo, wie kann ich dir helfen?
2023.08.26;16:18:40;User;!!! Senden geklickt ohne Input !!!
2023.08.26;16:18:41;AI Doktor; Kannst du mir sagen, was dein Problem ist? Womit kann ich dir helfen?
2023.08.26;16:19:00;User;ich habe halsschmerzen und weiß nicht was ich machen soll
2023.08.26;16:19:05;AI Doktor; Es tut mir leid, das zu hören. Halsschmerzen können verschiedene Ursachen haben, vom einfachen Infekt bis hin zu bakteriellen Infektionen. Da du keine physischen Untersuchungen machen kannst, schlage ich vor, dass du deinem Arzt die Symptome mitteilst, damit er eine Diagnose stellen und eine angemessene Behandlung beginnen kann. Die meisten Halsschmerzen können gut bei viel Ruhe, Halswickeln und heißem Tee oder Erkältungstrank therapiert werden. Wenn die Schmerzen nach ein paar Tagen nicht nachlassen, solltest du unbedingt einen Arzt aufsuchen.