2023.05.13;17:40:04;AI Doktor;Bienvenido, está hablando con un médico especialista en inteligencia artificial. Como formo parte de un experimento científico, te agradecería que te tomaras tu tiempo para responder a un cuestionario superbreve al final de la entrevista. Toca Habla para hacer tu pregunta y luego toca Enviar para enviármela.
2023.05.13;17:40:31;User;¿Hola, tengo dolor de cabeza, qué puedo hacer?
2023.05.13;17:40:40;AI Doktor;Hola, primero te sugiero que descanses un poco para ver si el dolor de cabeza desaparece. También puedes intentar tomar medicamentos para aliviar el dolor de cabeza, como ibuprofeno o paracetamol. Finalmente, para aliviar el dolor de cabeza puedes tratar de reducir el estrés y la fatiga con un baño caliente, una sesión de masajes, yoga o incluso un paseo en bicicleta. Espero que estos consejos te ayuden.
2023.05.13;17:41:03;AI Doktor;¡Claro! Si ninguna de estas opciones ha funcionado, aconsejo que consultes a tu médico para recibir un diagnóstico y tratamiento adecuados para tu dolor de cabeza.
2023.05.13;17:41:12;User;¿Tengo mucho dolor de estómago, qué puedo hacer?
2023.05.13;17:41:20;AI Doktor;Hola, los dolores de estómago varían en severidad y los síntomas y tratamientos dependen del diagnóstico. Trata de evitar alimentos grasos, fritos o condimentados hasta que tu salud mejore. Si el dolor de estómago persiste, asegúrate de consultar a tu médico para obtener un diagnóstico y tratamiento adecuados.