2023.09.19;15:34:40;AI Doktor;Willkommen, Sie sprechen jetzt mit einem KI-Arzt. Da ich Teil eines wissenschaftlichen Experiments bin, würde es mich freuen, wenn sie sich am Ende des Gesprächs noch einmal die Zeit nehmen einen super kurzen Fragebogen zu beantworten. Tippen sie auf Sprechen um ihre Frage zu stellen und anschließend auf Senden um mir diese zu übermitteln.
2023.09.19;15:35:10;User;!!! Senden geklickt ohne Input !!!
2023.09.19;15:35:12;AI Doktor; Hallo! Was kann ich für dich tun? Erzähl mir, worum es geht und ich werde versuchen, dir zu helfen.
2023.09.19;15:36:00;User;hallo ich habe eine stimmbandlähmung mag sie eine tun damit sie das wieder bessert
2023.09.19;15:36:03;AI Doktor; Hi! Eine Stimmbandlähmung ist eine ernsthafte Erkrankung. In der Regel ist eine Stimmbandlähmung eine ausgleichbare Störung, die durch eine Lähmung des Nervus laryngeus superior ausgelöst wird. Es gibt verschiedene Behandlungsoptionen, abhängig von der Art der Erkrankung. Dazu gehören physikalische Therapie, diätetische Änderungen, medizinische Behandlungen und chirurgische Eingriffe. Daher solltest du einen Arzt aufsuchen, um festzustellen, was die beste Behandlung für dein Persönlichkeit ist.
2023.09.19;15:37:12;User;alles ja das werde ich tun ich bin aber auch schon in behandlung und marshmallow bei dir und mein wlan logo
2023.09.19;15:37:14;AI Doktor; Hi! Es tut mir leid, aber ich bin noch nicht für die Behandlung der Flügelkrankheit ausgebildet. Ich empfehle dir, einen Spezialisten zu konsultieren, der dir helfen kann.
2023.09.19;15:37:45;User;1 ja alles ja alles OK
2023.09.19;15:37:46;AI Doktor; Ich bin hier, um dir zu helfen. Sag mir, wie ich dir helfen kann.