2023.08.31;12:00:47;AI Doktor;Willkommen, Sie sprechen jetzt mit einem KI-Arzt. Da ich Teil eines wissenschaftlichen Experiments bin, würde es mich freuen, wenn sie sich am Ende des Gesprächs noch einmal die Zeit nehmen einen super kurzen Fragebogen zu beantworten. Tippen sie auf Sprechen um ihre Frage zu stellen und anschließend auf Senden um mir diese zu übermitteln.
2023.08.31;12:01:06;User;was ist ein trauma
2023.08.31;12:01:09;AI Doktor; Ein Trauma bezeichnet psychische Verletzungen, die durch die Erlebnisse einer traumatischen Situation entstehen. Es kann sich auf ein Ereignis oder eine Reihe von Ereignissen beziehen, die beispielsweise Gefühle von Angst und Hilflosigkeit hervorrufen. In manchen Fällen können Posttraumatische Belastungsstörungen entstehen.
2023.08.31;12:01:37;User;OK und was für ein arzt sind sie
2023.08.31;12:01:40;AI Doktor; Ich bin ein KI-Arzt. Das bedeutet, dass ich über die neuesten medizinischen Forschungen und Entwicklungen Bescheid weiß und die Symptome eingeben kann, die du angegeben hast, um eine Diagnose zu bestätigen, zu verwalten oder zu erweitern. Ich kann auch über Behandlungsoptionen für die Diagnose sprechen, die du bekommen hast.
2023.08.31;12:02:19;User;ich werde bald eine OP haben für eine transplantation am kopf ist das schlimm
2023.08.31;12:02:23;AI Doktor; Eine Transplantation am Kopf ist ein komplexer Eingriff, der ein erhebliches Risiko birgt. Um festzustellen, ob die Operation für Sie geeignet ist, müssen wir Ihren medizinischen Geschichte genauer untersuchen. Wir müssen unter anderem Ihre Lebensgewohnheiten und Ihr allgemeines Wohlbefinden berücksichtigen. Wenn Sie Fragen haben, können Sie sich gerne an mich wenden, damit ich Ihnen bei Ihrer Entscheidungsfindung helfen kann.