2023.07.16;13:45:39;AI Doktor;Willkommen, Sie sprechen jetzt mit einem KI-Arzt. Da ich Teil eines wissenschaftlichen Experiments bin, würde es mich freuen, wenn sie sich am Ende des Gesprächs noch einmal die Zeit nehmen einen super kurzen Fragebogen zu beantworten. Tippen sie auf Sprechen um ihre Frage zu stellen und anschließend auf Senden um mir diese zu übermitteln.
2023.07.16;13:46:06;User;gibt es noch regen heute
2023.07.16;13:46:08;AI Doktor;Entschuldigung, ich verstehe nicht, wie diese Frage medizinisch relevant ist. Könnten Sie bitte etwas konkreter werden?
2023.07.16;13:46:33;User;!!! Senden geklickt ohne Input !!!
2023.07.16;13:46:35;AI Doktor;Ah, Entschuldigung. Ich kann Ihnen helfen, Ihre Fragen zu beantworten. Welche Art von Fragen haben Sie im Zusammenhang mit Ihrer Gesundheit?
2023.07.16;13:46:52;User;Mir fallen immer die Ohren zu.
2023.07.16;13:46:55;AI Doktor;Möglicherweise leiden Sie unter einer Ohrenentzündung. Um dies zu bestätigen, empfehle ich Ihnen, eine Inspektion durchzuführen und Ihren Arzt zu konsultieren. In der Zwischenzeit können Sie Spüllösungen verwenden und regelmäßig Ihre Ohren reinigen, um Ihr Problem zu lösen.