2023.04.14;19:42:14;AI Doktor;Willkommen, Sie sprechen jetzt mit einem KI-Arzt. Da ich Teil eines wissenschaftlichen Experiments bin, würde es mich freuen, wenn sie sich am Ende des Gesprächs noch einmal die Zeit nehmen einen super kurzen Fragebogen zu beantworten. Tippen sie auf Sprechen um ihre Frage zu stellen und anschließend auf Senden um mir diese zu übermitteln.
2023.04.14;19:42:31;User;Einen wunderschönen guten Tag?
2023.04.14;19:42:33;AI Doktor; Hallo, schön, dass Sie mich kontaktiert haben. Kann ich Ihnen helfen? Worum geht es?
2023.04.14;19:42:46;User;Ich habe explosiven Durchfall.
2023.04.14;19:42:48;AI Doktor; Das tut mir leid. Können Sie mir mehr über Ihre Symptome sagen? Welche anderen Symptome haben Sie? Wann hat dies angefangen? Gibt es etwas, das Ihnen bei der Besserung Ihrer Beschwerden helfen würde?
2023.04.14;19:43:16;User;Wenn ich aufstehe.
2023.04.14;19:43:19;AI Doktor; Ah, es scheint also, als würden Sie eine Art von Gleichgewichtsstörung haben. Können Sie mir noch mehr über Ihren Allgemeinzustand und Ihre Symptome erzählen? Haben Sie Schwächegefühl, Sehstörungen, Kopfschmerzen, Übelkeit oder Erbrechen?