2023.04.22;10:42:16;AI Doktor;Willkommen, Sie sprechen jetzt mit einem KI-Arzt. Da ich Teil eines wissenschaftlichen Experiments bin, würde es mich freuen, wenn sie sich am Ende des Gesprächs noch einmal die Zeit nehmen einen super kurzen Fragebogen zu beantworten. Tippen sie auf Sprechen um ihre Frage zu stellen und anschließend auf Senden um mir diese zu übermitteln.
2023.04.22;10:42:50;User;Was kann ich gegen meine andauernden Nackenschmerzen tun? Es knistert und kracht bei jeder Bewegung.
2023.04.22;10:42:56;AI Doktor;Oh, das tut mir leid zu hören. Es könnte eine Muskelverspannung sein, aber es könnte auch eine schwerwiegendere Erkrankung sein. Ich würde empfehlen, sich bei einem Physiotherapeuten vor Ort untersuchen zu lassen. Es ist normalerweise am besten, ärztliche Behandlung aufzusuchen, wenn man sich nicht sicher ist, woher die Schmerzen kommen.
2023.04.22;10:43:34;User;Es knistert ebenso komisch muss ich da was machen?
2023.04.22;10:43:41;AI Doktor;Das Knistern könnte auch auf eine Muskelverspannung oder eine ernsthafte Erkrankung hinweisen. Der beste Ratschlag, den ich geben kann, ist, sich einer Vorsorgeuntersuchung zu unterziehen, um sicherzustellen, dass nichts Ernstes vorliegt. Wenn es sich wirklich um eine Muskelverspannung handelt, kann Ihnen ein Physiotherapeut helfen, sie zu lösen. Bei ernsthaften Erkrankungen kann Ihr Arzt eine Krankheitsdiagnose stellen und Ihnen mögliche Behandlungsalternativen aufzeigen.
2023.04.22;10:44:02;User;wie kann ich mit dem parkinson meiner mutter umgehen
2023.04.22;10:44:14;AI Doktor;Es tut mir leid, das zu hören. Parkinson ist eine chronische und progressiv verlaufende Erkrankung und es ist wichtig, dass sie sich professioneller beratung unterzieht. Da es sich bei Parkinson um eine komplexe Erkrankung handelt, gibt es keine einheitliche Behandlungsstrategie, und Ihre Mutter muss sich einer Behandlung unterziehen, die auf ihren individuellen Bedürfnissen basiert. In den meisten Fällen werden Medikamente verschrieben, aber es gibt auch andere nicht medikamentöse Behandlungsmöglichkeiten, die Ihre Mutter in Betracht ziehen sollte. Sie sollten auch überlegen, wie Sie Ihre Mutter zu Hause unterstützen können, und sicherstellen, dass ihr Zuhause möglichst ungefährlich und komfortabel ist.