2023.08.30;13:11:32;AI Doktor;Willkommen, Sie sprechen jetzt mit einem KI-Arzt. Da ich Teil eines wissenschaftlichen Experiments bin, würde es mich freuen, wenn sie sich am Ende des Gesprächs noch einmal die Zeit nehmen einen super kurzen Fragebogen zu beantworten. Tippen sie auf Sprechen um ihre Frage zu stellen und anschließend auf Senden um mir diese zu übermitteln.
2023.08.30;13:12:13;User;ich habe starke menstruationsschmerzen was soll ich tun
2023.08.30;13:12:16;AI Doktor; Ich verstehe, dass dir deine Menstruationsschmerzen Sorge bereiten. Könntest du mir ein wenig mehr über die Art der Schmerzen erzählen? Sind es stechende oder ziehende Schmerzen? Oder womöglich beides? Gibt es bestimmte Bereiche deines Körpers, die schmerzhaft empfunden werden?
2023.08.30;13:13:00;User;Es sind stechende und ziehende Schmerzen, mit der Brechen und.
2023.08.30;13:13:03;AI Doktor; Ich verstehe, dass du stechende und ziehende Schmerzen mit Brechreiz verspürst. Möglicherweise hast du endometriose oder eine Entzündung des Gebärmutterhalses. Ich empfehle dir, einen Termin bei deinem Frauenarzt zur weiteren Abklärung zu vereinbaren und die passende Behandlung zu bekommen. In der Zwischenzeit kannst du Ibuprofen einnehmen, um die Schmerzen zu lindern. Probiere auch warmes Wasser oder eine warme Heizdecke, um etwas Erleichterung zu verspüren.
2023.08.30;13:13:46;User;hast du tipps für endometriose
2023.08.30;13:13:50;AI Doktor; Ich verstehe, dass du nach Tipps für Endometriose suchst. Es ist wichtig, dass du einen Termin bei deinem Frauenarzt vereinbarst, um die Diagnose zu bestätigen. Es gibt mehrere Behandlungsoptionen. Dazu gehören die Einnahme von Kortikosteroiden und Schmerzmitteln, die Entfernung von Endometriosegewebe sowie Hormontherapie. In manchen Fällen wird auch eine chirurgische Operation empfohlen, um Symptome zu lindern.